,0
0,competition part movie good come predictable part movie competition nothing new felt bakwas type feeling
1,unique movie story weak storyline time watch
2,outstanding web series director deliver another entertain movie time switch light hearted zone mark fifth movie actor filmmaker movie simple little predictable yet enjoyable plot good message story also deal importance sport education gender parity first half well write character smartly write humour second half well executed match although still room tighter edit never disappoints delivers divert performance give charm performance lovable diction look convince competitive teacher film also great ensemble cast young actor delivers terrific performance
3,rest star cast act brilliantly story routine treatment execution ordinary climax weak music standard hence desire impact critical scene lessen great extent film mins less direction extraordinary overall film turn average decent one time watch
4,first half movie nice good second half movie lose charm becomes predictable slow expect much movie may like low standard like bollywood still live fictional world couple find hang beaten black blue go date specially city like jajjar meeting guy girl always end hero case job movie make sense second half like train one month beat world chapions turn nerd professional player within day disappoint dissatisfied previous time wish get back
5,attempt miserable yet reality sport system prevalent country target frivolous nature subject school subtle yet powerful gender inequality still exist society look impressive hype get release set expect sky high something fails live come back blockbuster web series somehow able make excite often might deja predictably script add yet another reason live expectation way bad movie definitely good distance apart wow movie good watch entertainment keep high expectation life brilliant always finally get character orient script show quality real glimpse talent accent beautifully terrific character deserve appreciation background score pleasing decent watch lot gap fill good entertaining min
6,perfact cast superb storyline make movie enjoyable every bit
7,upto mark like idea hold competition woman one blue take random student train already good player newly train one actually win appreciate fact player actually turn table reliable one actually girl team player gender idea boy chase dog guava orchard bad training do
8,nothing new story good dialogue good do phenomenal job infact best thing movie support actor like kaushik sharma do good job also do decent job good family entertainment movie expect anything smiling face smile eye
9,like story tell make chalaang unique primarily direction hansal mehta long time indulge project secondarily rajkumar rao flawless act talent want spend lazy afternoon giggle chalaang good pick diwali
10,movie deal really well attitude people towards sport life protagonist use amazing method convey important message time keep matter light funny aspect like deal romantic family life normal film little predictable twist great watch probably worth time
11,act well story exactly make trailer fair number useless element use lot emotion evoke direction screenplay well entertain nevertheless
12,bore story look movie worth watch
13,full excitement emotion overall worth watch usual acting make skip sec entire movie one fine movie thumb
14,awesome movie great steal whole show make maximum use mother tongue dialect real sure movie hit especially ever visited school seem like real life movie love angle digress movie context nice movie watch
15,waste time filmaker think due corona peoplyat home free time watch anything without apply mind really pathetic movie give movie good rating may belong crew cast movie
16,story good comedy punch overall great act expect much time watch family
17,message good feel execution lack portion good part difficult connect focus romance bit
18,illogical feel like spit every scene bore pile poo
19,best really good movie happy movie keep entertain throughout dull moment phase watch
20,sport life career wise woman give attitude oneself win sweat extra mile among social issue handle story fun appeal way say word
21,want give spoiler say highly recommend movie watch fold hand fire
22,know movie get good review due traction fact recent film platform suck bigtime sadak laxmii bomb comparison one atleast one time watch really average movie
23,good dialogue delivery actor amaze character potrated role nicely good story screen play comparison big budget copy paste movie yet another master piece hansal epic scam watch movie
24,mehta run streak first scam chhalaang perfect blockbuster story underdogs try defeat already champion team story see many time every time look good story chhalaang predictable story lot entertainment hilarious haryanvi accent movie must watch revolves montu teacher small town haryana whose life change computer teacher enters life also get objective life yet another new teacher come school becomes head montu lead small competition keep two simple stoty fully make heart mehta succeed show social issue lightly comic way bollywood movie thus full drama rao natural actor small town guy role like make nusrat decent work apparently get good share screen time prove get good act talent sateesh koushik saurabh shukla zeeshan aayub champ comedy comic timing mark dosen look force supporitng cast pretty good job make movie even watchable occasion diwali movie best treat watch even family perfect family entertainer must see
25,act good see movie much impress act one best actor
26,super good movie release year performance actor actress movie moment feel bore soty panga good sport orient movie also family film come good time director producer
27,order fit character lot overact actor unbearable point time try hard authentic
28,movie enjoy family festival day normal story well direct mehta course like scam hero give fabulous performance ludo movie kill expression others contribute well movie hilarious need good edit song good sport movie also keep vibration entertain
29,stole show act skill well support cast watchable comedy movie much need social message get movie
30,storyline social responsibility entertainer remember dear way
31,bore story look movie worth watch
32,ganjedi bhikari desperately back ganjedi bhikari desperately back ganjedi bhikari desperately back
33,watch completely predictable plot new old drama etc etc watch holywood movie well
34,deliver movie quite simple plot already know watch trailer worth watch show great skill act usp movie perfectly nail character cast also perform excellently half miss cost
35,movie disturb various level teacher prove point organises competition nowhere teach student run casualy throw infront pack hunt dog latter us sound dog win competition spend mins show grit kid excel sport win dog bark aloud speaker thing objectionable teacher serve false court notice parent blackmail parent work whim fancy school make child something parent approve call movie dham dand bhed chanakya really ashamed type interpretation bring best underdog story never give even chip laywer father come call motivational story client fully convinced client lawyer represent actually murderer fight client wring lose cause even though whole village know outcome client try murder lawyer bit grit skill even though know lose cause manage acquit murderer underdog story clap hand
36,light movie good entertainment watch family hanky panky movie simple pleasant watch line simple offend one emotion good message teacher also
37,movie predictable lose first excel second skip beat fist clench win last game amaze parent want kid get think way become someone life perfect way say take road take
38,try prove movie okay work hard entire life live start act stupid real educate sportsguys match village idiot movie total cringe worthy portray exactly wrong euphemism nothing loser portray loser
39,average movie predictable end new concept
40,must unite production kind stupid movie
41,cast especially ajay devgan bad awful act
42,hai hype band karo saree aur rao matlab movie sorry neutral face pagal nahi cheesy dramatic unrealistic movie pretext movie meet type drama dikhao koi glamour achhe visuals hote hai romance anxious face sweat spare horror typical bakwaas movie hai
43,movie wrong many level promotes wrong thing
44,good thing movie rajkumaar else everything copyright make mistake watch movie see rating
45,motivational movie shud good dialogue one none average actor competition rajkumar rao well
46,bad storyline actor still much unrealistic story
47,masala outdated story poor story boring
48,wow moment movie character build well motive competition bogus
49,movie thing good market way become similar role novelty death milk cow last long drain expect like do mediocre work life watch movie make
50,start watch guess start movie money blame sure cringe every time see movie hour life never get back
51,average movie logicless script shukla rajkumar make laugh little worth watch hrs family film watch timepass recommend
52,actor waste top drama message movie specialise physical educate wrong job give village bum cook bad sign slavery waste slot hard earn money food take aways eat clean food home sport name gender equality woman live like man man idiot one
53,movie quite predictable still bind screen sure feel character well connect friendly lesson give life precious excellent work crew great head camera man producer director great shoot show movie
54,average story act surely give miss
55,watch topic good make well easily pas
56,actor like sarubh sukla satish kaushik actor rajkumar rao nushrat zeehsheen good good others department also good
57,give money bollywood use rajkumar karan party
58,mean nothing bad technically story act kind part nothing new story totally predictable nothing else feel meh end shrug end jubilation star tear meh
59,great movie good grow show vulgarity abusive language great movie one learn lot sir train life lesson father spirit teacher love movie improve mindset person every age group
60,movie lack depth plot character film quite predictable
61,laugh much mind blow movie keep engage base village theme good family movie
62,nice funny movie watch good storyline
63,piti kahani overact illogical clumsy screenplay boaring dialogue story turnes movie show work somewhat watchable main lead material
64,twist end typical end story surprise way story end many song film unwanted distraction
65,story much predictable say movie cheap version year movie slightly well
66,movie recommend story bit old type enjoy
67,rest star cast act brilliantly performance good story interesting climax good
68,story line like sport movie team lose magic happen win good message act do well cast
69,really beautiful movie comedy timing song really fascinate story lot
70,first great key actor though definitely underutilized like movie also light hearted family movie fact combine regular chore watch movie worry miss anything star rate first half second first part attempt add humour really make laugh completely passable bad though film completely falter half due unnecessary angle competition two pti teacher completely illogical shake head disbelief see saga past since go game want root team case obviously team feel sympathetic towards method train persuade parent cut ice movie complete letdown well avoid act good give pas treat time pas
71,like carecter do job good specially sir slap see remove girl pinky slap boy young neither girl nore boyes right slap writer remember
72,waste movie expressionless face write pathetic course act rajkumar rao awesome new
73,really hilarious family film humor kind predictable good watch family cast outstanding especially support cast
74,predictable screenplay good thing avoid park sceen hero heroine parent way bring continuity movie feel every school competitive spirit whatever game study good future generation
75,scene filmy derail decent plot enjoyable ride overall good one time family watch
76,family bollywood movie long time family bollywood movie long time
77,praise doubt act brilliantly movie equally well movie
78,old story rag tag kid become sport champ like presence movie definite disaster work get do kid exemplary delight watch despite character require movie like probably palate delight like always mere presence scene give assurance bore whether comedy drama must watch afternoon kind stuff regret
79,satish kaushik excellent job haryanvi accent get dull competition good movie
80,predictable film top humour try hard funny watch odd min well thing
81,movie try make certain social issue stand stand best movie far believe hansal mehta director scam also direct mediocre movie great expectation movie watch along family
82,element surprise whole movie style movie unnecessary song make sense good effort time watch maybe may skip movie well
83,uppercase feel one get watch director utna lowercase one feel watch admit bad like producer movie shallow characterisation roadside humour totally predictable half take one dialogue expression character change outlook probably movie title fantastic leap character take course movie may produce different background score movie sound walk theatre watch home
84,make team audience keep occupied work time
85,movie like go second open even see movie story full lackness delivery whatever script say short bad script bad casting direction
86,point story point support cast acting
87,half brilliant half lack show time watch
88,amazing movie watch family dialect amaze rao best literally adopt role pti actress do well role amaze make movie much well ancillary actor well assume much good
89,movie start well lose track midway female lead terrible little character development old unrealistic drama humorous scene make threadbare storyline believe film
90,dupper movie exxilent work like rajkumaar rao standard work
91,cute feel good movie perfect watch parent family member felt like drag place excellent act cast make feel like character development bit poor wrap nice movie definitely well medium spend time though
92,old story watch thousand movie unique performance actor
93,first movie despise vanilla story line somehow felt irritate something feminine acting style like trap rethink role delivery
94,sport movie year dialogues super act cast member enjoy
95,review significant departure serious cinema director light hearted rom com dash khel kood drama thrown plot especially second half quite predictable still make satisfactory festive weekend watch family keep expectation low cast earnest ever lead role resembles lot able match act skill support cast comprising sincere great bad film well two ott release spoil mood
96,start simple premise irresponsible pti daily routine life twist come find another wel train pti go instruct school kid com situation movie lead support ctors do job perfectly hummable song background score good especially sport sequence sport sequence direct properly little bit dramatic sometimes form right end teach competition take sportingly
97,movie set forth watch really high expectation always sincere actor even carry story movie share write credit know vibrance lively stories fails inspire keep wait something worthwhile happen something inspirational much becomes drag glad six two star one liner quirky laugh first half
98,movie predictable every single point good star cast meet expectation excellent okay story weak old otherwise make great movie also felt unreal sometimes good movie time pas expect great thing
99,good sensless movie story release corona story good acting
100,act good release full potential waste act talent great actor shukla plot strong climax simply predictable force accent irritate sometimes
101,cat act superb storyline direction poor
102,capture motivate drama let get bore throughout movie grin face must watch guy
103,rare story show true sportsman spirit accept opposition well teach self kid learn adapt competitive world
104,bro rajkumar thanks great movie great awesome love
105,good movie really good competitive movie
106,nice good movie watch good massage men woman
107,really entertaining movie love character movie
108,movie movie movie really good awesome watch
109,like together combination give authentic taste cinema recent everything masterpiece one long title unnecessary character teacher realise teacher nothing else mediocre film perform actor like yet pastime nothing extraordinary great felt ordinary best music decent score good game come go fast get drowned accent par film intend provide social message look like forcibl glass milk smooth gulp milkshake watch sake watch nothing else otherwise lagao bed couch nearby sleep
110,movie nice great act movie actor live character
111,movie watch story impressive command watch movie
112,time see full movie awesome super hit movie
113,recomend direction far good direct starring produce
114,show match inspiration toward sport watch happy
115,great show full kabbadi attitude must watch inspired
116,end lose storyline lone shin star treat watch
117,show chhalaang must watch show cantain nice
118,movie also movie comedy drama movie deserve best rating story movie reality movie base result side well student whose never play sport still get winner tag opinion well student winner entertainment movie deserve clap watch mehta do job perfectly
119,movie talented actor one best movie
120,watch movie really interesting specialy dialogue must watch
121,outstanding movie like movie base good story
122,great funny comedy ever experience whole life
123,concept simple story real movie movie camera best motivation family movie
124,predictable thwre nothing enjoy talented cast much expect
125,movie predictable weak term comedy average one time watch
126,really fun movie nice see sport movie dedicate school level
127,potration actually laugh silly jokes time pas
128,lose hope bollywood movie watch good simple story well execute predictable movie climax rather journey producer invest simple nonsense movie oppose regular overhyped bollywood movie
129,act sir adorable haryanavi accent hona theek hai ghatiya hone ghamand hona baat hai half predictable enjoybale good movie
130,real act rkr outsider good acting nepokids
131,day need light hearted peppy movie neatly woven simple movie
132,disaster movie give get rating rao movie fully waste time
133,first half movie funny second half movie inspirational
134,hearted movie fill comedy laughter message deliver movie make winner loser
135,movie sport many ture line movie sport person play sport
136,cast do grt job well assemble support cast uplifed thumb
137,like simplicity story varied emotion hinge storyline time watch
138,confuse directed great whose work also top notch technically brilliant feel time pas blow steam work stupendous kumar rao usual good utilize totally look place proper haryana base movie odd one entire cast average last song totally unnecessary believe let might pretty good story paper spoil director average school child characterization establish properly miss connect climax average time pas movie brilliant artist
139,appear movie screen presence feel like fast forwarding time screen absolutely average rao highlight movie along
140,awesome movie love nice character really nice movie fan love
141,regional language raw act humor yet mix cause make extremely entertaining movie rao keep spirit act show casing cause truly good actor
142,fine entertain movie base sport climax predictable way fabulous treat watch prove superb actor do good job get good dialogue way act looks good opposite do superb work cast decent perfect mixture light hearted comedy love every scene movie perfect watch
143,movie start usual story fact see trailer rather watch story trailer tell story
144,liked movie much contain nice comedy
145,feel act good act one feel like act script performance ever
146,really great movie high low along element humor fun
147,fifth time collaboration breezy entertainer average execution best especially keep mind excellent track record recent time delivers pastime distinctive style craft see several time outing like recent hit critically acclaim inordinately love audience result new project expectation usually sky high exceed confidence one take blame message indeed intent discernible underwhelming execution fail match idea similar level great writing every character surprise small role make impact technically well make competent work behind lens fit soundscore fairness flaws loophole script subdue quality gravitas irrefutable positive effect child laudable never set sport drama naive intention sole focus always underdog story journey ignorant fool sensible first half storyline lose charm begin slow unfortunate descent mediocrity
148,good family movie enjoy even love movie number good reason highlight plot interesting melodramatic moment enjoy age group audience relax interaction actor feel like commercial act cast outstanding entire team complement presence expression escalate mood movie atmosphere movie cozy relatable everyday life minus music course dialogue precise funny appropriate importantly delivery smooth rhe negative vibe negligible absent say enjoy song much background music scene vibrant
149,movie good nice story rajkumar rao act well
150,ott original feature film release time time hear name like point desi flavour tale inspiration sport comparable similar offering fight motivation story draw form real life name suggest movie deal genre sport inspiration hurt ego one man movie set story goof love jump literally midway change story underdog everyone respective favourite sport one heart surely go underdog movie set quintessential town love heros field sport proud want child successful character say parent want support child like idol naukri chhokri boy prepared youth girl study even upto mofussil town break news prepare chula chowka law house support child marry daughter law really big heart thing change ever slowly sport also give career professional set due various league football kabaddi badminton etc apart cricket religion teem billion encouragement support financial aid need hour story courage never say die spirit never give face extreme adversity little hope encouragement box think perseverance come top usp film second half first half dedicate insensitive ambition less instructor whose main job avoid work loaf around passion arouse face challenge job love superior individual story change tale inspiration unique touch make forget start romantic flick splendidly turn around also person helm sensitive social like late offer web series stream liv ott platform besides one definite shift subject whereas past film deal social issue late offering stable mainstream commercial cinema touch definitely still performances expectedly great seasoned actor like noticeable suit guy let either give superlative performance movie look every bit movie character surprise packet come lately try take job love whiskey sip go girl head firmly place perform suitably role look dainty veteran make presence felt dialogue behavior small town character capture subtle finnasse scene like fight vegetable market sport ground one friend eatery tease cook profession kind banter hear place small thing matter second movie many day heroine asks hero daru pilayega equation seem change food think horse male http filmytown com movie chhalaang movie review
151,leap faith take faced adverse condition never give always come next attempt overcome challenge come simple plot set feel good movie make work limited number lead character around story revolves clarity character look credible fairly simple movie flow like breeze good watch miss
152,predictable movie sport theme obvious drama old preaching nazariya badlo nazare badlenge do fab job able get hold accent entire movie seem struggle get hold accent effort evident commendable support cast amazing pro actor hardly ever wrong matter role mum character many scene typical mother impeccable performance quite underutilized talent good actor significant role totally miss second half humor average though scenes dog bark finale facepalm moment hope get see inspiring movie without continuous preach need deliver subtle way reach heart movie cliche far awesome
153,movie good watch story good learn professional behavior even lose
154,come watch movie feel embarrass see people rate average movie watcher mind brainwash pay money waste time see trash movie spout nepotism industry message movie subtle rkr movie unfortunately fly right past average viewer evident rating review movie cheesy unrealistic predictable serious grave movie social message many watch movie touch many social issue light hearted manner almost escape part moral police begin later subtle manner showcased wrong movie important many hidden dialogue cliche rag tag team make something alllll movie far original entertainer happy see none brain dead movie produce act rather watch anyday even average story
155,story maybe come type story line give time use real life forget maybe deep breath ready take big rao helpful student long break school college life boost ss ss answer see movie
156,thing first movie storyline kind movie release theater well nation watch mostly sensitive part nation thing wrong girl sport love storyline familywalimovie short timeline however story message clear way love movie
157,idea people rat highly fun watch absolutely brilliant performance enjoy change school set real refresh like soty school kid relatable fact school different school show movie brilliand also do great job highly recommend movie
158,actor actress perform role well story average dialouges good movie watch
159,film set rural town central theme grow semi urban school identify rustic charm around school sport event
