,0
160,avoid story line non existent act way overdone much comedy either unless stupid thing
161,story worth waste precious hour typical bollywood story without logic bear watch without continuous forwarding
162,like movie rajkumar rao actor fabulous act every movie movie also best many month like movie
163,tolerable annoy even put decent comparison level act actor poor story slow tempo average direction uninteresting depiction overall watching movie feel waste time make sake released time hope people watch anything day
164,expect script much great depth combo bring surprisingly light hearted watch disappoints predictable almost cliched storyline movie try win important message fail deliver conviction whatsoever impress either acting performance
165,movie travel ignorance knowledge nothing everything motivational movie give hop lose people also teach tackle difficult situation life
166,movie watch family obscenity gaali movie need heroine like ketchup pizza miss question stand tall stool whole movie dark circle video edit exist movie
167,new excite movie see plots numerous time save grace flawless performace entire star cast movie make feel good time pas factor time watch
168,cast movie act punch time great movie little predictable watch movie entertainment guarantee never get bore many moment true laughter brilliant always
169,plot usual expect line crisp direction edit movie keep audience captivate glue movie excellent actor find fresh face overshadow many time family story nicely word message conclusion slight non family promo song end must watch
170,one favourite actor mine movie help show talent capable even star
171,potential script direction weak act round intense
172,prove wrong produce good movie anymore movie enjoy entire family must watch
173,drink together along girlfriend rural village sense direction scene every evening practing scotch along parent movie fit exactly behuda harqat karna baat hai behuda harqat proud alag level hai think make scene direction
174,movie story amazing nice give life overall movie
175,story bad act even like name film want give star
176,fun excellent dialogue simple story weave beautiful screenplay memeber cast contribute fun journey
177,novelty script screenplay try pull last min fail
178,first half movie good half movie feel
179,get engross progress research script good direction philosophy match till last ball bowl movie worth watch show calibre connect well make movie double thumb
180,typical bollywood masala movie worthy time let film lower benchmark set
181,similar movie already make topic performance wise brilliant
182,movie climax predictable look pretty light comedy perfect family type movie always good
183,realistic rather repeat old story predictable every one know happy end
184,every second film amaze act one
185,want weekend bad movie ever watch
186,good movie favourite movie thanks make movie
187,good movie thanks movie watch movie favourite
188,movie great message brilliant performance best movie watch family smile always brilliant performance cast also brilliant good watch
189,good comedy film nice sense humour rao act barucha owesome also playeda good role love movie
190,though second part little predictable even movie full emotion like watch ahead
191,prove ability actor one serious comedy like
192,movie certain point improvement like situation realistic second half competition part little short less predictable overall movie great treat eye nice end also superb performance everyone include kid
193,good first half second half mostly base competition need describe team already aware start know win worth try win message want convey stream like sport
194,rao saurabh sir do great job barucha good hold role justify character really involvement trainning session give watch something new must watch give try expect much
195,movie good comedy sences social message specially second half really enjoy entertainment
196,feel teach time pas specifically good study also skill
197,really motivational good watch generation rao best
198,know happen last kind film watch know happen fun film watch comedy maybe good movie also sport become good movie movie engage mainly half sport technique execute well movie full good actor everyone act well also teach sport important part childhood last like also leave smile face
199,predictable sport movie need film feel deserve good role movie pyaar great movie movie good entertainer well
200,hilarious comedy lot subtle joke make excite story new act movie sincere great job need movie rkr next super star
201,movie family watch time well ludo
202,good movie really happy movie thanks provide movie
203,good movie watch family enjoy best part talented actor sure future srk
204,set improper example young generation deter think process strive anything good great life good either inspirational
205,block blaster movie act ever rajkumar good acter
206,movie standard big waste money time tooo bore ugly characterization plot
207,collaboration force reckon give great film like fifth collaboration mark follow teacher lazy job day senior teacher arrive clash lead sport competition decide get keep job really like previous work together time decide something mainstream accessible end product one ordinary unoriginal film year film terribly bad per nothing special memorable like previous film feel like film movie feel grounded reality event take place film feel realistic sport competition something see countless time riddle clichés expect excite new predictable film well authenticity accent location help make state feel real act pretty good great usual great scene drink night way delivers dialogue really well do well felt strange see character wear high heel throughout movie provide couple laugh pretty good well predictable forgettable new creative do kind story nothing stand particular another basic sport drama
208,drama else new promise watch money make industry else ghisa pita kahani slight twist lose talent decade
209,usual old predictable plot performance praiseworthy
210,movie start well keep engross suddenly go downwards look post teacher try convince parent lame competition scene look jaded movie show much promise lose steam midway remote nearby use skip second half torture
211,total family entertainer smile face heart eye total diwali gift ott film release worth watch thumb
212,bit overdramatic overall good movie act
213,half movie ish second half utterly boring waste time movie
214,half superb second half stretch feel connection character show story seem shaky get point movie star everyone act
215,strory simple interesting good humour part film watch amd enjoy whole family nothing new still screenplay much interesting keep seat till film get revolve mostly around teacher played life change sport drama film compare chhichhore still film unique way performance soul film give powerful performance prove act skill deserve recognisation make laugh whenever come look damn pretty support cast especially child do great job direction good yet present good movie section society strong message decent personally like karda teri choriyaan song predict easily wil happen next part movie also sport drama present good way flaw let aside overall film deserve watch family level sir
216,many scene say appear cinematic movie awesome extra cinematic part like always great act skill extra ordinary either movie everywhere movie actos awesome mind blow play character smoothly ease support cast next level say
217,rural story protagonist play happy lucky person movie revolve around win show worth effort waste time money bag avoidable
218,rao dil hain aur kitna bar jitoge love movie great act rajkumar rao act remind stree movie movie convey great message
219,jgah iska naam oot patang hona chahye tha old story sport base movie new name poorly execute
220,movie rajkumar rao good pti character hand
221,whole script superb important thing movie give important message fight till movie cast act well
222,much violence film also make film look realistic raw
223,life rural area well depict make one feel home unaware fact reveal
224,scene well perform portrayed look film brings authenticity
225,work outstanding get best entire cast
226,main two lead actor contribute equally make film success
227,intense atmosphere flim something keep watch film
228,film quite realistic raw great credit give director
229,suit role well justice love natural look
230,look body language dialogue delivery screen play everything perfection young actor
231,main lead rao good find do good job mass role impress throughout
232,music good making audience involve narration excellence
233,start make wonder story bury breathtaking mystery amazes
234,movie various version boldness depict delivered ease
235,character tale seem super important great twist buy everyone
236,background music almost make one belive character real
237,nice new come see rajkumar rao great always costars like saurabh shukla satish kaushik nushrat bharucha also give best
238,seem film promise adventure viewer crime thriller concept really good
239,scene movie leave great impact leave think long movie
240,product new packet sometimes need era bollywood push propoganda movie name creativity one good feel good motivating movie bound break stereotype act satish kaushik sourabh shukla jee new storyline good funny liner accent good clean movie
241,scene movie leave great impact leave think long movie
242,watch something really nice long time take eye minute cheap comedy insult religion cheap trick publicity controversy story top class act perfect message student parent review imdb movie deserves praise super hit
243,story surface seem bit hard believe quite indulging get
244,good pack anger drama love hate give goosebump
245,think power real cinema hit emotion
246,tale two lover rather lovy dovy one ride emotional roller coaster
247,movie take back time old golden village sort people live around
248,happy see great bunch actor like play great secondary cast
249,set background environment everything contribute make movie realistic
250,happy see great bunch actor like play great secondary cast
251,happy see great bunch actor like play great secondary cast
252,come rao rock film act skill point
253,omg since watch trailer eagerly wait one finally watch
254,prefer watch film love drama action crime thriller base film one
255,think watch film share support amazingly talented actor
256,become matured watch interest high level film job
257,watch film much fun watch get goosebumps end
258,become matured watch interest high level film job
259,film turn emotional roller coaster ride scene seem amazing
260,storyline film point even less perfect job team
261,think movie drive million crazy creative innovative concept
262,find film quite interest everything perfect viewer expect
263,movie raw macabre look hold strong plotline
264,storyline film point even less perfect
265,excite share film friend watch together interest
266,film whole different perspective think intensive authentic enough watch
267,film rare gem think definitely recommend everyone watch
268,best thing like movie dirt movie abusive language sex embarrass idiotic scene dialogue movie soothe portrayal importance sport sportsmanship able stop say really good movie
269,many mistake unconvincing character development hardcore traditionalist make total turn one meeting girl flaw love story anyone fall love quickly someone publicly insult parent get job easy one organize interschool sport meet winner get appoint easy safe way get athlete motivate intentionally let get chased dog hero father threaten student parent let play tournament teacher even right ethically one time watch masala feel good movie use brain much
270,movie good act good message give rajkumaar rao zeeshan superb
271,do amaze act star entertainment family nice script screenplay well do
272,thing mention movie definitely delivers even performance everyone incredible funny journey character fight nvr give make super amaze know win loos recommend watch majority people love
273,simple movie delivers powerful message entertaining way talk important issue convey message delightful way without preach keep hook till end bore moment write direction see write something beautiful instead usual com movie like punchnama titu sweety capable write good female role different genre ace social comedy top notch everyone include kid one best actor generation prove one help root goofy teacher whatever muse amaze job natural actor deserves good role like share amaze chemistry delightful watch two self make actor good movie cast top notch single bad casting lot thing movie undoubtedly kid do superb job every one balance girl boys character stand personally girl little storyline perfect family entertainer give message teacher student importantly parent
274,say long time masterpiece story line nice message society nice song overall full package
275,comedy movie strong message great cast write comedy timing actor
276,best bollywood movie mean great storyline enjoyable movie must watch sure
277,long time laugh much watch bollywood movie act every cast member
278,diwali gift form team form even think watch diwali surely destroy festive mood
279,never quit anything fight till death
280,best movie nudity abuse language use
281,hilarious comedy movie surely must watch start end stop laugh
282,constitute one cinema potent artistic collaboration film blister probe portrait state world attempt something mainstream tell uplift story teacher small town find purpose life coach weak kid school win team suspect conventional narrative go dna tear hair awful ordinary read full article film companion
283,good watch cut one scene later film think scene unnecessarly drag easily chop good watch strong act good command dielect
284,fabulous combination fun inspiration entertainment capability always remind powerful story stalwart performance cast always quintessence shout indelible performance every movie must watch
285,enjoy watch movie family smile face heart eye song movie also good
286,love watch movie entertain movie actor act nicely
287,best sport movie dare change mind
288,must watch movie film track family entertain movie smile face heart eye
289,useful service user best service nic
290,movie must watch movie love watch story base nice theme till end make feel little bore really enjoy smile face heart eye
291,time waste wait eagerly movie turn disaster decade idea director try achieve storyline expect
292,poor accent way use dialogue also poor see wed like movie nowhere stand nearm
293,act actor avg shocked see ask pilaoge every minute liquor scene father serve drinkliquor friend drink serve liquor
294,movie time good song humour punch line suspense
295,movie promote creepy stalk felt cringe guy
296,lucky release high expectation trailer clearly say nothing new old traditional bollywood stuff fall love heroine third guy enters emerge story hero feel jealous challenge defeat close match predictable typical formula far outdated today time sport issue deal manage deal issue different argument altogether yes outdated predictable manner may formulatic drama wrong make watchlist definitely watch diwali story lazy ambitionless coach aka fall love computer teacher first introduction spoil dreams try convince apology local heroic trick guy enters emerge love story decides take coach make small challenge look like national war know win end never ever look like try something new even bother put new technique love story bother something screenplay look rough right first frame till last one somehow manages make average flick help performance postive outcome brilliant actor see take tough challenge character lightweighted accord standard deserve well tougher roles suit potential ordinary look gorgeous handle local accent beautifully also get underwhelming role play like easy daily life course walk sleep cast fine remain unnoticed weak writing stand chance come good film falter paper write directorial effort make look even weak execution almost every aspect kill potential decent story somehow save far film make audience keep say old school book need think box least try something new get nothing new offer still average watchable flick nothing else watch people show much interest see another frivolous short jump make filmmaker hence might come something new next time hard believe creative mind like come something like one expect something innovative hard hitting rating
297,support movie call druggystars anymore like feel respect also
298,story line teacher least interested perform duty show hero movie turn fortune within month good coach show loser portrayed negatively inspiration one draw pathetic movie illogical movie frank
299,good due pathetic acting may say overact actor zeeshan movie become pathetic watch something else
300,fabulous extraordinary performance rao beautiful dear sir love sir sir nicee performance dialogue screenplay good
301,base nice subject seem rise expectation stereotypical story film contain anything new try hold audience attention throughout film even good act performance deny fact avg storyline fairly average job one keep eye away actor one really try keep film humour go stand high term act film perform well first half total romance buildup second half seem quite fast lot thing happen important part end seem know come make film average one time watch
302,average script kumar use put creativity really think well script
303,narrative play much well like great sport film rao usual good also rest dramatic even storyline many point felt copied many sport film
304,movie superb actor deliver always pleasure watch good actor one frame kid surprise element act equally well moment make laugh smile act direction movie let predictable weak storyline still big let film effort put script story
305,movie launch date laxmmi movie watch movie want tell one thing kumar time come pack bag make room talented actor actor director chhalang
306,steal show word take proceeding forward well support cast perfect special mention expression enough time movie proceeds well till reach finale sport sequence right easy succeed keep audience interested director fail match thrill enough even climax big let especially since movie keep engage mention background score cinematography time pas movie last minute movie quite entertaining
307,romantic heart love love movie two time like first time love second time
