,0
1007,mention refresh take actually miss point negative review take exist change context change core character embed theme come back imagine updating time period set true story modern car suggest imagined black farm boy magic power consider inaccurate much like set world set character act specific way mean create female centric version use name original writer estate currently sue film misrepresent core character write writer piggy back know brand lazy generation
1008,good half bad pause film least time interested enough least know family contain smart people brain behind thought little smart excpect mean year old maybe critical grown ups
1009,lead charm engage story nicely pace odd twist unsubtle message rather like force eat bowl gruel lovely roast dinner worth sort obvious top feminism woman favour crude message good
1010,nice world nicely play character part good
1011,delightful movie overly sappy keep thoroughly entertain throughout detective strong look like introduction character much come yet unsolved seem like answer possible future movie hope actual detectiving improve actor splendid storyline fun nice balance many movie feminist twist overly go theme need man see girl logical deductive also follow heart strong character choose give message path make choice want one hell message opinion enjoy much wait next installment
1012,lot troll website good little film fast paced twist turn thought well do worth watch
1013,put high expectation believe family friendly films much super mysterious event however entertain
1014,franchise little less virtue signaling lot sluething next time well make great sherlock
1015,become ridiculous century race seem exist perfect harmony constantly tell world need change know history lesson teach idea many black nobleman asian duchesses back learn simple movie main character call really call expert virtually everything put mind thanks private lesson mother taught weakness note detective skill seem well brother overpower men twice size ease even see audience watch home like talk camera lot may find smart alecky aside fun right word insufferable befriends boy whose main interest herbology flower arrange radical turn standard cliche gasp constantly save life guess make girl tough one guy sensitive type creator think clever maybe say constantly bash head allege wisdom transport modern day think century past word get one painful speech another deliver one dimensional cardboard cut character role woman society tiresome tirade use bear child sexist brother long lecture tell men pig worth talk shrill radical feminist time film feel like exercise wokeness adventure movie miss sit back enjoy light hearted romp instead bombard political messaging must much art turn extend sermon nowadays case lack wit sparkle ever anything less average ride street capital bike cycle flaw start worry though end fully perfect main thought kind glad see back precocious twit inevitable sequel
1016,movie start promise try many thing plot complicate stop watch actually want know even end get watch remain minute extremely bore
1017,actually see perform act actual dialogue unlike dreadful part stranger thing perspective great one bleh nothing interesting easy see perpetrator
1018,cast terrible plot anything story great keep talk camera camera talk get rid concept maybe try fun scene work well together hence
1019,imagine thriller story unfolding every couple minute someone shout feminism loudly annoyingly approve concept find self root bad guy end shout
1020,crazy movie act theaim character modern set film try make many thing happen crazy dull honest
1021,cinematography act point well do feminism annoy overlook everything else film fine film television producer understand make male clown build female one say like beat dead horse already think whether love male child thing stream movie purchase rental actor think fantastic writing issue
1022,read mixed review decide give chance bottom line even finish movie whole movie interest enough packed ton cliche shalow dialog good sherlock way adult recommend watch movie
1023,definitely budget issue sometimes feel try tok much facial expression cgi quite good cut arrangement scene horrible awful do amateur understand movie die step production
1024,adaptation poorly write graphic novel feminism message think essential story performance show act range expect movie disappointed much story fail capture even elementary aspect fan fiction anything else
1025,premise movie intrigue edgy female character ahead time related already well know like famous detective problem nothing set apart make original even mystery seem predictable fun part fine enough job rest cast problem remain end movie feel gain anything ever watch
1026,well lose bearing half way mark avoid small second fiddle role stuff
1027,countless version story include recently lead series reboot two movie series book call put unique twist old tale couple way firstly young sister protagonist take backseat along old brother movie exclusive mainly due covid direct stream distribution method indicate popular convenient streaming service become set find miss mother soon become entangled young plot surround historic vote prove strong will mother mainly appear bite sized flashback teach fight independent use brain rather proper lady find well husband bear child also capable blend environment dress like proper lady common newspaper boy refresh twist classic tale afraid break fourth wall either directly address camera provide relevant backstory pose question viewer like real detective also impressive visuals mix show tell narrative device think see every story surprise fresh take
1028,young adult novel series borrows canon use newly invent character year old girl era central protagonist give female teenage reader new literary heroine film adaptation work merit similar vein last year revisionist feminist adaptation literary classic teenager fan take digest characterization new addition ongoing canon onscreen interpretation rewrite support new female character mythology mythic element downplayed purist may big lump swallow ahead may sit well normal well adjust onscreen incarnation obsessiveness craziness cursedness within mind self invent profession seem like normal everyday work man career path relatively physique never seem like starves case close one scene go speak hide tree lay back tree like young romantic lead novel try talk upset girl climb back immediately think never lay tree like tenderly matter function story meant another version legendary actually big brother figure symbolic representation someone free pursue want society time intellect set something surpass whose characterization also accurate literary origin representation conform tradition make antagonist charm relish lead part jujitsu archery receive homeschool education time something probably woman access real life live thing great job take audience character strong early part film nimble witted thing country home speak directly camera bring wistful frenetic youthful energy latter part film start sag flipflopping subplots mystery solve fairly simple predictable story predominantly concern make revisionist feminist commentary set intricate mystery audience truly sink teeth exactly female end felt like urban swashbuckler get adventure film feel never invest potential love story film tease actually commentary convention always need include love story every movie film seem allergic prospect female protagonist fall love boy entirely nullify film premise make solely dependent male béau case writer help another girl feeling repress woman society broad term perhaps nurse want chance certify doctor name reason instead film really need mother play seem like actual dialogue film want cute charm romp play best young adult age group think cool heroine fourth wall break cool edgy college take literature class find good idol read good fourth wall breaking later line primary middle school girl watch feel empower do job becomes franchise mystery fan personally want intricately craft mystery plot personal taste much prefer give spinoff bbc know young sibling super intelligent borderline murderous find miss mother within prison supervise minute
1029,cast well act well shot etc usual compliment problem fact spoiler warn mother heavily imply engaging act terrorism write film condemn normally associate terrorism religious extremism fbi actually defines briefly use violence achieve political social objective true whether objective jihad woman suffrage warehouse full actual bomb directly link film response make noise wish heard exact quote final scene film admit daughter find elegant solution get reform bill pass way admits clear evil chosen methodology
1030,expect much condusing mess mother finally show explanation add absolutely nothing brother hehavior make almost sense run mission plan dumb mess time believe teen ager era find interest wish bother fan please entertain
1031,costume set setting etc look fantastic kid movie invest historical accuracy overlook long story dialogue etc good mean hey imagination one time meant watch actor stage paint backdrop imagine castle field really story act else merely fluff get wrong love eye candy lot movie look forward good mindless adventure brother mainly background character invest much two character want follow girl adventure onset learn raise single mother widow never work reveal later live financial support one two brother abandon portray strong independent woman raise daughter train raise weapon hand hand combat world knowledge etc end sorry first two minute already hint anything want even dress men outside estate think play societal expectation make outsider normal society might make interesting interaction outside world instead make lay foundation something else turn mother secret government agent spy nothing interest turn mother terrorist plot something require multiple bombs want change world speculate world need change reply talk say specifically already saw bundle flyer look camera sly smile say yeah reveal much foolish bumbling stupid inept male character fall right place remark female clothing prison finish school well put prison within prison gendered remark inference roll eye ball roll get large large go mother suffragette course police look likely responsible bombing may may kill people hero movie try rewrite history careful say much outright blatant inference allow vote leave aristocracy men vote property owner men woman serve armed force allow vote survive extend men woman men obligate fight die country exchange vote right woman obligate fight die country vote right extend woman occupy premise certain yearly value woman well woman able vote ten year men able vote men vote allow woman able vote without obligation responsibility country unlike men exchange right vote day men really woman hat misogynist woman really right freedom etc slave men woman never get right vote right fiction many blatant hypocritical notion evident movie fact men responsible woman single man much frown upon difficult find employment single man man future man basically worthless importantly man support woman support country every single man woman support real pressure men single man also find difficult gain entry university woman commit crime husband responsible responsible debt tax even divorce still responsible elder brother legally responsible mother sister never work support financially year mother work work government employee job move away city work turn support mother also feel comfortable take someone hard earn money give nothing return sad year old young impressionable teenager indoctrinate believe spread misinformation past audience many also young impressionable kid might believe see movie hold truth
1032,really good part movie else really make much sense hour kinda start think almost like movie tho play part perfectly
1033,score average film think much watch find anything else
1034,movie amaze story good actor amaze wait sequel
1035,watched whole movie find adult movie stop watch kid entertain
1036,movie complete mess plot line really expect whole feminism feminist movie lover tire light family movie wast two hour head enjoy
1037,good actress character annoy bit top enough screen time
1038,put title name excpect mystery good dedective observes every little detail make fast accurate conclusion movie happend time actually without investigate impressive clue really look forward movie idea woman dedective fascinated femisists ideas way kind movie kind bore even movie focus much conclusion moment explain everything viewer thing secret idea thing observe even notice owwwww brilliant movie feel way even one time say movie want kind plot use name holmes title talk young lady well educate smart sister watch movie young dedective find one
1039,high hope film read info really saw trailer reason think go series realize film start still begin eager finish thinking go great nothing comparable version see feminist actually intrigue see go storyline come place bad capture component deduction type female detective every chance make way hello sister suppose smart witty mother teach focus much physical fight rather intelligence solve mystery character ridiculous make cringe believe chose lie dumb way add level normal detective pretty sure chose handsome really contradictory towards feminist way big complaint end result entire time look mother right fact trailer main plot movie besides boy randomly meet fell love within second yet never solve mystery mother mother appear somehow knowing random hotel room find find mother disappointing film much potential main character well support role include yet complete failure level potential think feminist line bad fact think awesome creative framework put great film like keep say disappointed
1040,become painfully obvious early film target audience age range possibly also gender range less approached open mind someone read book also see far many man bash reboots late absolutely charm always thus far burgeon career convey sassy resolute character aplomb old folk play part competently even look raise rebuff ire die hard fan atic pretty glad write character lesbian transgender velociraptor current trend think enough strong young girl try figure time escape shadow big brother hopefully future installment possible franchise concentrate develop deductive skill give challenging case solve flesh character arc sell genocidal gender crusade expect watch space wary eye installment
1041,young sister live countryside life mother learn manner unconventional skill science eve birthday disappears set adventure find pick runaway evade old brother attempt send board school base eponymous series book chronicle heroine adventure gear toward audience read series speak towards faithfulness adaptation movie respectable start clearly intend franchise anchor solid performance absolute delight play brings intellectual prowess one expect teen sleuth relate endearingly timeless detective also give role sense humor energy help bring character life movie also give solid direction veteran director kill keep film move sense forward momentum manages maintain audience engagement support cast also quite good essentially glorify cameo embodies character well nice character base moment brings level sweetness humanity usually see also quite good play runaway find tangle complication lead repeatedly cross path throughout movie first major role minor role film like deleted scene show charismatic appeal actor hope see despite relatively solid movie still drawbacks case embark upon feel especially engage essentially two case movie disappearance try kill case tenuously related degree first case basically drop favor pursue second one later film make film feel somewhat less like full story big issue case involve unfortunately case overly easy solve much way intrigue relate either entertain mystery adventure gear towards family audience film feature good performance across board well strong direction first time feature director story unfortunately engage one expect feature carry iconic name drawback lighthearted sense fun adventure prove entertain target audience
1042,undeniably messy end likely leave lot people somewhat disappointed majority spin enjoyable adventure relatively unique style central mystery complex involve find theme definitely do piece move fairly quick pace bolster solid performance entire cast constant camera narration actually work rather well cement thing distinct style storybook feel sometimes bit violent good raise bar entry little high also tonally inconsistent overall typically fair bit fun underway issue entertain family film heavy hand important theme female empowerment
1043,run away guardianship old brother search miss mother film lot go favour lead performance star great cinematography fun graphic strong theme female empowerment run one forty year old male movie aim enjoy happy daughter strong female character see compare one generation grow watching find story bit long wind addressed camera felt bit gimmicky often difficult mix plot exposition character beginning one mix two mystery origin detail two hour run time number scene bring momentum halt break forth wall film buff like say think work well dialogue funny personally think work something different viewer see type thing think story need felt watch vibe film feel jujitsu funky graphic action sequence suspect something studio executive demand day order maximise profit bad thing case enjoyment movie might prompt people explore novel even original book say appear movie portray good look muscular star superhero genre give character sensitive side clearly another marketing decision find entertain probably one rewatch
1044,ideal child nice light plot nothing special overall entertaining actor good
1045,immediately likeable break wall describe explain situation come across teenage thing cute relationship mother charm adorable seem relatable mother disappear thing start wrong brother turn absolutely insufferable absolutely useless far smarter faster capable many area flat murder someone screen useless big misstep stand background help indirectly step save life bloom
1046,think well cast excellent job couple key plot point well explain typical story past well act enjoyable movie hardly wake man feminist leaning bother quite enjoy aspect film reason woman ever keep direct whatever want
1047,clear bright future short term assume drug next year excellent actress age also good producer film quite awful hit feminist note require may even win normal person film likely boring except performance attempt capitalize name make diehard diatribe essence suppose sort film veneer cover obvious propaganda make lot money hope grow understand late
1048,new interest adaptation world involve sister shine film show act chop take good role act talent surprise point fun watch prop make cheesy romance ruin film excitement originality lack well told story hold together premise admirable historic bit much go also look mother randomly leave rationale quite hold end big reveal plot end somewhat anticlimactic uninspired see story good cast originality hop killer story take next level nicely weave together bit messy still enjoyable
1049,movie fun watch bore lot clever idea part enjoy immense fan review base point view claim best one bad movie big huge space improvement storyline potential especially far mother daughter bond concern find part totally unnecessary others clever well expressed political aspect film reach much depth many way young girl bring promising fighter war woman society art tomboy manner enough express exception probably well saw actually interact powerful old men contrast even distinguishable case uncle scene adequate hire murderer serve political meaning relationship brother rather exaggerate boring mention write bored way purposelessly distant strict absolutely uninvolved end seem really thoughtful mixed baffle understand movie try focus men pressure woman clear exaggerated part create point making reason repress enter board school brother kind contradict senseless opinion masterpiece background forever thankful take advantage follower majority one watch film probably wait meet mystery portray brother genius way solve plot really poor field extraordinary role hardly use inherited talent feature priority character young lady love affair rationally create provokes interest anyone receive chance turn roles prince save girl stereotype also turn stereotype say find really unnecessary scene boy shot dead waste time dignity backstory moreover slightly mention keep mystery sign bore write plot twist murder attempt twist kill reason assume earlier difference family member behind big deal end duration absolutely indifferent recognize need writer girl end man support end chance prove indifference wrong mum daughter bond problem start fact mum know chance daughter pressure form brother mean know son move since take sister custody stupid move mother whole plot base move intrigue get back together also pretty awkward watch since see together present quite distant persuade mother motif one mention apologized cast really badly match role unfortunately misuse one talented actress time give poorly write role amaze role nothing adore interpretation seem like know heck guy play play quite decently even well act quality bad many scene understand whose fault whole idea third child really interesting smart attempt go wrong strongly believe main cause failure much promising background storyline hard feeling sorry possible syntax expression mistake second language
1050,deep exquisite still bad place bad hat portrayal detail polish little education show etc
1051,truly wonderful cast bring life fun adventure pepper humor feminism subtle nod feminism repeat jabs face mind world equally accessible everyone fight feminism fight thought work well female lead girl come age wields intelligence thumb nose world chauvinist convention like feel preach yet enjoy light hearted tell enough shrug angry wake message brim underneath every scene like crowd march nasty woman pink hat scream audience film spoiler end brilliant enlighten mother use power deduction logic conclude reasonable course action domestic terrorism bomb world progress slowly woman right blowing convened vote course bring desire change want kill great message genius matriarch goodness pure daughter manage effect zero loss life well one guy killer repulsive subplot thread find movie enjoyable entertaining
1052,girl dress boy run home meet boy also run home loses boy dress girl find mom also run home lose interest find mom decides find boy minute sister duh start run away whoever try find jujitsu year back black female run cafes period movie one gigantic mess insomnia sleep like twice view eventually finish movie brown movie crap stay away
1053,bore many ocassions scene totally unreal yes get detective damn remember detail ocassion enter mom room even remember location point map stop search mom save kid know like two day feel pity save sheep little kid patetic abuse forth wall know watch explorer movie garbage
1054,seem apparent feminist message film get past reference find quite competent engage young actress oppose usual role quite subdue contrast production costume design good storyline seem little detached character involve much background film wish connection share surname familiar book series film probably young adult end also seem pretty open end inevitably lead sequel
1055,lot people imdb go movie expect hop another dark gritty movie dark twist assault reality truth human condition people miss point movie sixteen year old intelligent empower young girl develop shelter life many complex character include men men movie represent general perception woman day whereas men show different perspective feel aggressively feminist suffragette movement underlie notion movie fit perfectly character fun way interacted audience camera great convention many movie use course side every film nature subjective art instance historically inaccurate aspect position treatment poc movie progress change world need include people part revolution include poc get backlash enjoy story inclusion poc still know reality time fictional movie watch complete write find drawn movie write act excellent story line good target audience list cast do justice personally love see turn series solve decipher problem
1056,seem polarised view like like ask question like historical drama adapt masculine story pitch particularly teenage female family audience easy task topical theme around inequality patriarchy racism sexism make good stab introduce theme fun entertain way without minimise trivalizing turn teenage audience say well do fun female protagonist remain excellent teenage role model like ask social political theme rest easy want something serious classical teenage girl much need feminine hero
1057,clearly establish know nothing personal upkeep break scene go gardener boy debutante forth wall inconsistent bad watchable support cast
1058,story time predictable feminist focus story
1059,male actor play dumb male character smart female main actress appeal pretty actress try hard play smart wannabe genius try copy male genius creation bother childish
1060,act almost everyone specially young lead love interest whole thing actor talk camera explain think overdone funny complicate plot fun sense approachable try several time complicate calculus class even know make sense cgi do without cgi basically throw random movie make idea movie somehow empower woman cause female lead case well weak reason original thought get anything end
