,0
0,movie wish solve mystery surprising audience teenage girl find charm funny wonderfully act aesthetically please sweet grown man criticize make make yro girl fifteen year old girl love
1,absolutely wonderful quirky charm absolutely love unless fan quickly loose charm basically change every character completely fit story render unrecognisable make young teen girl love also add one bad ever see genuinely like actor case think terribly miscast love love care great time
2,sort try many thing think go puzzle brain lot base thing set commentary oppression class privilege difference thrown alright sometimes annoy little love story throw kind unnecessary get weave story message bite hit miss good well acted execution need work
3,premise interest set good actor terrible write plot place main character verge perfect bore character male character belittle order elevate female one write well instead lazy way happen way make sense reason plot demand know historical drama suspend disbelief bit artistic license historical inaccuracy go glare remove viewer story entirely make much bad stick modern act character society act place wrong theme feminism poor write shove theme face every minute theme speak action character tell face look camera
4,reviewer state thing like female class unheard ruin period film wrong class male female child hold trained master run dojo go back ran club quite story worth rabbit hole dive
5,excellent extraordinary great story heart warm mystery much wait see spin
6,see many people dislike film historical inaccuracy feminist idea must respectfully say much respect opinion miss point film entirely intend masterpiece cetera cetera leave powerful message million question suppose fun family action mystery people age enjoy hint familiar character iconic detective film succeed aim fun film watch others unwind long day forget life film along great story stellar cast lead always spectacular exactly world need moment time aforementioned cast brilliantly roles pull character excellently manage perfect blend regular teenage girl create fantastic original character exceedingly good point rather humorous role brother bring usual brilliance table role film fantastic managing entertain whilst work underlie subplot message woman right highly suggest watch film argument persuade let ask cinema entertain
7,thoroughly enjoy film preconceive notion movie toss start glad flaw year old child turn century refresh showcase time make error opinion make mention hotel open everybody good job wall nice touch well
8,agree one people post often view film either think want poster point film well do family entertainment adventure young woman set find miss mother sister appear form feel register much real star mother play make good cast film wonderful production value wonder plan future adventure film really teenaged woman lot fun emphasis creative imagination girl power may tune connection really sister family keep grow
9,enjoy movie someone center politically sometimes think woke culture push much movie opinion movie person love act problem accept story
10,much mystery solve young come across like junior level intelligent highly trained yet puzzle unfamiliar unfair world men movie less intriguing high level mystery whatsoever seem whole rather scatter bit piece make kind dull cast weak storyline suspense mystery drowns disappointment
11,fictional story name set narrative device relevant character expand perception intelligent person behaves speak look unfeeling sociopath hook cocaine certainly case real world identifier genius person like film hit head feminist message normally do well time part character develop concept develop narrative reason get heat enjoy solid release personally love sequel
12,must watch different movie viewer well point movie cute movie become really good actress movie movie fictional little sister think well act even love speak audience good touch much worth see enjoyed
13,get poor review find delightful film really aim young audience disconnect find charm cast excellent
14,good movie act alright everything lead towards end bit disappointing
15,enough wonder manage play role many impersonate manage brilliantly
16,nowadays find film everyone family watch together happily one film character good story action lovely landscape enjoyable film
17,really fun film perfect family movie night fantastic actress really impressed produce film look forward next one plot good character likable message strong mystery engage recommend
18,hard alternative period piece ultimately end detracts actual movie
19,fun film keep toe funny moment well frustrate moment interested line actor actress
20,character point point magically without weight character unrealistic sound like cheap reskin try plot basically non existent thing happen sake happen understand sexist time shoehorn message numbing
21,knew get big review bomb feminism element movie anyone give star beyond enjoyable little movie meant young one positive message become person let society standard dictate coming age movie enjoyable action rat since see review bomb give help counteract
22,badly write constant break destroy narrative pace condescend becomes annoy irritate bad sin movie characterization write understand insufferable chauvinist petit maître million mile away understated genius government superagent book add insult injury characterization despite book play movie show clearly show kind character personality miscast sympathetic charismatic friendly brotherly care irony utterly misguide cast play depressive brooding uncharismatic emo dull bore ruin classic franchise year come seem condemn always miss mark actor thanks awful scriptwriter poor characterization lot chauvinist give low rating movie allegedly feminist also far fact movie fail since also lack mature nuanced understanding feminism
23,movie lot fun fan action pack film felt lot like version film rat action sequence well do definitely feel production design act soundtrack pace story good script final minute differently still work scheme plot motivation main character great young actor corner stone film new take classic enjoy enjoy film fun engage story
24,perfect introduction holmes film fairly good aspect comedy mystery emotion bobby brown act fantastic good job perfect character enjoy much humor play differently fun watch might meet many people expectation suggest watch without wonderful fun fill journey
25,require braveness young speak voice way stun beautiful movie forget woman last century feminist movie statement intent mission young people stand equality human right commemorate good one past good adventure movie watch family
26,read quite reviews forsake movie understand standing think understood movie several revolutionary woman time movie remind people back movie background enola holmes sherlock plenty movie even exist book movie undertone feminism mainly come age story society expect conform standard instead individual much like today talk audience real thing call term invisible wall exist world play movie case audience think fantastic job captivate audience whether liked recommend anyone love adventurous tale
27,hop something least pleasant watch eat boy wrong bad bad movie predictable shallow cringe woman feminist movie horrible
28,watch next fun story teenager great act
29,many people read movie much family movie night kid
30,good flick young sister firmly young adult family market well made well acted period piece good choice even family friendly entertainment young old subscription
31,young woman great future talent charisma film entertain beautiful watch do
32,film fun write character wish turn series stream service even television proper head shoulder stand stand atop crate everything else reviewer say film hit intend target quite well keep story live breathe interest next generation instead let wither die look brain strain problem instead look puzzle fun solve much good experience tell daughter date dinner
33,clean fun thoroughly enjoy movie perfectly play whole cast perfection hope follow make installment movie
34,love quirky narration style great act do
35,hilarious commenters like movie feminist agenda strong female lead really upset much love aside film beautiful compliment nod multiple series unique take feminine perspective present traditional sardonic time wish bit involved
36,ask saw movie really understand harsh review worthy good movie say fun act good enjoy see role say give try may surprise
37,act badly keep talk cam audience make annoy sadly cavill terrible sherlock holmes story bore slow writer knowledge history disaster movie disappointing
38,first quite excite noticed new movie first glance seem like great flick list cast center around great mystery lovely decor mind movie center around less well know sister movie sort feministic background movie progress latter become obvious point become annoy movie time period unrealistic example secret woman jiu jitsu class early sure class race gender movie seem trouble problem wonen time certainly case unfortunately case many metoo please movie nowadays male character either evil bumbling idiot completely helpless sole exception get much screen time get wrong love many movie female lead character underworld pan labyrinth resident evil etc really dislike current wave overcompensate feminist focused movie keep use old formula forget actually suppose decent plotline movie bad much
39,like tale learn kid reimaged new light see great example act solid script
40,along really nice cast quite charm drive story well wall audience create welcome distraction add quirky fun film film fun time manage ignore plot element seem superficially think many inaccuracy period thing find striking seem follow certain diversity policy cast sure show many possible people non white ethnic background set plainly silly though works firm believer equal opportunity art make film lot white guy around main character instance different ethnic background fantasy bother might ask ignore meantime dream world colour skin gender background really matter
41,lack substance long day movie mean convey story entertainment political ideology hbc character even need
42,disrespect want metoo movie fine borrow fame character logic unbearable point drop even movie still minute away really care read remain plot pace sooo slow suitable audio book movie intention borrow fame character film maker direct intelligence viewer even completely detached universe think still fail attempt metoo live life movement much boring conversation still fail audio book
43,another line movie basically propaganda mess really confuse smart core message sometimes make noise refer bomb plan plant somewhere get attention woman right vote say sometimes set bombs get voice heard try make appear okay way make voice heard rest movie kinda silly insult saga
44,read almost every negative review find trash honest bother much hate see female character intelligent powerful hate movie ignore many disgust historic fact people say rewrite history dare dream history right everyone world racism place woman oppression fight cinema always reflect sad world live people dream whatever form art rewrite history speak new generation doom repeat
45,reviewer seem impression story hitherto unknown teenage sister tone bit like adventure girl search identity avoid normal fate young woman evade brother stumble across miss viscount torn solve mystery vanish mother carry film well appear often enough remind connection little true deduction word puzzle brisk enough pace keep kid interested fun even entertainment whole family
46,much add user great story surronding world instead enrich new artificial non realistic caracter create mon seriouly consider leave netflix alternative
47,quite excited movie play minute watch excitement go away really really struggle stay still rest movie well quite boring maybe target audience feel like movie really fun excite pre teen maybe historically inaccurate bother feminism promote one get start like bore modern comedy actor dress victorian clothes enjoy aesthetic
48,really hop fun chill adventure movie kick back relax first thing turn way narrative handle talk screen viewer explain every small detail leave field mind excercise felt like director think dumb understand basic concept second perhaps key issue movie aggresive use call feminism aggressive towards men constantly tell useless act strength weakness message want convey youth order strong woman must believe men somewhat less need say portrial main character little historical relevance part forgive suppose simple feel good movie stand direction movie take toxic form feminism strength woman kindness empathy love care others hat men
49,really fun adventure great young actor lead end boring predictable story young lead quite carry film yet film look good script awful act great work good fun
50,get far much hate look something historically factual obviously look else film mean creative fun lot big great name movie course act wonderfully true fan anything spinoff know since base sister still get quirkiness whit detective skill come love entertain little long side must see view incredible get immerse old world scenery always fun see
51,sherlock franchise get name publicity combination topic fancy day huge hole plot history even moment intelligence humour sherlock holmes film use
52,history woman suffrage pretty well know lot individual event actually make base true event movie television subject need introduce pure fiction mix shoe horn together historical theme surprise surprise lazy writer favourite piece public domain nothing poorly construct alt fan fic fourth wall break jar act mostly wooden stale get expect best thing say nonsense perfect example copyright law broken stuck public domain foundation cultural expression century without anybody willing cultural scaffolding
53,empowerment good popular topic movie completely miss point main character basically terrorist boyfriend grandma try kill succeed movie luck even say punish misbehaves time even rule nothing gender like throw food others slurp steal someone car make seem normal even heroic action runaway mother decency explain end film disappear daughter birthday leave clue lead nowhere want child watch empowerment bad manner total lack respect others film deserve recognition though tiny pine cone doggy
54,movie visual masterpiece cinematography innovative intriguing act beyond recognition story simple follow mysterious time solid release mbb best prove list actress definitely love see sequel
55,think film lovely massive fan year old man jujitsu taught suffragettes anyone know holmes know sherlock exponent refer baritsu defeat reichenbach fall system introduce buy writ partner yukio tani root judo jujutsu
56,bad good performance lead actress screenplay writer director fail movie expect proper mistery movie disappointed bad good expectation one
57,much disappointment movie disrespectful holmes book clearly make feminsts sake character vastly different book play compassionate love person book self center selfish degree
58,say anything enjoyed much find old fresh time want really soon
59,excite soon first announce even start add list talent picture know breakout role impressed work anything else see much watch performance sub par say film suffer terrible screenplay direction help performance give terrific probably best ever include way near perfection embody role definitely film two talented actor add lot scene narrative good great story compelling probably pace place minute easily trim runtime maybe even twenty care much mother storyline end anti climactic main negative film entirely watchable base purely performance light hearted tone narration forth wall break also work cinematography beautiful easily one best look film available mention end anti climactic nice message sprinkle throughout despite issue really good time recommend check watch act character cinematography probably end good time film score
60,seem like become junk production machine great extent resembles massive meaningless production reason movie subpar story exist waste time
61,say great future head brilliant entire movie base great performance entire cast crew great job show awesome actor bless great career outstanding performance
62,think accurate representation history hate think fun lighthearted movie girl find love know go expectation historically accurate love
63,time movie seem make go able describe end wtf scene bad dialogue annoy monologue talk camera self film critic good rewatch old movie like time well invest maybe year old girl find future idol bet confuse face
64,movie disappoint make regular angry men like novel equally smart smarter
65,think brilliant never allow damsel distress find totally engaged world idea format leant series much well though
66,start end weak storyline sometimes feel like simple story make stretchable without give much audience
67,fun well produce nonsense nothing spoil fun many criticism intolerant feminist agenda mind review
68,hop sherlock fame gonna spend much word movie
69,really odd mix actor feel like hear twang also strange boring
70,nice cast much potential squash bottomless pit boringness riddle propoganda film place emphasis fact sense creativity come empower woman quite frankly dreary watch white wall
71,talentless writer director producer without wit original innovative shamelessly pilfer name legendary character pile garbage upon roll waste throw audience know bound lap movie title relation anyway spirit character likely touch even hazmat suit dare use character try blaspheme way supremely mediocre narrative straddling stick clichés wear shoe great actor hilariously oversized rot deformed foot painful watch infuriate behold impossible accept year quarantine movie another piece never leave box
72,target teen market film end hat guy approach fan authentic screen depiction modernist teen fantasy version film pure fantasy even attempt look moral code etiquette society instead throw random disparate element include female jitsu club sight random artistocrat cavort around countryside female minor plot hinge ridiculous underwritten uninteresting mystery cast litter familiar face ease role whose entire role rather pointless miscast try decent performance come typecast assassin excellent whose charisma exuberance shine screen
73,give rating wastage time terrible accent fan
74,feel like review review film something try want historically accurate film want non female empowerment film watch historically accurate empower woman review film entertainment give film nice charm family friendly film light hearted serious film right amount female empowerment see message show whilst ruining plot film believe remarkable able produce star film young age
75,perfectly wavy hair enigmatic enough play perfect cast quirky bit deduction tad mystery perhaps begin succesful franchise thanks netflix create engross industrial cityscape
76,movie simply annoy waste valuable time
77,really want love movie father year old girl firmly believe need cool smart brave young female lead movie smart cool brave girl like daughter someone look look forward see clever young girl solve difficult puzzle movie subtle reference old story get premise story mother disappear leave behind clue hide bother solve rather simple paint number case step case really kick lead character meet young viscount run story turn love story instead lack good puzzle main problem movie talk audience show strong female character lot movie great insist constantly telling world change choose path life subtle message sometimes even narrate directly viewer main character old say tell show seem something film maker ever hear
78,cringe worthy awkward dramatic film potential amazing actor none chemistry whole thing terrible
79,algorithm era strike strange thing rat show witcher rat last eight month probably bad stream platform put content every week put two actor movie obviously approx spray feminism cause win spot time plot character direct nevermind target stuff need something put story snob catchy sentence
80,bore propaganda etc forgiven damn make like joke compare make sister never mention original novel kinda stupid main identity whole movie relate
81,super cute charm strong point include talk cam technique rest rather burden dull story solid production young one like guess target audience adventure younge sister rather slightly bored movie know old classic new one alike include watch know one superior version good one modern interpretation rating one point add charming performance note like first second accord creation character also second creation wonderful titan conclude final note leave
82,start say movie pro feminism badass time period thing sister character movie book drag name mud family sidenote people say like brother much well see portrayed naive uptight idiotic manner never keep quiet hell watson
83,waste time watch waste money investor another waste go descent production watch
84,like writer nowadays crate story family base nothing original like writer crate story feminism social oppression century basic logic common sense still work convince people believe every character story average indeed born year ago least born family one nerdy girl century believe feminism fight brother educator story shallow childish modern way
85,life future paint picture play inequality boys girl woman men past present sadly sweet engage tale heart importantly empower potential limitless hate least recognise comment review score afraid lady keep pressure
86,rat low must see another movie one great movie outstanding act clap hand millie brown nailed
87,exactly sort cringefest expect put break wall scene especially painful
88,production quality say anything bad act plot nothing special new even surprising hop movie trouble keep interested
89,huge fan mystery intrigue storyline take flick young viewer historically accurate fun action fill mystery nonetheless connection establish expectation much else okay expect enjoy much watch fresh eye expectation storyline pleasantly surprised heroine familial relation act scenery excellent story empower heavy hand political message true use mind right thing find enjoyable family
90,make great time say childish movie good way sweet lovely fan really entertainment look right eye
91,exactly protagonist quarantine life need learn immediately mother disappearance ignites epic search journey run many curious character journey life always recall training provide make one astute detective training excels strong young woman eager flex skill world hope strength power film forward recommend great night
92,movie several flaw mostly continuity plot issue easily overshadow incredible act entire cast put movie performance believable truly outstanding absolutely brilliant role wait see future work
93,unpredictable funny charm loved movie great yes write man apparently men think movie bad show woman smart independent wrong guy seem need bit intelligence like
94,open wisps hair loosely tied dainty blue ribbon flow wind pedal bicycle gorgeously green backcountry ask question familiar begin struggle country hill toward beckon whistle train soon meet begin tell story story inspires choose path take adventure life place front willing fight battle may able fight breathtaking light hearted movie ode young girl everywhere year society expectation woman somewhat well different expectation seemingly superficial anything hold woman standard heavy petticoat drape constrict corset though raise much different expectation firmly stand behind mother remarkable woman single handedly raise daughter intelligent enough think fight decide despite society ever reach grasp play wonderfully outwits old brother yes quite version may imagine fan famous detective board train search mother mysteriously leave put deductive thinking skill test path disapprove old brother pave dressed nice little finishing school young lady turn another direction blaze path path however faint heart faint heart path ridden unwelcome stray form young handsome chance meeting result reluctantly fight sinister man hire find kill right leap speed train roll onto edge cliff adventure lead another arrives face sinister man hand hand combat encounter dilemma press search mother continue discover many secret help young vulnerable whose life realize hang balance good care vulnerable mean risk life let nature take course advice wise mother sound advice embarks yet another risky journey help stranger turn friend figure target compassion others shin overpowers mother resounding voice lead change world around life reward purpose accompany beautiful friendship self proclaim finder lose soul refresh new character little sister daughter niece look character whose resolve mother aunty grandmas replicate little woman light footed adventure movie present scratch little itch wanderlust even temporary relief beautiful reminder look within answer life mystery welcome arm wide open adventure life throw always capable help soul need
95,movie guess suspense actor really amazing
