,0
729,young girl come age story meet feel mystery struggle early century feminist revolutionary regressive oppressive ideal towards woman era woman literally bound restriction wardrobes whale bone corset symbolize cultural societal restraint freedom expression independence patriarchal society set adventure far great solve mystery hand story adolescent sister famed detective represent shadow female sibling masculine archetype brother plight woman right revolutionary century unearth come age story time culture hard work woman right activist late threaten regressive political agenda include attack conservative politician intend gain control choices woman make body name movie title embodies deepest underlying theme movie search even clue lead solve mystery mother disappearance spell backwards independence clutch female oppression blatantly finish school brother try impose aim movie male dominance defines plight pave way girl woman epic tale rebellion revolution hope movie begin establish relationship young girl mother learn father pass away two old brother move away pursue career mother left device mother chose educate unorthodox method accord time period teach proper etiquette home making skill typical young girl education teach martial art art reserve education male patriarch oversee education progressive feminist mother free teach thing girls age never dream mysterious disappearance mother play quirky old brother return home take charge young care begin solve mystery mother disappearance play stoic play arrive realize unorthodox upbringing education seem want bother situation leave decision callous old brother chooses send finish school plan future set find mother sleuthing adventure lead cross path young play issue deal struck need help escape someone get soon part way longer immediate danger learn startle information activist mother might coincidentally effort intertwine come political matter threaten young beau quest answer independence lace political social conflict century mirror many issue face today story come time society use reminder learn history repeat progressive ideology challenge status quo lead darkness lead current shadow bright new future
730,movie many good good thing sadly story one latter really enjoy set costume music movie acting also good even though imagine henry cavill sherlock important take movie seriously take first problem trailer marketing surprising people expect something mysterious sherlock holmes related light hearted film girl find world story bad little place clichés predictable moment general think romance part little unnecessary consider maybe target age group overlook well make movie story lack little suspense direction sure year old self enjoy lot think many teenage girl boys well
731,sucker grow watch fantastic black white film star checked flick like murder decree percent solution fell love bbc sherlock holmes series course modern take master sleuth must see even board take iconic sleuth thrill portrayed elderly holmes eagerly await treatment younger sister enola holmes gotta say disappointed series novel enola holmes introduces heretofore unknown young sister fiercely independent mother late go search go miss get mix along way stranger thing win charismatic enough performer steady sure hand helm ship throughout course hour minute adventure like command screen presence enough make good solid effort support cast good fight club perfectly cast mother fierce streak independence mess energy carve path type character one look go miss hunger game catch fire finely unrecognizable least write piece traditional family man steel bring strong arrogance portrayal also bring something else heart character character trait traditional fan character arm work well context film film good enough found enjoy mystery character enjoy time world anything new like put pair old shoe comfort wear adaptation first book series one hope win combination pleasant watch star take
732,movie like movie like pride prejudice enjoy greatness strong as girl become woman begin stage feminism love
733,movie start big adventure hop move randomly enjoyable feel lenghty bit interest somewhst adventurous still fall short something
734,think charm lovely film documentary film seem forget reading review set certain century mean every detail accurate time frame beauty film political connotation simply lead young lady film thoroughly enjoyable anyone willing watch piggy back names establish one people expect presence film film believe make soft well perhaps sister perceive lovely family friendly warm hearted well do film anyone enjoy choose
735,trailer overall disappointing slow slow slow difficult continue watch
736,book bit young relationship mother complicate truly alone book historically accurate much clever face true challenge learn navigate value freedom mother procure elude brother boyfriend sad compromise dumbed movie
737,want like good work throughout movie creator use attract people movie really shameful
738,movie nothing character every scene feminist propaganda sick suck
739,movie bring screen deep message begin woman feel look like sometimes extremely easy make whole message feel unrelated irrealistic movie show story real girl real world thing confidence bravery perfect set cinematography perfect beautiful scene really interesting storyline comedy drama miss build together mystery show woman late prepare small chance society one movie impact ever actuation point drag attention show stoles movie charismatic personality realistic spirit break forth wall do flawlessly excess less iconic moment one blink water one best film year perfect cast great direction soundtrack give even special storyline recommend
740,immediately let know life well without men men oppress put woman
741,film laughable excuse attempt create cheeky contrast humorous spin movie break wall time necessary use correctly effective funny cough cough movie felt like episode explorer set century fail attempt nothing compare fail attempt mature actress well performance cringe worthy almost though refused try make movie feel like set century mean sophisticated lady act though act movie set modern time performance struggle get touch character feeling due stiff performance inability develop accent coincide enola mother accent like say line act camera shot frame decision help movie already feel like set century time either movie also sham woman want transitional lifestyle make feel though woman foolish want dress like alongside movie try mirror current event injustice movie meant time period movie make everything feel force many discussion need portray real problem time also spread myth corset relationship love interest also felt extremely force way discover mother clue see movie try achieve caricature istic feel movie flop aspect feel do place time end tried typical encourage end main character last word unnecessary feel professional repetative introduction performance form actor convince role sherlock production value visuals impressive waste due bad direct choice cast choice cast certain people pop culture
742,fan series get disappointed one know attack main character different however seem like plot story tell poorly write expect excite plot see come however story progress keep throw detail much useful towards end trailer search mother sadly get excited love story irrelevant casting though feel try please target viewer add plot make sense towards story generous
743,heard name one thibg come mind go see mysterious thing movie waste time boring storyline
744,start promise quickly fell apart unfortunate good
745,review middle movie disgrace everyone actor director producer everyone
746,movie wonderfully act powerful star cast excellent actress well write movie typical agenda teen want different life suppress patriarchy many time see male character either evil dumb weak slow year old girl order elevate importance movie piggyback name star power big sin day name protagonist save heroine story movie problem way well fighter strong smarter male counterpart need disdain importance men make powerful woman
747,wish movie long time ago great action scene great script beautifully do important message necessary young woman watch feel represent empower truly inspire
748,heart movie evil men nobody watch really ingenious plot hijack beloved male character like get people watch trash everywhere
749,henry cavill helena bonham carter waste boring script talka camera half time unnecessary cringe good mystery mother story bore mycroft give vote even tho set ward whole movie bad script imagination weird movie sherlock holmes cavill best part movie hand love movie start sherlock millie decent character play well
750,give make film since produce trash act part quite good imo earn
751,much fun really wish new series fun movie
752,surprising part flick appear direct rookie poorly glance film moderately talented high schooler learn cinematography light dreadful flat time risk fall screen stiff breeze write adequate plot couldve much darker dare hitman murder child sake get much darker time remember early basically second class citizen barely worth orphan tart company man heap darkness something worthy watch personal note character name share close nothing original care others thin short temper short stumble mildy interest character moderately intrigue plot come age story end wimpering yawn become series akin bbc travesty show find footing
753,easily entertain enjoy cheeky lead character never endorse movie portrays domestic terrorist bomb maker sympathetic light give show much high rating otherwise total misstep
754,guy serious score low give point
755,movie look exciting promise feature popular actor moment lack may expect engage mystery rely heavily feminist narrative film continually slide deep deeper politically correct territory lose promising film narratives fit agenda movie subtle attempt paint every male character weak stupid wholly useless cherry top mother building bomb plot commit violent act name reform film condones push change cost end result story saturate biast far leave agenda leave favorite story free politics cloak extremism pas one
756,extream wast time give even manage finish watch ever summe one word come mind rims hit
757,movie small use name rise expectation way meet nice come age story nothing cast like probably movie disappointing
758,nothing interest happen entire movie dreadful aside good act give material likely poor direct
759,shot write captivate something kid enjoy new generation inspiring time period turn series
760,thoroughly enjoy movie lightweight immensely entertaining creative recent thing stunningly good series course even well figure uncontested star young lady future guarantee subtlety facial expression faultless dialog delivery surprisingly strong physical presence worthy actor far beyond year pull break fourth wall brilliantly never seem contrive look forward another hope become series
761,become fantastic actress movie remind old type movie fifty sixty make really great movie stand today look camera speak audience really great wait second movie
762,start bright rise star star make perfect lovely cast story storytelling also perfect classic yet fresh felt force awkward thoroughly enjoy every minute film also fast pace unexpected new classic book
763,wee bit fun fancy cast play delightful sister brother never hunkier portrayal never fail bring trademark eccentricity role wonderfully love cinematography location round good light entertainment give film good
764,really care less people like movie sure remind artistically do entertain begin end well cast really nothing think say term might lack know lot people know difference unhappiness whether justified around course applies people age hope outgrow someday somehow maybe get big kick movie many enola holmes please pre sure live another year disappoint request
765,kid find strong funny smart tough female hero story like kid basically impossible movie give also show young boy hero girl entertain movie whole family
766,whatever good actress might become one time impossible watch movie cutesy performance make unbearable picnic either might director fault lack talent tell chore watch
767,good well know cast maybe expect much watch year old daughter enjoy story really strong continuity felt disjoint seem happen writer say wow need throw something anything wanted character talk camera really pointless movie watch least case mean felt like documentary sure someone write direct thought novel forget watching movie like part story audience give credit least stopping movie completely ask food service people think cutaway shot production crew behind cameras watch production like character interact character stop talk camera sort movie long two hour take movie day really think movie potential whole lot give four watching recommend
768,movie pretty picture good act bad write obvious illogical show ideology openly mostly bore predictable
769,belter future ahead really pure talent predict bling join club chunky role line one give right amount everything character support cast equally great brilliant slick without overdone appeal enough adult kid alike see become quite perennial especially young girl cute little love story fall short cheesy side thankfully definitely watch sweet fun charm lazy film thoroughly enjoyable enjoy
770,good basic movie much violence language nudity bit mystery detective work mild love interest wish make movie write direct cast also really good family job
771,perfect popcorn entertainer load fun viewer get viewer may question scene may seem bizarre perfect movie work give charismatic performance love see know
772,bull teenager movie save two hour something else
773,character mood action scenery definite like feel
774,go judge movie base book read legal issue original story movie figure whole plot movie fill clichés see everything come joke try funny movie fails villain way filmed try emulate film teenage audience well do except fourth wall breaking use correct way annoy constant look directly camera without say anything give movie essence lame actress case forget film look go feminist message movie force say time female character clever strong good brother show make audience believe action word come time character mouth deliver powerful message especially young audience well executed action mean repetitive phrase character well do clichés work performance solid despite fourth wall issue great another walk park tho complicate character wish appear movie usual time classic character come shine enjoyable movie new perspective need polish detective movie rack brain one turn relax
775,single character movie one treat evolution character whatsoever plot feel like lift channel flick teenage girl mins screen time combine clearly lure people watch pos watch one definitely well use even
776,lead role perform awkward exist girl suppose really genius become phony absolutely great always movie
777,good endure lot big fan cinematic implementation far show disappointing base novel young sister film release receive lot praise bore find toxic misplaced feminism aspects awkward eye overrate film young raise mother teach kinds thing chess fistfight also literature art young birthday mother suddenly disappear without trace brother help either clever teenager quickly find trace lead lose mother energetic presentation film admittedly entertain first constant break wall annoy quickly movie like example idea reason never use inflationarily seem choose style come across cool funny self confident work act lead actress good enough carry burden eye bad film progress seem unsympathetic arrogant way act good somewhat old actress character annoy heck protagonist course also due weak script misplace feminism repeatedly unpleasantly come focus existence housewife demonize example male gender also view disparage manner brother best example one dimensional villain want put board school make room little entire film put one gender make stand weak tasteless say convince even course still young second major film role hand well cast even look bit well trained rest cast unfortunately pretty forgettable look film bad impulsive narrative style distract sluggish unfortunately lengthy story like continuous style animation effect seem different scene maker film know visually work music hand entertain even catchy place disappoint spin series unimaginative tasteless execution lead actress opinion convincing
778,try finish movie lot thing time nothing
779,smart lively period piece mystery adventure kid adult imagination girl detective play intelligent resourceful authentic charm support cast among others wonderful enjoyed movie period setting detail witty dialogue respectful era thankfully dumbed contemporary shallow speak great music score family baffle numerous negative review think negative individual core demographic perhaps expect something like action version classic movie
780,read boy etc etc grow title way isle look like touch oppression topic really love whole story evolves grow along path agree predictable well film set part narrative see lot butthurt dude girl intelligent independent silly childish
781,love girl love girl act movie movie love girl act movie love girl act movie love girl act movie
782,funny smart feature fair bit action great sure like enjoy many movie invest fairly quickly decide watch
783,freak actor actress turn camera speak documentary whatched kid like
784,love whatever name child actress watch do fabulous job movie bore asf image hyperactive mind get completely ruin movie make think character anything include
785,liked movie funny good act say plot little bit confuse time little weird still cute movie cinema gold
786,fun engage family friendly story young lady use intelligence help solve mystery around find process stellar usual
787,watch teaser like color screen clothes component character good movie style adventure little girl find mother life want like quote end watch self future
788,film appreciate nobility lord pay make film character ridiculous script design hand costume hand
789,love fictional story sister love story mother daughter story highly recommend
790,decent movie overall present rather unrealistic false way movie present feel like sake diversity whole plot bias false unpleasant intention sure good presentation may lead sensitive viewer towards wrong false watch movie strongly recommend viewer get influence understand jist everyone go help achieve goal carve way always key survive still always bring order life never wrong disciplined definition demonstration discipline present wrongly discipline never bad individual one know really cinematography act set background do finely
791,good addition holmes series artistic like guy ritchie sherlock entertain
792,sure expect capture begin protagonist excellent great young actress never see actor great job always great lot range great movie feel like make movie blockbuster well make movie recommend
793,excels time lead character niece great mother go miss set quest find whilst pursue nasty brother agenda play great detective smooth anyone see family love watched start finish without pick phone good endorsement get
794,fan wonderful story well tell superb century countryside fantastic like talk touch passing good word movie btw
795,sherlock movie good enola holmes movie star entertain additional star love message enrage movie feel way probably never receive end attitude
796,though character peculiar journey rather adventurous excite watch able let eye astray screen narration nice keep movie mildly humorous without always keep excitement alive mention great hilarious lifestyle lovely hobby magnificent also callous convention unveil finely enough long movie absolutely love movie
797,movie great scene act actor start story much interesting
798,quirky visually stun little bit everything definitely fan historical inaccuracy though think good movie two path take path others choose
799,added movie watch list soon release trailer love cast especially watch movie weak plot direction miss spark overall movie plot mystery touch underwhelming believe miss good chance cast blockbuster
800,year old niece rename charm smart fun little movie world shatter entertain way pass couple hour two teenage girl niece win charm actress anything elevate cute feisty funny plot fast move quite exciting place say great see support role brother tone quite light hearted bit like incarnation without violence costume pretty look recommend good family film kid niece like lot
801,watch half way believe nice time killer nothing end message remind watch movie somewhat unusual sure first direction take matter talk another teenager movie even less realise movie actually quite serious scenography direct camera work really nicely execute set right tone around story simply surprising tone movie almost comedy connection character much deep think point movie really nice story tell establish future franchise character properly place nice general architecture future plot cute interest definitely worth see twice movie talk modern kid grow quickly move another century contemporary sort super hero old time serious kid today serious venture
802,love movie character intelligent self possess new poster woman empowerment movie much fun bring giggle lot know smile
803,really enjoyed movie find good story really well present
804,watch daughter throughly enjoy fun story brightly act nice way spend even
805,film make odd choice present strong independent young girl immediately swoon bore boy make decision base boy meet mismatch game afoot film try mystery teen romance feminist revolution adventure story none mesh well mystery call dull predictable also know character top evil caricature good though shines lead though constant fourth wall break bite jarring decision cast brilliant love see spinoff continue role manner scene far highlight film music production design solid well movie start engage soon drag excessive runtime want like film lot work nothing wrong presenting strong female movie beat head future film fix issue try little subtlety message
806,charm movie take fun approach character three thing enjoy like forth wall break way manage include story without make way portray well balanced character ruin good story like insufferable glad write smart capable without overdo make want root whole way
807,set find miss mother try get rid two brother brilliant fun familiar popular approach universe need captivate new audience use basic pillar style add new element work really well plot nothing hat particularly basic linear structure easy follow right pace entertain start finish star show role best part film unique charisma dynamic many hollywood actress study replicate example female empowerment attempt change individual right social standard curious sequel near future
808,entertain enjoyable light hearted family film respectable cast top notch act bland predictable probably disappoint mature audience unnecessary love story blatant social propaganda
809,negative review feminism unrealistic period drama forgetting film take place suffragette era say character practically unrecognisable anyone know anything terribly miscast give sympathetic sentimental performance playing basic villain might well replicate performance tendency overact throughout plot line also incredibly predictable really little mystery solve
810,great movie inspirational future generation young girl family already ask sequel series love see
811,even smart closely resemble case like teenage love story time watch
812,tea time watch film throw sufra jet superman little girl together sit see superman glint eye wow bit fun talk camera get involve try figer happen like one like surfa jet understand idea vote let woman vote save vote boy end needing vote feminis alot people think need history film sum time team dig alot think channel
813,holmes perfect example balance calculate visual funny lite movement good camera follow sequence good mystery movie answer tight edit like movie
814,bmb great movie entertain much purist bad sooo sad hang historical detail entertanment wikipedia page yes feminism time like impose opinion seriously
815,simple good movie think many title actually say day movie mediocre best remake sort franchise special effect get big big story thinner thinner good movie course try put politics detail history fanatic forth call ever kind people call thing like good movie less good movie
816,great movie make weekend great act
817,set actor play movie much yet mainly girl follow gut end give solution whole country brother suppose best detective country think movie make everyone heroine stupid make stand find explosive factory still detective movie point onward change course romance movie good visuals production storyline good
818,dialog love way engage audience viewer like even scene real one set stage future production concept allow audience change scene even end extraordinary production design music pace intensity love much one hope many episode come
819,great movie watch daughter year old edge seat love movie one point turn say want say may diehard fan enjoy style characterization much kinder empathetic play protective big brother film line original character break fourth wall often annoyed lot reviewer comedy come think cute addition show personality look fun excite family movie definitely
820,movie sweet fun funny thrill empower show non toxic masculinity end male character get teary eyed goodbye watch suggest anyone look lighthearted film
821,liked movie character storylines well writen part enola look
822,interested like know idea new project
