,0
364,reading produce impressed happy dismiss little flaws charm signature great promising young producer actress excessive talk audience irritate bit first still find enjoy increasingly consistent well place throughout ever change fast paced adventure pull exemplary give movie modern young appeal add whole set layer way story narrate entertain well worth watch piece cinema well almost definitely one lucky shot dark last couple month even year
365,movie eye opener youth girl live conformity society set know exactly felt also time go experience show much community live need much change people seek change one beneficiaries indulge even betterment many motivate speak even world shut move limit space others thrive box cave something people usually realize movie able cliche may sound change part life view thing definitely change well perspective movie mean give positive message become version let society standard dictate hope people also able watch sure also learn lot society thing future ahead
366,set journey find happen mother go miss old brother plan however want proper lady stop living wild lifestyle influence mother middle child stand middle two sibling care never best emotion general follow first adventure defies set find mother come across another mystery might well change history really understand movie lover like movie want read proper story suggest turn screen read one many story write story another take universe keep character add story mystery story bravery difference society expectation find hold thought delight see star lead actress movie make great convincing performance young sister iconic character fresh take side character speak cast wrong acknowledge actress legend play role mother stole every scene together delight watch thought excite funny fresh movie entertain begin end
367,endering give performance intend man love movie wife even sweet soft tone movie like kind thing might different use okay fit otherwise think end good decision way
368,charm nice see grow actor recognisable role different take reimagined franchise cast decent job hour long film family film inoffensive thrill family friendly action scene sense danger
369,scene entertain story love movie like except disagree one message sure movie promote distance discord within family message bit anti family high rating overall adventure scenery
370,film star ever rise star reliable talented pair wrong nothing thoroughly enjoyable film go tax brain go worry scare fun dun star talented likeable actor well write sometimes amusing adventure mystery get even write bag chocolate choice nice cup tea sorry go back childhood treat enjoy film play lesser know young sister embarks mission find something important go miss whilst avoid guardian arrogant less care elder brother play brilliantly normally likable try emulate slightly look care definitely elementary point brother show tender old brother side whilst maintain dignity sensibleness way meet young problem namely form seriously seem ever need hard eye bad guy silently threaten get job role incredibly well family look include help think every time hear word lot answer blatantly much horrid ancestor character superb amaze someone talent screen presence still even amaze know great accent look surprise find reason great accent parent even though move around fair bit time film either make little comment look audience actress annoy imbues sense charm humour one young lady huge huge future ahead well deserve far set nicely second film director want make second one hope green light though make odd decision cancel series anyone weekend crack open chocolate style drink sit back watch lesser know sister take centre stage resound success ship sorry resist nearly make end though write ship really remind yippee yay kimosabe kind disappointed self edit do family friendly blog yeah really fun enjoyable even enjoy know got good
371,fun watch story suspense interest follow historical action suffragette period action humor talk screen mystery period costume great watch family least old kid understand storyline movie
372,start spot photography beautiful part wear bit thin miss important opportunity include suffragette movement nice reveal especially break fourth wall great roll dice always work family film day need sequel cast
373,underrate people still covid cinema industry still best watch anything worth see today make amazing story worth watch family effect right fit movie era
374,really good movie expect good cinematography brilliant actor good plot interest protagonist likeable change annoy watch wanted see pleasantly surprise
375,movie rat wrong rating great act do review say good movie bad bore one
376,know bad review movie reason must people give lose sense fun mother feminist exist back huge fan many decade offend movie fact much fun watch movie age story fresh character great wonderful line actor visuals soundtrack feast sens enjoyable movie highly recommend naysayer lighten relax learn fun
377,enjoy diversity cast feminist world view delightful
378,bright future ahead film hand although give felt like something miss definitely long wall breaking felt really strange choice rather farfetched moment definitely die one point main plot point felt like bit cop end unfortunately despite flaw fun nice chill film put
379,watch expect typical movie trailer give clue like message give film powerful wish change world get rating low may men want see powerful woman around like act scenario fulfil expectation fun movie need hard day
380,make mind people way torn dull disappoint nothing well good way
381,enjoy movie excellent cast good act main lead especially period detail excellent give one reason expect expect different resolution main plot mother miss give spoiler say really well make movie good actor enjoyable script well direct honestly enjoy see rubbish pours regularly day mean good hope come thumb
382,say get range hard make transition child actress young adult convincingly one add list think fab hugely entertaining film good role quite short wish screen time together able potray family like emotion persuasively amaze convincingly excellent movie target audience compare mode revolve around much detail say end
383,light pace funny young adult fiction adaptation talented girl get know adapt real world make effort look feel historically authentic clothes make prop etc important part take liberty rewrite bit make empower story young woman fantasy story youngster tell young person define oneself fight weak little bit mystery adventure action add little bit romantic touch plot talented cast committed character story pretty much ask back early teen btw abundant even absurd young film fiction available problem one girl orient enough move find another tree use fan big nitpick dumb lot villainous character canon book describe even good deduction keen field work younger brother rewrite aim young people give pas enjoy ride remind young soul love see sequel
384,long time see movie like thing simple funny catch way enjoy family love
385,enjoy movie terribly complicate historically accurate cute movie enjoyable way spend couple hour
386,expect think talk camera part bite unnecessary unfitting type movie though complaint like character story intriguing
387,god wrong people horrible review every film need rat political hatred shout feminism beyond mean female science fun teenager movie woman self defence class thrown like laugh get remember like child
388,course perfect package star stellar performance first review movie one imagine positive impact movie worth watch
389,awesome movie actor priceless saw think watch
390,another successful movie familly enjoy watch english accent make movie worth watch first minute take part bold move amazing
391,honest first hear film think enjoy something trailer felt boring excited see another role begin watch fresh mind definitely pleasantly surprised enjoy feminist yet overdo portray feminism realise heartfelt way also like left opinion various thing open viewer especially admire male character also depth development often find lacking film like really enjoy watching probably revisit multiple time
392,wish become series fell love movie minute saw girl realize engage character appropriate time live political thing go oppression woman still continue day main character really captured heart anyone read well really watch movie care character probably someone really care woman woman right well do well acted great cast great story line course argue part watch year old way one reviewer state anything something year old love year old husband
393,go watch idea expect chose right actor movie perfect best choice fit roll movie also really amazing roll also favorite actor top favorite actor voice favorite character time sum give movie rating overexceted expectation movie totally recommend favorite movie time overexceding
394,like see kid also good time
395,movie eye opener youth girl live conformity society set know exactly felt also time experiences show much community live need much change people seek change one beneficiaries indulge even betterment many motivate speak even world shut move limit space others thrive box cave something people usually realize movie able cliche may sound change part life view thing definitely change well perspective movie mean give positive message become version let society standard dictate hope people also able watch sure also learn lot society thing future ahead
396,really enjoyed movie first sceptical near constant break fourth wall end feel make movie good think deadpool one favourite rendition character see date
397,act engage thoroughly enjoyable forward sequel
398,simply awesome treat watch presence every scene fab wonderful struggle woman patriarchal society portray well
399,love film act love hope second part come future
400,awesome great future act wonderful actress enjoy every minute love see series
401,movie much well ever search case revolution character theme gender
402,well do make want read book impressed read credit lead actress also producer
403,production fun lark classic good job step fire do amazing work appreciate challenge
404,fresh charm fun film deal serious issue also offer fresh perspective character long beloved like funny heartwarming good watch whole family enjoy rewatching longtime come
405,unsure whether suppose teen flick adult think end tick box genuine family entertainment huge fan old see every film television rendition past care tangent story veer original enjoy provide gravitas young lead ably business solve crime complete modern vernacular mandatory martial art skill even play field matter size disparity see continue grace screen presence far cry maybe always trigger fond memory nevertheless
406,perfect sequel sherlock one make happy bobie brown
407,film decent sweet family film watch curious another role glad say well know pleasant surprise story expect keep toe follow predictive path good also enjoy wind path change direction guess best one say hope produce sequel
408,film light ambience feel calmness youthfulness watch also feel curiosity find happen next make engross watch also like part decode mom message think movie really entertaining good quality
409,quite fun movie think work bit good series felt like try set many thing likely hop sequel assume stuff addressed think good draw series cut something introduce late mystery conflict felt little rushed generally like narration film find usually lazy way get exposition across actually bug much making face camera think add spunky nature think tone bit scenes character cause maybe time say say course others react comment like overall let figure stuff look serious cerebral movie think definitely gear towards teens family bad thing still think fun keep mind thought actor really good job standout course likable throughout tad bore felt like character kind take backseat rest one hand kind make sense since main character also kind weird since universe make super impressive famous guy really see much thing explore sequel kind reminds young good give feel like throw mainly fill teenage heartthrob quota make sequel check really like liked character
410,young sister famous detective intrepid protagonist new production bear name youthful freshness film capable bring invigorate version fantastic story deduction older century brilliant fictional researcher create century writer young fiction reality story introduces teenage character literature publish author character youth way detract cleverness trained different fighting style verse various literature spontaneous desire investigation establish free personality story escape rigid control harshness old sibling search mother mysteriously disappear involved restrictive issue social class sexism characteristic time story take place unfortunately also today character attract dangerous political plot young platonic novel though production gear towards teen audience work please different age action pack narrative mental fun exercise perform stand even famous old brother solve difficult case diminishes innovative strength youth novel build quickly literally single afternoon already repeatedly expose much romantic interest grows head mistake success many production style film efficient construction point temporal work work pillar young character self knowledge discovery vast world always read prepared explore never really venture although felt fear adventure dangerous take script set scene costume especially great energetic performance also produce work film base work writer plot really worthy detective story lot feminine empowerment action fun current reflection
411,review short film excellent since go expectation
412,star show without question hold whole film together ease lightness touch pull dialogue particularly light comedy like pro make distinctly unlikeable good job part reviewer say miscast really actor like imagine someone like suit well pulled little oddity eccentricity defines cast member good feel kind quality bbc period comedy drama feel seem snap feature bomb badly theatrical release bad film tent pole budget action set piece seem attract cinema goer day enjoyable romp fairly sound plot enough detective work sleuth satisfy pilot series honest
413,misogynistic reviewer claim historical accuracy clearly uneducated one woman jiu jitsu boxing class become popular early woman fight political empowerment associate bodily empowerment movie mean historically accurate movie rarely mean show period time lighthearted way generally use obviously woman struggle lot endure way bad show movie social fight mean centre plot main point plot still mystery first mother disappearance mystery mystery around marquis attemped murder strictly link historical context say movie set around male electorate extend include men genuinely enjoy movie finally year old character interpret actual year old actress playful somehow comedic way introduce social issue time large audience usually movie revolve around social injustice fight especially woman right meant old audience case badass heroine movie still tackle interesting social fight dynamic
414,care critic review watch film enjoy entertain especially watch full justice character role emotional spot give watch regret
415,compare sherlock movie fun watch movie family movie really talented maybe story bit weak place recommend watch
416,even well modern young woman obviously meant modern girl fictional set quite get anyone expect historical accuracy character barely mention fiction
417,overall good movie fan book hop something follow movie well lead believe base book small part note though
418,absolutely loved movie great job play know exist realm movie young girl become woman different mindset society want tell act wear may little history woman time take away actual purpose message movie still love
419,make course acceptable nice expression subject fluid course watch really nice movie love want see
420,look fun film mystery intrigue take seriously provide delightful escapist story sure enjoy movie performance across board stellar really steal limelight title certainly make cheer hard solve case also remain independent young woman also great performance name sister uptight regimental old brother desire find mother go miss desire put finishing school set young inexperienced year old girl arm knowledge mother pass knowledge history chemistry literature even physical combat already bless keen deductive reasoning skill make even grin pride case set search mother quickly become side track much important case insecure little boy complain film historically accurate enjoy story movie suppose base history yes movie strong take capability woman inferior men problem either thing watch love emotional coward unable deal power woman always make laugh really hope make another film movie enjoyable one whole family enjoy
421,disrespectful miss point caring film well shot great scenery story nice intriguing actor invite played well much enjoyed
422,excited release film disappoint film movie quirky extremely engage story interest keep engage without force fantastic add comedic timing frequently break fourth wall find funny main critique film focus feminist movement find ironic review primarily seem male critique historical inaccuracy also fictional story see historical piece fact
423,understand people many bad thing say movie personally think really good one many good detail good actor definitely see low budget movie
424,love plot movie begin end great perfomances
425,fan read new related film albeit less know much young sister release get excited mistake problem female character drive plot huge fan franchise name two even fact little screen time know start problem fact film story series excuse show woman kick men asses whole film problem fact film treat audience like idiot anyone right mind minimum knowledge believe thing show sad excuse film actually possible late advancement woman place society wrong way film men either idiot evil woman capable good wrong way unrealistic make good story real female hero throughout today fight fight bravely woman right without throw single punch make enemy men tell story instead make drivel like recent version pity really decent story line character development decent addition canon advice see avoid like plague series best ever instead recent even two rdj film preferable welcome
426,find negative review extremely shortsighted quite frankly ridiculous absolute pleasure watch clever witt young lady adventure heart care rest people live little care fact history brutal enough want reminded monstrosity scenery beautiful breathtaking cast actor wonderful absolute delight watch act love entire movie laugh giggle cry exactly world need right wonderful make series people real adventure wonder heart movie must watch
427,excellent pitch project shot well perform unfortunately
428,rat star even forgive star story focus initial core find mother air secret want reveal anything either one thing great see grandiose continue like play everybody wall
429,fan excite announced movie get disappointed fast act remarcable average shine think character charmless care anyone wood emotion goal fake cry sometimes environment nice portrait cringy cgi scene pasable plot plot main idea simple mom go miss find clue go find sound good paper good watch sooo many convinient thing movie help plot lazy bad movie ment feminist propaganda yup know okay show sometimes important necessary whole thing feminism movie figure mom radical feminist yes abandon join group radical terrorist attack show woman need right vote change world terrorist attack go kill people show movie bad people like figure care say might dangerous continue live without care terrorist attack talk problem propaganda movie make whole review move something else talk character even moron anti feminist guy movie make one main antagonist boy useless seriously chief guess capable much barely catch useless shadow suppose say solve lot case say know everyone wisdom habilities get literally beat solve main case knowledge solve case know anything human behavior literally spent whole life house without leave mom maid happen lot negative point miss review make eternal advise like book maybe one play even one crossover watch justice legendary character hardcore fan miss flaw entertain movie case skip
430,plot really good amazing cast well thought entirety different idea character narrate throughout work well love definitely recommend
431,saw minute movie get bored minute none character act intelligent way family disappoint suppose intelligent require help scrabble letter chip read encrypt code result backward write sentence easily see first sight
432,first watch movie think mystery solve like fun ride enjoy strong screenplay relevant theme society degrade movie basis mystery movie mystery main point plot pls degrade one worth watch entertainment
433,criticize film wrong reason leftie feminist yes girl power message nose come forced yes racism apparently exist time overlook seem fun movie actually bother shallow story line lack mystery top reaction poor choice talk directly camera poor edit fast pace many cut scene intro alone upset force romance lack character development use great cast member feel like watch maybe meant kid communicate well enough guess watch super hungover case watch
434,crap militant film well netiflx production destroy everything get hand communist indoctrination campaign do several reshoots etc surprised militant arrogant writer create script jump tree tree carry helpless fool arm one actually woman kill big as chauvinist
435,incredible entire cast incredible job especially feel like witness everything something special see anyone like really think ever entire cast screen fabulous job favorite forever extraordinary
436,much entirely strong independent woman men pig potentially good movie political statement
437,performance great energetic overall interesting watch hear many good thing performance tell movie incredible role intelligent young story mission find mother disappear take help two brother end alone right thing character interest intelligent dialogue point overall writing perfect opinion first half great second good acting three sibling make entertain play amaze job want see get spin movie amaze performance old brother strong believable say movie rightfully cast maybe one lack write character actor character really like maybe huge presence actor movie nothing wrong felt movie work well without love interest edit great fast paced make story move fast everyone work energetic performance feel good atmosphere film write great bad either okey argue break fourth wall place movie let make argument work movie right start get know alone like company lead say person talk find great huge amount feminism movie much time feminism time feel like much scene make unrealistic entertaining movie lot people watch enjoy one incredible movie leave mind blown try kinda movie fun adventure movie whole family age great performance book story tune get sequel
438,get hope movie watch disappointed character give less time know movie know name represent movie annoy boring time make sense
439,much try delivery talk camera work way shape form help incredibly poorly script teenage version leave wife asleep sofa
440,expect mysterious movie full adventure movie much boring expect nice shot countryside movie hold attention teenager movie seem dull time character really flesh well comedy enough entertain wise romance enough become invested mystery enough carry away get point really recommend movie anyone teenager
441,mean really bad movie get felt force nose break wall get tedious much tell apart appreciate feminist undertone story mess need many trick somehow fill plot hole become whole kept watch constantly uninvested rather annoyed good try
442,whole movie try make lead female charecter smart strong perfect much possible praise every charecter film hand show men stupid useless story line real mystery solve dull predictable waste time felt like instead focus story make realy good entertaining movie use name famouse male charecter hlomes promote feminisim bad
443,movie show clear feminist agenda wouldve fine work little hard create story plot instead milk cow story direction hole movie leave bad taste must cry grave
444,boring movie bad plot jump one thing next little explanation
445,holmes story even crime mystery story much feminist story woman modern feminist value ofcourse mother like blow thing detective story lame one political background story
446,carbon copy different version see movie series boast pithy modernized light step may quite visibly bold screenwriter director wonderful job capture think loud visual aesthetic turn exposition snack chore rise young star effortlessly radiate charm tale rebellious teen sister gift super sleuth search miss mother already become world favorite take entire movie shoulder effortlessly cast member lot seem do job perfectly include flawless portray many cast member see movie include era intellectual property studio mine library repackage brand concept find unexpectedly enjoy despite increase cultural exhaustion property fourth wall break aside become tiresome point mystery quite fetching film think puppy love romantic dynamic sprinkle throughout movie stand tall major lead enola play denounces provincial old brother accurately point wish change world world suit go
447,break wall asthetics set star good act asthetics star totally unrealistic depiction era use plot device modern day politics come preachy bore
448,good movie enola make enola holmes create lot expectation meet reputation holmes name generally come spectacular mind boggle story miss good story live name
