,0
276,make feel like twin asteroid flick rule box office crash land pop culture consciousness unnerve uncertain time suddenly end world seem far fetch take yet another global catastrophe alongside director back back project time regular guy rather superhuman agent preoccupy save family president open estranged couple whose marriage implode struggle parent young son standard news report impend comet pass quickly escalate extinction level event fragment start lay waste continent society fall apart one conventional race clock thriller jam pack classic genre trope cliche protagonist embark perilous increasingly desperate attempt seek sanctuary rumour bunker locate soon split amid pandemonium run seemingly impossible hurdle want get money worth spectacle appease terrify destruction cargo plane transport select group safety premise overrun nots true zombie fashion callous kidnap child separate mother also different kind nightmare two hour end care character even showcases best bad humanity hurtle inevitably towards predictable conclusion message ring even louder crisis reflect people survive common international threat together look sliver hope mass entertainment amid gloom make enough impact
277,movie dipicts end world storyline meant happen reality folk something huge happen soon movie indirect warning
278,movie real live watch behavior cataclysm present realistically decision make truly movie watch eye wide open truly understand state emergency know avoid inevitable like movie hero save world fill boring everyday cliche see every movie something different need absolutely recommend watch
279,film start man ask worker home back house talk wife scene turnout film son need escape bunker save strike comet film full boring conversation annoy overuse scene overuse news broadcasting scene overuse star scene overuse shout name scene overuse argue scene overuse flashbacks scene film unwatchable action scene also intense messy shaky intense scene myriad debris comet strike bunch people car road end come bunker comet disaster wasting time watch
280,actually show big reality existence planet realistic way moment boredom without notable thing complain alone deserve high mark
281,film feel like write capable create character drive self absorbed need countless occasion protagonist give opportunity help others yet exactly make want see survive fact several point film wish pray even large chunk comet debris fall head spoiler alert anyone seem show loser even ounce kindness wound dead
282,subject good movie quite boring predictable unnecessarily lengthy scene enjoy much
283,give due drama bit soooo long drawn special effect well do direct bit lack imo keep feel like want move keep get stuck
284,story link together movie seance bloody important know put much vaillant
285,unique film like sci like watch heard interview scientist guess consult movie anything happen right comet head toward threaten destroy humanity nothing impressive especially scene father law confront marriage cheat make movie minute good emotional performance wife desperately protect diabetic son ensue chaos watch spend see
286,watched kid expectation low pleasantly surprised get wrong script pretty linear however play well emotional side
287,hard find good catastrophe movie theese day cool see thing normal people experience kind situation detail despair others really make like movie course high class cinema guru crush movie damn fine movie normal person
288,awesome definitely best role mainly do disaster style popcorn enjoyable substantial similar good average pace believable existential threat unnecessary back story melodrama covert woke culture standard across board many year riot loot real present day bad end world loot say lot crappy year well produce well act predictable get see big screen best way enjoy sfx
289,script probably write year old imbecils least make feel like imbecil
290,actress movie end beam face smile eye good one really liked
291,hate everything people think life give want think people idiots saw
292,movie people need two enjoy good movie critical
293,movie make feel stress mother kind stupid decision expect action movie intense realistic
294,genre find flaws realistic great act
295,start decent idiot kid drop med rest story become painfully clear rest movie drama pry writer big crowbar plier bulldozer kept watch peach usual almost forgot mention movie promote nwo propaganda burden make case disaster discard asap get kill cent
296,special effect people make crazy decision think give circumstance best film do watch
297,spectacular doomsday movie first class acting also amaze really like movie another catastrophe popcorn drama movie abuse cgi actually focus family break apart chaos caused meteor intimate psychological much expect movie genre separation character create different point view come together tell story structure well think really felt connected character whole thing felt truly intense fan doomsday movie like one
298,film deserve much good reception full cinema release human character focus story either less visually spectacular also realistic gritty meteor disaster movie shame creator put bit budget time final impact scene push film somewhat anti climatic well write build help want scene hammer home effect mile wide monster impact world tidal wave scene city destroy put ice tasty cake movie
299,world experience apocalyptic event movie bring joy viewer intentional tension story seem heavy dramatic effect necessary pleasant watch movie focus main plot
300,factory type content day thin plot fill scream family vague disaster scenario barely flesh watch guy place place care barren framework superficial scene societal breakdown disaster do well nth time ride become transparently boring force attempt emotion tension scream loud music real exploration deeper theme spectacle bore
301,good movie know movie good enough well full woth unecessary dramatic scene situation dull decision make character dull suspense lot cliche move even cgi good focus realistic situation case like fill movie lot cgi act think one lot entertain quality movie weakest movie
302,though massive fan disaster movie quite enjoy one know know see asteroid comet destroy world hour find shelter save family bit far fetched bit cliched sometimes need well shot well act actually root family care character effect well pace good effort probably give benefit doubt
303,like movie much hour right time kind movie little boy act good recommend everyone movie watch
304,normal one man save world type film actually quite well thought movie story dare say believable effect corny good good disaster film do
305,moment saw knew wanted one start although long period film appear man struggle find family plot use separate family quite lame say natural make sense love movie action concentrate start middle end movie save best part end deeply disaster movie though man family issue catch comet attack see magnificent cgi effect character struggle break free aggressive comet satisfy wanted see earthquake tsunamis land slide great film watch
306,enjoy film think act good much good many half naked disaster movie really felt emotion anger loss immersive hour fly past end good well hooray amaze least maker half commit original premise film end appropriate satisfactory fashion little think really cement solid movie like say good shot
307,film extinction level asteroid event lead protagonist rest human search shelter chaos come run good pace overall keep edge script average chaos create something see many similar movie idea far novel scene dot make sense feel bit stupid act score visuals constitute movie watch expect blow away film
308,music background give extra emotional touch overall end world vibe something make movie special must watch side
309,rehash comet movie come except movie want main actor die script make cringe act make laugh another movie like loose status list star
310,learn two thing movie go apocalyptic event lie always know movie make abundantly clear wife good chance make die child go die kid kind movie always sort illness make enormous liability case stay home save people trouble navigate accept fate go die tip hour hit safe bunker hour min drive drive like grandma coke bottle glass yeah make stupid decision character make movie alright
311,usually pretty good value know get certainly start like film able character bite paper thin interesting dynamic setting plot spoiler free giant asteroid little one hit world killer family select rescue take secure location course thing tits film start well effect great everything go well good scene show nasty human time peril excite midway seem lose interest money patience plot get stupid one lucky first try call character effect airplane need say atrocious even set effect take place clearly studio lot scenery paint go embarrass like effect finish everything go rail actually find bored rigid glad end shame start well
312,frankly know rate movie intense doomsday flick seriously call iceland worth good people reach greenland shot improve american people sense geography way related iceland form shape last minute turn like paris ignorant public serve crap happy
313,really think movie end impact occur saw flashback least star movie
314,film really feel like someone accidentally sign give one mid asylum syfy film large budget budget nothing improve write direction see syfy film see everything happen cgi well cinematography fine accent travel around world leave wonder get list film nice see film see screen ten year like everyone else film give little also feel pad like film try make minute mark one two hour long scene see someone tent tent tent tent tent find someone suppose tense becomes laughable like good bad disaster movie character write direction plod unoriginal feel pointless
315,movie thing make sense scientist nasa whoever know comet real problem alert people right hit alert family anyone see government know kid diabetes turn away last moment end movie flashback black screen show open door stupid know outside like still air fire radio communication earth destroyed radio still work
316,account level movie lately close masterpiece entertain believable reallly scary well do
317,movie disappointing seem agenda black guy good white guy evil
318,film highly anticipate movie year one best disaster movie strongly influence also slightly inspired term source physical threat return even well disaster movie actor excellent always like star interest prevail begin movie long way survival movie suffer thrives convince interpretation plot emotion suspense although inferior effect scenography compare consider superior film whole without extreme exaggeration best movie year highly recommend fan genre
319,describe movie one sentence spanish indian soap opera thing miss freeze shot one person face another back first one another one drama scene another non stop till end importantly highly unrealistic situation even case world end like drama scene sake apocalyptic movie see maybe one two second scene meteor yes end movie show apocalypse world meteor hit earth like another second soap opera drama follow family go one scene another kid get steal mum losing insulin medicine leave airplane take phone work couple lose crowd etc get idea one big happy end end magically meet somehow survive give star cause nice shoot obvious put money everything terrible less idea fuzz movie read news portal instead play game whatever wanna kill hour miss anything trust
320,cgi people matter everyone behind scene make stunning visuals possible say many congest highway scene real involved maybe producer simply rent mile freeway stock hundred extras vehicle story letdown much heartwarming dialogue zip around plot hole size impact crater heroic stuff make little sense give circumstance even extinction level event upsides keep criticism mind write screenplay possible scenario feature effect
321,love disaster movie must revise team along production course moviemakers become challenge make fun movie easily rat execution average acting average best exclusion story cliche sometimes happen astonishing sequenses compensate right none frustrate downward spiral movie maker much like seem go make fun good movie average average one
322,manages deliver credible portrayal human nature face danger raw tension fill disaster film showcase good dark side human nature everyone know end world near movie scientist discover giant comet hurtling towards planet destroy hour average man everything power get wife son safety emergency shelter
323,awesome movie watch family race time get safety disappoint usual act cast entertaining movie keep edge seat wonder happen next love whole ark twist
324,well do act beautiful comet hit loved movie yes cheap feel well do forget several time rarely movie family orient make miss movie miss realism love family help country seem comet invasion least worry day get together
325,cliché film ever watch painful waste time
326,annoy movie ever great father mother son family make disicions nobody make sitiation stupid
327,impressive action film lot emotion film real rarity genre take away actor give whole film ice cake
328,pretty entertaining disaster flick film dramatic expect character well write part like family dynamic film also try emotional hook surprisingly well film dumb think much one two plot point feel forced create drama tension like lot think first half strong second half whole like well enough
329,drama relationship love people midst apocalypse make cry recommend
330,ridiculous situation protagonist get united actual disaster movie watch expect something similar come movie want bit disaster time break run got tired get end still know watched move safe area others struggle get backstory easily zombie apocalypse want road trip story family seem help get split way objective
331,gap plot hole silliness way much stress serious whole year might well see fun movie hour fly past love every minute cheat death grin face sweat expect something brainy entertain
332,praise script act ordinary disaster movie much beain stil message hold underneath cliche surface butler watch suddenly turn see reflection black screen unbearable kill someone last image electrical pole burn image cross compulsivly wash hand escape guilt also radio point say third horne revelation well butler pass baptist church even anymore religious mark religious cliche want see warning one warn remember revelation welcome compated last procents own stupid message much people desire superhumans evil good
333,bore family apocalypse recycle zero reference science logic even close sci family drama something random background
334,lack special effect make average disaster movie watchable leave movie bad script lot character stuff noone right set mind
335,enjoys end world thriller genre film specially include cast like really turn something legend keep edge seat none thing happen movie potential cast expect amaze know happen next thriller moment alas expectation run like road kill write story really know go writer mind literally miss great opportunity movie make real life situation basis normal person react specially engineer proactive decision make case board last flight able get hell destruction zone see medication child go never ever trust kid kind thing first place keep essential vital thing document adult kid rest say one time movie really disappointment specially expect something like expect anything like one
336,idea implementation terrible terrible script act cgi send thought prayer crew
337,much film act fine cinematography bit much family drama one time watch
338,movie real hero stupid ignorant egocentric family get call government chosen survive doomsday minute show ignorance people get kill airport mommy daddy check son medic care movie slow dull nothing new old sentimental meh
339,good solid good act composition special effect look realistic good little complain give star still formulaic disaster movie score relative right anything well deserve star give circumstance look new movie entertain minute good hope
340,get apocalypse part brand series play play one argue apocalyptic movie well fill clichees one expect disaster movie average family dissolution society special effect one good one well do moment real tension sit edge seat list good thing act good even child bad cause disaster plausible exact detail threats quite real terrifying film work well without special effect good story well crafted moment unexpected movie genre line certainly worth watch especially watched disaster movie suck gros one good
341,person diabetes high glucose level give person food insulin start work get glucose level movie also shaky camera guy parkinson drama scenes way dramatic save movie though beauty delight
342,best disaster movie decade cut last minute show true raw good bad side humanity family get bunker run big one hit major astronomy one definitely gonna end everything saw screen like gonna die bunker point everything together give son chance choose try parent anything bunker clock count hold eachother flashback happy memory together think good end personally touch move also cause make pretty big point size comet big one kill go black sad touch movie show everything one stay behind prepared die want one try try even use know give son chance start show city ruin teacher taught right comet show amazing effect flatten bloody place month dust settle take year one kill like come know movie sometimes keep fact like make point say big one sometimes stick first end know wanna hopefully end sometimes sometimes think different end fit bit well
343,agree low score review nothing new every disaster movie cliché drag really surprise act great scene roll eye obviousness make cringe fault well do excite like like disaster film plenty disastrous situation people panic run scream enjoy almost like great roller coaster ride know come since ride make less thrilling reinvent disaster film one good one
344,job end world movie slow moment act weak time still entertain watch high expectation
345,look like real beutuful story talk much less explosion
346,series disaster movie year confuse lot rate one hand remarkably consistent almost never terrible always pretty entertaining part hand feel similar safe follow template template happen work also template little risk know go get films sure prove exception rule felt like knew exactly go end moment begin obviously twists character turn along way even never really take much guard yet hate movie fact even give slightly average rating movie look great well put together basically happy nothing unexpected happen accept theatre next one movie come honest probably
347,intense family love saga action emotional rolercoaster ride family go disaster come distant second cool special effect like say action trailer rest high pulse familydrama
348,watch film really impressed much relatable realistic film genre see really imagine happen thrill end enjoy act definitely worth watch
349,predictable carbon copy fiasco run global catastrophy barely escape death fly away safe place choose continue human race billion dead happy end condition accept thing sound like cheap movie plot lot pathetic hope survivor kind movie need
350,absolute stunner end day movie act cgi story everything practically perfect see movie keep engage every moment long time bring game felt every pain felt want character film couple dip tiny plot issue maybe couple line dialogue may love one hell ride
351,bad movie every minute make angry recommend movie movie get point
352,good saving film also enjoy performance number film film enjoy performance anyone else story think reasonable people preposterous go bad stupid child lose insulin go dramatically downhill form load crap write people appear different planet movie best
353,like world end type movie one another level whole time intense wait go happen almost whole movie story kinda cliche worth
354,look drama sprinkle natural disaster flick look action natural disaster flick science fact definitely flick much unnecessary drama little drama actual natural disaster much severe smh
355,survival movie fan really one one best watch enjoy much watch family red heart
356,tense sometimes emotional call disaster movie well one since last couple year fine action drama combine also good lead great job cool see lot try see either fan fan disaster movie nice story emotional well excite
357,decent film like many wake film lately try lecture moralise decent adventure type film complaint shot dark make hard tell go lot film annoy
358,love end day movie right best great act great storyline like style love
359,chaos scene top notched well directed people run around look pretty real thing stand accent get pretty old fat wrinkle face act accent really suck place typical self important wonder redneck truck ask really still look pretty good acting also quite good played minor role movie movie also show lot ugliness citizen self center almost everybody opportunist disaster strike like animal use every opportunity loot rob kill thing quite get guy kidnap diabetic kid simply grab kid mother beat kick car drive away cruel also stupid couple difficult child rather kidnap diabetic kid stupid guy get insulin chaotic time finish movie husband father wife mother miraculously find kidnapped son later might happen movie never real world accent force stop watch middle stand
360,movie essentially say packaging disaster movie good point act quite believable effect overdo movie build tension well times bad point whole storyline main character trouble marriage man affair cliche add nothing overall story progress narrative serf redemption arc main hero scene hero pull person burn vehicle fire rain sky sustains nasty burn see rescued person point come across redemption act adulterous hero add nothing choice wider character make seem unrealistic imagine people volunteer mann army checkpoint admit away family humanity wipe day military maybe know talk imagine even dedicated soldier want family time element film extinction level event comet underground shelter mention huge tsunami actually see materialize film harks back earlier disaster film deep impact except much good far originality film mildly entertaining worth watch like disaster genre save money wait home release
361,let admit actor everybody everyone seem take frivolously never make anything iconic post admittedly walk expect like sci film great concept ultimately forgettable snicker fact country geography teacher say look mistakenly large flat world map actuality become safe apocalypse help wonder fought way find shelter limited space leave outside burn due disproportioned cartography stand correct pleasantly surprised writer understand spectacle disaster nearly terrify ugly awful thing people survive know world end impend disaster film present fabric society tear apart human turn style panoramic disaster shot save sparingly opportune moment aspect differs disaster film convention character try save world depth try save family story stay family everything else happen world deliver sparsely medium outlet result tense grip thriller play towards one basic survival instinct force audience wonder give scenario get separate family refuse someone know help attempt break genre wheel character centric approach remind disaster film share approach arthouse sensibility one foot ground commercial blockbuster sensibility quite land emotionally impactful solid experience nonetheless best film long time unfortunate release time people see cinemas people catch vod later safe see theater recommend solid matinee
362,move story move edge seat uplift main character major fight get high air hot movie everyone want cool nude stuff best bad human nature expose address tough challenge traffic jam wifi boost energy fireball everywhere mon enjoy ride
363,kind like start lot action quick pace middle movie kind slow go emotional overkill get really bad really quick know sound funny crazy fictional movie become unbelievable kind make sense earth movie call come near scene shoot landscape iceland look nothing like icesheet end felt like disaster movie turn comedy end
364,miss ranking military men president panic discover truth missed impact distruction mayhem especially one angel plot revolve around family reach safetyi expect comet action movie general
365,everywhere awful cgi modern movie quite emotional troughout film end nice touch like disaster movie worth watch juist expect anything special fancy
366,movie need rating fact release almost everying postponed movie every bit
367,fiancee like movie dosen like kind movie like fall franchise movie worth watch
368,make think life happen give kind emotion world definitely worth watch fair tear watch
369,story line good movie keep edge seat basically hate new release tell director fantastic job ligting effect sound etc perfect act far best act see year lead lady absolutely fantastic believable lead man also absolutely fantastic movie average people make move actor simply phenominal whoever make flick great work learn lesson need shove teen lesbianism non stop sex scene use profanity make great film film none still kick hollywood as
370,film ever see hope see move
371,bad movie see movie run inspiration music video
372,movie easily since people happy anything even slightly resemble movie budget get propped couple point slow terribly bore payoff sad thing really much good right probably go watch rationalize well really
373,judge movie brilliant movie roller coaster ride love nerve wreck scene destrution nature movie also tell sooner later reality believe humanity form religion like belive god
374,kept entertain scene edge seat struggle family try odds find safety cgi bad act pretty good movie show best worst behave earth know come end
