,0
183,joy tear excitment name emotion pack one single movie exactly movie film action excitement every scene thing love unpredictable disaster movie already know usual storyline watch something unexpected scene love see disaster action movie
184,time silly decision make implausible end kill people
185,rate apocalypse movie come even close stand side side movie like day due incredibly low budget problem try make apocalypse movie big budget order believable movie like film film need big budget still excellent skimp budget apocalypse movie time gonna end rate rate movie fact movie well even close day hell apart fact movie poor cgi movie also suffer overly dramatic waste minute movie medicine scene result straight minute roll eye know exactly go happen next scene movie like waste screen time effort stretch budget fill movie reach golden minute mark afraid movie hamstrung budget nothing really wrong actor budget destroy change movie good try build false suspense many time shoestring budget bad cgi
186,last movie watch make feel lot hand hold camera footage combine lot action movement screen walk movie end feeling like need vomit part hand hold camera unnecessary amount movie realm even alright star movie without camera issue
187,sad force kinda movie know struggle money gamble kinda movie hope never mediocre act follow unfinished story line many flow start finish movie like pissed walk cinema give movie hope good friday family fime say pay see hater mather fact love kinda movie english
188,decent actor movie crap writer throw bunch dumb scenario together garbage movie get finance
189,terrible movie soon know kid diabetic clear movie revolve unfold full clichés terrible act surprisingly dumb event time story even insulting people simply want entertain watch disaster movie night disastrous
190,poor script poor act one hilarious non logical decision another character constantly behave like low idiot especially wife like child painful watch
191,best plot hole like swiss cheese incredibly boring speechless deep impact well
192,bad movie decade horrible plot copy anything theme movie cartoon comic original moment whole film horrible act horrible want throw many time garbage awful music cheap production probably expense actor wage movie get use covid stay cheaply produce garbage worthless actor world want
193,enjoy read review please follow blog type movie always rather divisive critic audience simply due nature wise never groundbreaking innovative shape form apocalyptic film always follow formulaic screenplay pack logical inconsistency also ton thrill action vary quality depend studio well sound design technical aspect always try best accept everything movie throw irrationally viewer prepare open mind usually issue actually find science work argument bit nitpicky subgenre fail deliver thing expect planet killer comet pure popcorn entertainment positive aspect cast two three sequence genuinely excite already use sort film series problem portray another thin character real motivation depth go simply plays wife deliver good performance enough keep engaged end flick good sequence really good scrap giant comet hit extinction level event look great minute runtime far satisfy expect screenplay generic like direction really offer anything remotely new narrative decision relate science technology accept part usual illogical stuff definitely pass time since consequence whatsoever precisely like dozen movie subgenre without technical aspect end elevate overall picture vfx look date sequence almost like enough time money finish mean static image meteorite shower sky come across amateur lazy absence powerful score make action scene feel empty like something miss fight moment pretty much impossible see clearly due overly dark environment choppy edit action walk line decent terrible significant slap face planet killer comet everyone go look forward soon enter theater way work around entire film build third act massive comet side must show hit ground splendor gigantic explosion ridiculous proportion endless smoke fill whole atmosphere distinctive sound impact moment make break apocalyptic movie go write break end predictably underwhelming pack couple genuinely exciting sequence decent cast try enough compensate everything else expect formulaic screenplay add unique storyline innovative aspect genre well basic direction fine action deliver people want see sadly component also quite letdown occasional riveting scene entertainment level pretty low due unimpressive visual effect lack powerful score poor edit culminate view killer disappointment absolutely love apocalyptic film maybe find something enjoyable type movie suit preferences one surely go convert
194,directs worth mention unless one focus potential movie
195,premise failure predict piece comet go impact accuracy make sense stay put rather bug stupidity premise outdone stupidity main character cliche layer top cliche
196,run idea left much bad copy yr old cgi course well truly suck
197,take know last day new release big screen cinema keep tell gonna love movie embarrassed movie hardly cgi hop except scene debri meteor fall onto car count hand amount special effect disappointed movie warn fellow movie goer watch less mediocre movie home waste time money go cinema loses husband decides hey let trek across country dad know insulin son huge chance come back car look leaf small note car anyone take long night scene shaky camera struggle actually see hell happen hop daylight want movie end put misery
198,expect usual disaster movie full explosion vfx focus family quest reach safety government bunker world end family survival journey encounter many difficulty try different movie genre appreciate director take different approach consider also apocalypse movie similar flat development wife really annoy think cry time try best unfortunately deliver convince performance convince actor play kid lot bore uninspired dialogue serve increase runtime want really different thing focus human side family show complex emotion add maybe tension moment problem want take different approach rest disaster movie time want one blockbuster end really understand movie make sure people love apocalypse movie enough action either people like watch something deeper one single interest dialogue character personally recommend movie seem screenwriter director even try good product
199,love kind movie extinction alien invasion sort end world heroic savior human action drama movie movie reach level early film seem make like anymore want action hero topic movie something special memorable forgettable story waaaaay well
200,interest whole time never get bored watching
201,act plot believe watch crock must hard put name plot poorly execute
202,time waste like emotional roller coaster either get seperated silly tragedy main character something drop close curse man
203,movie warn label viewer five year
204,see action daytime movie good idea combine marital problem end world world end tomorrow pretty sure relationship issue one last thing people mind yet make prominent part movie silly
205,one word bore two word childishly bore lack usual story line one situation next really unrealistic way teenager maybe enjoy movie
206,movie predictable unbelievable many way comedy still stink
207,enjoyment flick depend totally upon one disposition le permanent prefer mood watch work art tell story comet hit see want kill couple precious hour life opt watch something unpretentious lowbrow make habit
208,really quite look forward see suppose thrill minute turn predictable sick kid leave med car get separate fuel spill sorry predictably disaster film
209,learn movie parent decent education job save life deserve die poor uneducated family important people worthless
210,story revolve around small family much visual effect expect visuals like movie star act lesson try give moreover useful instruction incase disaster
211,great example type movie good enjoy like disaster action movie one different one see come space cool anxiety induce generally good time cliche
212,see many time year white save family certain death save world rush back get son life save drug car give son look course drop petrified crowds scream people try save want script year old let know
213,manufacture emotional rollercoaster go wrong everyone make every possible dumb decision heighten artificial conflict
214,comet stuff way world react special effect great really edge seat really believable love disaster movie like first one realistic opinion say get people make one bad decision another like zombie movie people scream screen super annoy maudlin love son every time scene also annoy love see movie like well do people make decision make situation create conflict stupid people make stupid decision comet stuff really great realistic recommend alone
215,set expectation low still movie disappointed decision dumb decision also extremely biased cast good guy bad guy wokeness make sure every person race help hand hero good guy select evil character must make sure race exception part except main hero solely cast lure big audience disaster disastermovie
216,see sound really good disappointing poor choice another cliché slow actually
217,stupid moment another choice another movie
218,start good devolves break marriage reconnecting dinosaur killer asteroid cause ice age thousand year sun one hit atmosphere clear nine month kid go cave maybe month insulin month later still good
219,total lack pleasure watch last night neighbour like woman hour make disaster movie mostly car motorways roadblock think literally effect shots trailer copy stuff film without best reputation think great entertaining top comedy thing like drown syrup shmaltzy manipulative storytelling family drama crisis fail terribly wait end limit actor highlites limitation basically everything wrong today redo thing do much well absolutely reason thing resist one new idea shot justify existence cringeworthy favour something else hour cos painful outmode trash
220,like visual effect like doomsday like
221,many thing defy basic social interaction amongst people special effect really cool rightfully reject diabetic total lack critical thinking skill well put parent charge save world realism see closer moon give scale airplane fly foreground alert people impact select surprise thumbnail math move extinction speed say hour tktag physic medium broadcast doom communication still run even announce radio second seek shelter molten meteor shower slow molasses comet give second warn notice dutiful medium help instead get family shelter idiotic general need something hurl sarcasm screen friend
222,say bring nothing new table felt like brought le movie category ingredient disaster movie simple annoying time lot fun watch friend watch felt big letdown love see movie continue deliver little promised might like
223,bad need disaster part drama dis bit moment say kid diabetic know subplot problem cliche boring month sun back etc pretty sure able see even glimpse sun year since take ppl find insuline kid month anyway decent warch especially
224,world movie go cinema expect bad get bad person always want see next eotw movie see cliche one start yet white rich family though woman break marriage kid illness diabetes always diabetes diabetes fact give straight away knew immediately go happen kid also smart well behaved nice get kinda bore represent moron whole cast tall skinny person change guy obviously accidental hero throughout movie woman hang around child seem anything also ask man idiotic question know answer since situation main character guy stupid heroic act multiple time movie doubt play macho man fantasy director screenwriter good piece want waste couple hour need movie drinking game way pay see damage already do give credit fact kid great actor world include continent even mention country guess many idea make laugh cringe even well spend risk
225,million production movie think million give butler worth watch
226,family cellect goverment do many stupid thing father bad act borning movie
227,realistic recreation possible event comet hit relation human behavior extreme situation observe important part movie non stop cgi action probably think see movie trailer admit name say much check strong sci background already
228,must say movie way well expect afraid succeed much due covid hand kind good timing everyone attitude depict much see far crisis like perfect movie
229,liked movie like plot think actor good job movie two thing bother first bag blanket suddenly reappear mother son reunite happen thing suppose crazy couple car son kidnap character arrive nice show real landscape even movie go call
230,tonight felt like stop hald way stupid movie asteroid hit plot enough write movie back writting school throw kind stupid idea reason ever raid pharmacy okay bunch goon start shoot place wtf guy give wife kid ride north end kidnap kid ridiculous ohhh yeahhh kid diabetic like writer meet every idea make bad make movie
231,thought might reasonable movie watch disappoint story predictable interesting story tell half time many event far fetch stupid like low level movie miss
232,family drama little bit action thrown disguise disaster movie minute long story quite boring consider subject matter
233,total disappointment least say suppose well movie feel maximum cheat name felt bore death watch family loose first son husband loose wife three end search fracture plot incomprehensible way ordeal end let search lose father start bet family lose yes joke four meet kaboom happy lol seriously underestimating cliche whole thing talk one hundred mess unsustainable fracture cause frankly worth wasted time rat
234,often cinemas enjoy big action disaster movie big screen unfortunately
235,film like lot wonder discovered budget film low talk disaster film full effect look like cheap film almost everything definitely watch near future recommend film everyone
236,time take time write review absolutely completely disappointed call hand medium light skin tone
237,film suprised positively old cliche really disaster movie expect character superhuman fumble fight afraid also make poor choice story overexplained president speech truly rare disaster movie way society break totally believable action story building good leave final end give star see fun ride
238,act predictable plot time desperado mode
239,expect much movie thank able watch thoroughly one best act performance ever see film storyline perfect entertain audience fan world destruction flick thrill suspense caught wild imagination understand people thumb movie pretty decent fact best movie see far
240,movie revolve around family really care less start movie promising cliche face palm worthy moment end skip last half movie glad interesting fresh good actor
241,see indecisive frustrating movie even wife yell sceen
242,awful movie thanks dad plane full people die son truck get nothing mom tell truth kidnap son thanks family lot lot people die care stupid
243,film scene scene world war minus zombie good watch mmm
244,movie decent act fail understand important father give band mean refuse already issue give people
245,always look movie hit right way feel privileged watch film change everything actor superb dialogue movie amaze special effect today enjoy movie many level care character put shoe emphasize pain stress situation encounter decision well really tell right thing magic also true fashion superb effect sound call great entertainment able watch film ask every step way let grab ahold see
246,movie catastrophe movie social behavior movie focucing wthat already know peple always act like moron idiots aggresive horde sheeps come survival movie meteoric scene destruction movie show nothing new term human kind behavior everything bad humanity movie hour thirty see separate family find way back together bore predictable line
247,give cause hell good script proper storyline best act performance great cast great action stuff like watch action film back day teenager old always give best one favorite actor worth watch give bad rating maybe expect worthy thing film sit back enjoy
248,understand review watch tonight partner think brilliant well act believable character good plot great special effect well think write edge seat throughout film really fault way even try nit pick watch good apocalypse type film think type something different recommend friend family worth watch
249,do charismatic actor save flop message movie try send wrong insult one intelligence tire line old use quote make movie lose credibility romance misplace funny memory utterly place dysfunctional family come together difficult time sell make normal family still gorgeous enough save flop point wish fail even expectation match
250,watch hour film cry sprinkle scene asteroid
251,good thing first target choice realistic general public panic lot shoot otherwise one brain cell generic script character cgi art work also poor wonder case deadly comet selection program big shelter support large population least year exist small one house military personal pps plain fly skys fill ash earthquake destroy even bunker
252,really hard watch half time fast forwarding begin promise even good story endless car ride long goodbyes well use hr
253,start get mediocre fast end lot stupid emotional moment make cringe world go hell everyone distress one woman think need important issue involve see get somehow always way annoy stupid cater classical cliche womn disappoint rather face crisis orderly country like chaos immediate collapse sociaty order moral get depict every movie type
254,terrible script write look forward find really boring korny
255,nearly decade involve many underwhelming actioners put league definitely bad feature neat performance lovely level suspense mid portion plot family try beat apocalyptic odds time due large comet name hell nasa get safe place characterization quite generic nothing make memorable person fact structural engineer world need post apocalypse big question film like well action disintegration craft cgi range crappy decent relatively low budget disaster film become evident time well portion family get separated viewer start ponder probability eventual reunion filmography mixed watchable actioner like couple gem half arsed becomes obvious storytelling film lot good writes script screenplay lose suspense third final act end tell story hear zillion time get hour kill work keep bar expectation pretty low
256,course typical trope world end movie annoy thing however butler change accent lol
257,look tense edge seat film tick box thumb light skin tone
258,disaster teen height disaster movie trend film etc human drama also plenty disaster move decade get pay great special effect city destroy etc film give none human drama steroid explosion quick less spectacular end absurd student know cataclysmic event earth take hundred year earth recover comet asteroid nuclear stupidity atmosphere age afterward poison sun block well whole lot dead stuff people shelter emerge sunshine clean air nine month impact plain old movie stupidity shelter door open still function descendant people save emerge shelter pretty much know new well design well equipped shelter exist day read like mini city recycle water air waste facility botanic garden grow food etc design outlast effect nuclear celestial disaster effect old cold war bunker plus side actor good role
259,movie example frill storytelling super space ship magic subway train save day story human confront catastrophic natural disaster individual way continue theme never give read negative review proclaim unbelievable saw movie saw many review say unbelievable well yet pandemic happen suddenly people change mind saw eye successful storytelling strength
260,soft disaster film character unrealistic cinematography conventional special effect fine script well masterpiece watchable flick similar lot well disaster film
261,one appreciate take disaster film focus family quite reasonable struggle stay alive earth enjoyable time least cast member quite awful though include two third main cast pull although fair best effort either part write pretty lackluster much obvious character make stupid choice reason set supposedly tense scene worth watch find three ten department
262,admit expect disaster lot good annihilation movie act okay script fairly predictable effect bad movie nearly good good way spend hour
263,nail bitting surprisingly entertaining make huge impact pun intend disaster film family fight survival planet kill comet race think another disaster flick think keep tension rise scene scene feature really good performance scene even feel like watch zombie film make want yell screen course film blockbuster clichés around great time promise disappointed snobmedia review
264,structural engineer marriage trouble son diabetic comet come get evacuation order part select group section middle movie find mojo becomes quite compel problem lie begin last section begin people sanguine comet small chance news play doomsday scenario government secret program worldwide conspiracy keep impend devastation secret way big danger keep secret long told friend certain thing tell gather food essential find close deep mine cave system bad problem calibration people many dumb stuff middle best family get separate think stumble onto compelling theme story thing start go badly get worried separate emotional heart lead conclude climax reuniting problem end world problem lose whole last section become anti climatic despite pretty good thrill meteor shower action like make sense anyways last section lot non sense
265,opinion lot action scene every scene give chill curiosity watch like scene airport felt feeling world war type survival vibes disaster go happen world panic preparation moment tho even come close movie tht mention similarity somewhere show love importance family worth watch say one good film btw bad eng
266,base disaster cliche old offspring put retirement home offer work good average nice formulaic wife family course love much style photo phone live formulaic life burbs predictable personal problem well half disrupt nasty inconvenient formulaic extinction level disaster event spite fact present work stiff family special special bacon fact postcard perfect pluck terrified expendable mob humanity get entitle self start well choreograph competently direct special effect laden disaster romp look like every disaster romp see might bore new disaster flick however around decade tire fare offer nothing terribly new fresh also push notion equal whilst show quite clearly
267,problem people get help talk much
268,act good good point minor plot predictable do well realistic bit frustrate watch one man bully much survive though wonder current time covid visuals stun lazy afternoon watch end world movie little commitment
269,movie extremely entertaining good acting saw yesterday imdb movie blow water comparison
270,think woman wore kilt male outfit well perhaps non consequential goof jerky camera movement get annoy
271,hour end world people still work road wonder get pay double many bad decision everything make sense give love genre look past incoherence still enjoy
272,start feel intense feel something come intense movie turn family struggle stay together stay alive see beautiful landscape make feel beautiful planet verge destruction scene satisfy take realty account also like big disappointment movie something miss
273,surprised positively story event unfold surprising though fairly cliché feel act dialogue overall good involve decent stubborn hysterical kid otherwise norm ridiculous movie whole continental plate flip upside much believeable seem alot realistic plausible point movie scientifically seem right big part end really hold science either still quite nice much focus cgi effect people work well mentioned story bit disaster type movie main cast constantly run obstacle along way expect also time make poor dicisions nearly many one fear end consider lowpoint movie still give
274,world disaster movie good showing humanity still exist among even different race colour language balance people turn good bad strict soldier nice soldier
275,hit cinema everyman action hero lead charge go think save world fact light year away well disaster movie planet kill comet call barrelling towards much small story character must everything try save estrange wife son story explore notion human survival instinct end world know make immersive often stressful view woman mother push brink face worst human nature compel make authentically troubled couple anything need save son gonna lie saw trailer certain pretty much do number disaster movie pleasantly surprise got instead narrative unfolded plausible convince way augment kinetic concise delivery talk award worthy life change really great big screen covid distraction thoroughly enjoy
