,0
0,add anything new catastrophic event genre yet perfect movie watch amid coronavirus pandemic sparsely populated movie theater wear facemask think much bad
1,go tonight girlfriend two people like kind movie love native language keep short well make apocalypse movie evolve make feel contemporary vibe refreshing like downtime lots emotion twist like bad cgi point
2,end world movie follow storyline one little extra like way handle realistic way scarier usually like see lot destruction action definitely recommend watch
3,hard watch feeling already see new movie problem check disaster kid check kid health issue check wwz scene check wwz drugstore check wwz almost forget earth space end check special ruin check
4,know scene come hell anyone movie pack character poor judgment take idiotic decision possible hysterical do sole purpose generate obstacle create tension work create lot tension aim towards scenarist blatantly take imbecile quickly find wish death main character make thing much good movie last minute
5,planet destroy asteroid hour strike expect call world dig must house arrest follow family try get safe place world around turn chaos people seem put effort loot shop toilet paper hold end world party make route bit like try save family drive ridiculously oversized car meteoroid forget corona two hour mindless fun
6,overall mess movie love disaster film seem like disaster theme take back seat family drama film load scenes parent scene try pull art string get tension comet easily replace wild fire film lame film truly awfully bad scene overall terrible plot development lead guy construct building course go vip new world comet hit poor write lead character drive onto runway prevents plane take pilot argue say full capacity say take wife son refuse reply one leave basically blackmail pilot reluctantly agree take kid mother erupt demand take sigh ask hero much weight lie weight call pilot accepts entitle family say sorry passenger board plane gtfo
7,mess child keep sit wait christmas
8,bad review movie awesome swear people hard please day film definitely heart race get extremely intense several time one favorite disaster flick eat heart highly recommend give movie watch star thumb
9,start good natural disaster way medium people seem react somewhat limited amount cgi leave lot imagination make nice background main story drag atmosphere main plot poor write mess fill age old recipe seem turn movie series fetch quest tedious look make sense waste potential try add drama even need event dramatic enough
10,movie classic end world hero flick tick right box course awesome although surprise come main plot enough unpredictable event happen keep entertain edge seat
11,comet hit people people people people hit drive base comet hit
12,time find bore think self go end impress good tho character bad either beggining movie think potential great film clearly wrong
13,love disaster movie still rather low expectation one hop pleasant surprise unfortunately unpleasant one cliche way still make movie exciting expect even director try surprise viewer make movie really even screen cinema release straight stream service truly disappointed like movie normally script cut
14,movie character annoy wife kid annoy stupid hope die film
15,follow sentence wrap entire movie giant comet head way automate alert suddenly appear continue shop nothing wrong confirm let family waste hour pack clothes lot yet forget take anything help survive perpetual cold dark world write thing
16,raw tension filmes disaster film showcase noble dark side human nature everyone know end world near spectacular visuals emotional narrative frame harrowing experience one family movie definitely enjoy screen
17,waste time boring movie cliché action scene see trailer
18,see disaster movie want know science cause behind world change want see guy try save wife child hour egoistic pursuit microorganism family save little ass ignore friend relatives neighbor child step everyone everything get save irritates endlessly whenever see movie actor repeatedly scream wife kid please please please want see disaster movie romanticize idealize happily ever end relationship man woman idealize version sweet little happy family need center movie around bias movie way cliched woman divorce husband cheat woman angry man try best major regret child need constant medication exactly movie short description family struggle survival face cataclysmic natural disaster struggle survival try get save place finally get bumm write original script without clichés give real disaster movie
19,spoiler whoever write nonsense tower genius copy chemist scene directly reason kid need medication film poor quite believe ever get green lit unrealistic scene apocalyptic scenario outside yet open huge cargo plane ramp door let one man result whole plane destroy comment hour stop watch brain hurt
20,whst find google two min mile wide around size kill dinosaur possibly bit large mean massive tsunami extreme volcanic activity around impact zone accross globe ozone layer destroy sun completely block earths crust damage thrown earth atmosphere rain earth fire possibly decades earth like live oven almost everything planet burn die due lack food initial devestation way able outside hour day week even month happen see sun shin bird fly around like disaster movie come make effort research effect giant mile wide comet fragment collide earth mention numerous fragment
21,last year sadly become synonym movie flop rarely movie last five year either bad completely awful last name last part less exciting wwii thriller one worst movie make last year go certain level skepticism seem gotten lot smarter choice quite entertaining motion picture fan disaster movie mostly always follow bore concept namely family get separate stupid reason try find next two hour journey complicate various obstacle human nature kind doubt disaster movie fortunately little excite creative kind last year movie begin visit wife son separate seem get along fine fascinate star asteroid shoot towards earth invite friend presidential alert appear phone tell pack bag drive close airfield get ushered board plane separation plot kick stupid usual might sound like typical disaster movie trust quite smart handle character plot always straight forward movie try less create tension loom disaster rather human element different character family member meet way get experience family member five six main character agenda separate stay focus movie meet good bad people along journey like particular honesty director handle character people selfish greedy even situation like one work together important people still think movie work also good chemistry couple hard time still love anything stay family really good good year difficult role something beyond skillset serious dramatic usual tough guy part time happy see growl butcher accent still butcher least character charm likable overlook love tenderness show face time one never see particularly important scene see self loathe disgust face believe always glad finally chose movie allow bring full talent good especially many major role yet movie hope soon really capable actress certainly worth watch chance current situation allow see next month release make welcome change pace
22,start finish later one word spoiler symptomatic big fail patent lack imagination flic least entertain release vie top spot darn predictable vast sum money waste deliver sophistication dollar use find movie terrify original concept sorry one take
23,man warn seek shelter comet small gravity lock companion decide planet earth good way break fall man begin trial wife son attempt stop comet survive impact aftermath do instead witness attempt find shelter hour large impact crater recently discover icesheet biggie believe trigger last ice age previous location magnetic pole perhaps even close although worthwhile man destination safety extinction level event occur safe movie title go hour leader unite save specie perhaps style suicide mission secret project evacuation nope impact get see everything except get drama dad get evacuation flight son insulin leave car knew action like riot loot traffic snarl people try drive somewhere anywhere presumably get film clichés notably one start destine new must disaster movie clichè inform must evacuate immediately bring wife diabetic son phone set speaker neighbourhood get together new record lose friend new clichè saw first go downhill disaster movie set bar low win material fair actor demand prolific one forgive stinker due vote comet early nomination announce winner please
24,must admit certainly expect disaster movie writer director actually manage deliver get wrong say bad movie say movie entertain enjoyable certainly movie way generic mundane predictable disaster movie afraid say movie frightfully devoid massive scale destruction good however hop get see lot destruction meteor fragment make contact destruction scene definitely good look doubt disaster movie nowhere near enough destruction pure cgi mayhem throughout course movie say though cgi special effect movie definitely convince look real good screen thumb cgi special effect crew felt like family drama lace end world disaster theme point throughout course movie really feel like world end mention movie premise stag director come admit really sit watch family drama go played play amidst end world scenario end world spectacular effect showcasing destruction sadly really great term disaster movie movie good ensemble actor actress say carried movie quite well child actor definitely also add something good performance nice see movie shame give screen time watchable entertaining turn felt cheated grand disaster movie experience one thought put disaster movie shame knock seat throne disaster movie rating ash settle stand mediocre five ten star movie way generic follow strict run mill make disaster movie blueprint
25,idea usa build enormous secret bunker foreign country save event global disaster lip bitingly difficult get past though enjoy rest love love comedy drama beat hand tongue cheek end world humanity scenario
26,decent end world movie deal happen ground one family interaction desperate people act nice special effect watch
27,effect story like constantly bombard pun intend message scenario bad non good dangerous way round make real stop preaching please
28,movie everything good come end stop win since first half hour terrible almost painful watch actually get headache watch story base disaster happen basically drama bad decision bad everything think write bad otherwise write testimony mom let soon kidnap like untie boy sit belt grab hand let people take depends insulin live come personal purse jacket pocket whole drama start damn insulin scene felt like cheap copy rest drama evolve catastrophe happen waste time give history potential actually something good get end bad
29,like impossible dumb film film character make dumb decision every turn dumb film go hope something bad happen type film insult mind even mind numbing veg category simply bad bad bad bad whatever film whatever storyline bad able sue film maker thing bad recompense time life waste watch case hour like dumb film dumb decision
30,liked movie like disaster movie standard recipe divorce nearly divorce family still get movie show special effect impact movie mostly breakdown society sudden everyday people confront despair find amusing comment character movie portray negative selfish care family people tend situation life death ever look report news people claw others eye food distribution war zone know well food come imagine whole world face imminent death pretty like group party till music stop regard end arrived base diabetic kid kid survive month clear begin avoid people require longterm medicine run shelter clearly look unused since decade know comet since day like prepare place place like nuclear blast grade old shelter month know need positive fluff end movie well box office anyone pay attention science class remember impact suspect sky properly clear several year still give act good overall story disaster movie never best friend remain fiction story
31,way long much happen drama thriller everyone stupid stupid shizz real life first die
32,absulute piece trash know usually disaster movie oscar win one really bad feel rush dumb try save family plot like always movie like always family drama think enjoyable much well disaster scene
33,cliché nothing new one dozen movie remember movie minute mediocre best
34,suggest people watch instead watch total waste time piece one want watch people try survive run movie remove category put family cliche drama ton well sci movie someone rewrite script well know subject useless garbage
35,feel filmmaker want make profound social political statement lack foggy notion say perhaps earnestly believe incoherent babbling come across somehow deeply profound earth strike comet trigger extinction level event ordinary comet comet existence come complete surprise nasa track precise path near asteroid piece space junk several thousand satellite somehow miss humongous comet head directly wipe life planet comet wreak havoc destruction course several day first chunk large enough wipe entire city meteor shower molten metal finally chunk size wipe nearly live creature filmmaker explain nasa miss notice many object hurtle toward planet fragment manage remain roughly trajectory hit move target travel hour million kilometer day lucky president implement plan except without polygamy fly choose wait come huge underground bunker manage buy island secret seem need bunker citizens wonder plan evolve real life insist merit base selection process withhold fund unless choose represent ethnic cultural diversity populace spot reserve undocumented alien geriatric politician filmmaker never try explain chosen choose president never see reduce disembodied robocall voice family must contend force nature uncaring bureaucracy society devolve anarchy various criminal existential dilemma grist several distinct necessarily compatible movie genre result incoherent pastiche familiar trope scene derive film
36,movie lack kind action think kind budget amazing cast something good interesting definitely lot wow moment luck hour extreme boredom plot fall flat edit joke character depth favor fast forward one scene worth watch end credit
37,introduce child ailment first act use second act fingerprint talentless executive say kid sick plot point later also say marriage rock rejuvenate end classic family separate impossibly find late forget gotta old crank refuse leave home even though go die like see disaster movie without tired cliche challenge write story rely classic trope
38,experience extinction event family choose lottery amongst save take military plane take safe location disaster strike soon matter forty something hour leave plane mean almost certain death chaos realise lose insulin kid father run soldier asks plane leave enough time get note time hundred people try aggressively break facility get onto plane ask insulin medical care location go go downhill minute later
39,white people movie portray terrible people mainly white people loot arm gang enters sore loot yep white bar one guy white couple kidnap main character son couple white guy attack main character back truck white woman medical official time main female character try find son contrast black people movie saint like one black guy gang arm looter help main character get danger one black guy back truck befriend defend main character attack two white guy truck black female military officer break protocol try help main female character son black medical volunteer come main female character aid brush aside white volunteer blatant white bad black good attempt virtue signal think watch feature length advertisement find hard concentrate story respective character run around aimlessly every time face adversity dark knight come along save moment pap
40,saw trailer cinema look liked film bad watch watch selection character care drain disappointing film castaway dustbin history
41,disappointed levrl use actor recommend waste timr
42,movie scam like watch zombie almost exact copy movie easy predict go happen next movie waste time awful awful awful
43,get bad review pretty good consider movie suck one start kinda slow min get interesting intense throughout edge end think cast exceptionally well
44,movie something nice tender predictable sequence event unfolds start typical protagonist introduction bos man construction thing thing really kick high gear introduce run treadmill know woman get fat need exercise like time course open mouth usual woman stuff get snack come back minute include kid scene annoy cringe everyone involve still kitchen get snack tolerable minute tell movie end way start predictably bore probably large sound effect million pyrotechnic cringe worthy line forward bore
45,review greenland like metior film may see previously previously unknown metior heading towards earth one sure strike random people choose shelter follow story one family try get one shelter stupid think unknown metior know impact resource disposal simply true film way realistic compare similar film metiors see aim order way actually annoy major part film include ramp suspence felt someone chosen shelter think government know long term medical condition secondly marry couple want steal wrist band simply steal son write promised excellent film actually turn quite disappointment honestly skip first minute film try build character honesty care
46,like people cook keep add salt dish think improve replace salt explosion grim dystopia ever imagine world watch movie need hug think even watch single second movie tell good long common sin movie maker direct era really need see love father assume bit fast forward watch mess first place disaster hear movie bad good like campy whatever one movie bad freak horrible meteor hit toilet riddance hit next rest hillbilly state soon election government plan seem save annoy family
47,living corona time due environment around movie get mind make believe world actually go end superb movie amaze storytelling direction favorite top class act lead lady also amaze job put movie category movie entertain grip forget real world around start believe movie night light
48,film dumb story see people scar lose go way way end world film see one lame nothing special pretty vanilla even proselytism show film recommend watch first ten minute last minute way waste two hour
49,understand comment refer repetitive standard disaster movie lay movie impact space course element use go similar previous space rock movie like make another movie complain shark one do however efficient convince effect seldomly consider film good enough merit one outstanding hour solid entertainment do fraction budget many disaster movie brilliant
50,need shot big one hitting soon family run around try find fireballs type movie do expect one good
51,watch new release fiance laugh lot movie one make money scene resemble hurl hot rock move car meteor shower land randomly across surface movie also far violent suitable young viewer ever think
52,best disaster film ever listen guy say cause ten trust film
53,release part last week first week clearly do avoid slam critic awful junk plot make sense either science perspective social perspective human interest perspective occasionally suspend disbelief plenty action film case great action compel action fact pitiful leave turgid endless stream cliche family drama might decent refuge full global warm massive asteroid strike cause massive cooling similar nuclear winter want tropic
54,auch event ash induce ice age remain atmosphere year magically disappear little silly consolatory end destroys little good movie
55,emotion live every moment film inconsistency forget put place main character
56,bad decision people believe complot theory disappoint
57,film great suspense act action sequence plot similar disaster movie felt little clishé fun popcorn flick recommend disaster movie fan
58,think script self plain nothing intelligent acting pain look people face run without clue blame decision make nice see make one interesting choice fell well expectation main due fact even though knew probably much way neat special good fact enough dialog go one least spend much time look people sit car occasional jump car get car jump car get car movie go
59,overstate distinctive charactersrecommend see sure fan catastrophic movie disappointment
60,new actually something new like fact storyline traffic chaos weird guy want kidnap child reason understand action destruction call show nothing besides ashy wasteland two bird fly omg happy mean course expect excellent burger decide eat good bad guilty pleaure kind bad well imma watch see
61,think explain might one best kind talk realistic catastrophe movie good act two hour thrill ride also intelligent quite realistic catastrophe movie thought go best rule alien kind like day good either film great story build tell much thing like question still answer later explain tension building good way film also make care main person sweat scream breathe heavy run actor ding great job film well act full great actor even small role also ad plausible story mostly good cgi much go wrong cgi perfect good especially fire comet fraction film even take time ask good question reveal film actually make debate well change react comet hit earth film also careful stereotype generous good script al well make really film maker look love impressive fact impressive far see theater film deserve large screen watch tomorrow
62,definitely far best movie make good way pas time weekend night end feel waste time standard disaster movie plot end safe family get separate say give watch
63,nothing like time disaster film coincide similar real life event minus devastate consequence course release comet course sky astronomical phenomenon bright become bright visible without visual aid create stir around world comet however different idea cosmic entity announce spectacular harmless view event become rogue piece enter atmosphere mostly burn land ocean thrill piece make landfall follow family make way safety estrange couple work together bring son ordain government shelter catastrophic event urgency build film visuals worth look terrify scale yet surreal beauty one highlight even extinction level fragment make way within hour first impact focus family tribulation expect smooth sail part film also use showcase bitter side humanity people disregard great good sake self preservation message also hit home pandemic world struggle cope errant behaviour public extremely disturb expect say way execute come across little trite time scene stranger party hedonist couple hijack situation false samaritan writer vignette much cliche season audience also direct scenes little depth often deliver message character stir motif clear good bad film family get separate episode get even pronounced bad still situation run veer dangerously caricature many stall highway hitchhikes take way people drop main thread discourage emotional investment viewer try episode repetitive formula know expect disaster movie excite side character bland big lack come main cast likeable film family ditch friend emotionally blackmail officer part even endangers everyone else sake save family ode family loyalty admirable point situation start make seem entitle one really want root entitle folk non stop badger information officer try job allow exceptional waiver case throw great good wind without much blink eye try negate scene good random stranger random puzzle convinced people cheer still win premise effect minus incredibly flat orange color grade lack endearment character leave title without much impact
64,kind story end world movie bad action less performance time well make believe character one second minute end ask movie call maybe second suppose movie watch something else anything else actually
65,director movie panic disaster felt real cgi good sometimes tbh overall expect movie good really intense
66,great movie ever see think movie least
67,shock bad scenario use movie totally junk
68,crappy movie million people die hey three unlikable main character get saved sort stupid situation stupid stuation endanger everyone else selfish behaviour right yeah government spend public money building bunker case save engineer family case meteorite strike also good carry people airplane free first get bunker strictly elect say government doen matter anymore knock door soldier send truck pick sorry as list go
69,read title right expect see impressive visual effect comet rain globe destroy civilization hero run life prepare disappointment movie basically family drama disaster backdrop short sequence happen screen see do well movie genre star cast effort rare disaster scene
70,doomsday movie predictible start simple get bunker get everyone able meteor place earthquake volcano hollywood try change thing
71,wise completely pointless movie even whole time mostly see face main character tell nothing see humanity fail time flaw flesh even put focus see disaster background kinda beign nothing beign movie couple go vacation minor problem road
72,movie make let alone watched actor lose sort credibility star hour long lobotomy movie
73,visual effect predictable storyline cheesy shallow conversation waste money movie theater good movie watch bore know anything well watch home
74,bad review enjoy film totally entertaining piece cinema edge seat whole way move ultimately satisfy
75,get notice grab wife child relocation spoiler comet striking piece story short get separate come together hitchhike burning convince thrilled type plot disaster film sex nudity brief strong language miss
