,0
76,give minus like watch slow move train wreck watch hoping may improve sink next low level keep go rock bottom
77,best film witness pandemic response people grind organize plan halt find pro comet positive side least organized plan alternate timeline
78,must agree reviewer movie entertain hour run special effect classic disaster movie clichés demand movie think several time find film bore almost bit cheeky second second seem screenwriter look film think actually shoot little bit different spoiler movie greenland man divorce learns imminent end world want save family make away home odyssey begin job info guy meet chance learn ark want end manage get illegally ark live one film end dramatic opening gate ark finally look world end aka man separate wife learns imminent end world course want save family make away home odyssey begin important job information guy meet chance learn bunker want family end manage get illegally bunker live one film end dramatic opening gate bunker look world still stand end know disaster movie genre reinvent basic feature surprise little new film show aspects one realistic disaster movie effect unfortunately think star want watch movie take mind hour spoil bit action special effect right place others want see really good movie surprise amaze another time
79,old run mill apocalyptic event cast race certain doom reminiscent
80,production company take make clear one want take risk money loose take bit easily recognisable hole character development exposition disappoint depresing future classic box office hit
81,masterpiece want two hour excitement one trick illogical decision maybe someone get tick slow move emergency hey jump shout move way want good end time movie actually want wife often fall asleep watch film wide awake end
82,wait movie since long thing get watch disappointment problem story line concept goooooood
83,amaze best look real death blood comet asteroid protest thing look fake best especially base similar current event covid pandemic something serious like extinction judgment day etc also look confident experienced real immersed event best pandemic apocalyptic movie like etc watch emotional exciting
84,mediocre film stand quite good virtue compare legion awful film come worthwhile audience accept loss quality entertainment otherwise gain much diversity hire practice progressive ideology pass new normal villain white every black person competent care person absolutely film continue push end whiteness almost couple mixed couple exclude due course antisemitic noticeable exception villain couple remain white do course own production company via tencent
85,camera keep shake like hell watch min get headache feel dizzle watch anymore rest movie pretty much sit cimena browsing webpage know hold camera still story shot
86,hit beloved humanity go extinction seem like see something like expect story line boy boy leave gasp air line well write show exactly love family unbroken time extent parent protect love one never disappoints
87,read synopsis excite feel like die little inside watch felt get angry frustrate lot scene film put stupid see film hopefully understand mean lot scene add clearly pad film cut film altogether affect story arc whatsoever zero sympathy wife kid end film honest even care family find eachother becasue come across completely selfish egotistical acting come comet
88,say use lot similar story except alot le disaster alot drama amaze storyline part drag forever occasional loud noise disaster fall asleep empty theater one time watch worth movie ticket price
89,film stupid live character act stupid way make whole movie annoy comet kill comet true heroe
90,look action fill doom day movie disappoint movie drama driven make weird decision weak backstory happen weird side story kind blur strength story line good watch though predictable
91,film non sensical action character make ask
92,well do thriller film go equal level eagerness throughout movie first min adopt atmosphere movie start travel character twist main strength film two hour thriller roll mind
93,let confess get way like think movie good well do action pack end world film film totally perfect mistake make film may look hard find production value high act well do expensive polish look cinematography act edit sound sfx budget believe million every single penny screen enjoy allow negative reviewer scare away watch film rob experience good action movie seem like people watch movie sole intention try pick apart people say do maybe way many different way make end world film know many end world movie make thousand honest kind hard come idea completely original say devil detail truth matter end world movie make far difference detail instance already know trailer planet kill comet go hit yes know go people panic experience hardship kind destruction etc etc etc consider movie make general plot outline way vary many detail instance take movie script copy time give copy different director film crew everything say do end movie thing movie completely different different look feel atmosphere technical expertise flavor etc reason completely different many small detail make movie cause movie completely different like say devil detail detail make movie either good bad think well do movie yes sit watch movie already know supposedly comet go destroy world really know exactly go happen know exactly infinitely small detail join together ultimately bring event thoroughly enjoy movie comet end world film end comet end world film film definitely worth watch thoroughly entertain main actor people actually end care aspect movie gloss expense part let say well do action pack end world film believe really enjoy ultimately goal film entertain really succeed
94,put together blender without protagonist movie crazy disaster movie touch adventure offer something see man call take refuge family army bunker comet fall ground destroy everything like dinosaur good interesting argument put aside maintain sequence plot always show heroic character save family effect well achieve two three moment action sequence try develop story want put tension spend afternoon
95,like day tomorrow inferno hesitate watch one expect complex storyline character development love kind movie hate popcorn drink sit back enjoy
96,great fun watch make whole meteor hit earth story believable much walk cinema little disturbed think happen real shake feeling day cliches sure ruin experience love destruction end world type movie definitely give
97,well craft film make imagine modest budget good job do whole crew people hat film sound bitter seem understand family life work mahoosive car though great little twist turn capture horror low human survive also sacrifice people make others see moment like life film act good little boy fine job do best work whole picture really come across scared witless enjoy film
98,short word like kind end world movie gonna enjoy one main cast pretty good even small role good job story pretty intense nice twist surprise bite predictable und unrealistic time expect cgi effect range okay pretty bad time bother much worth watch
99,quite get bad review really good movie around simplistic great act
100,like movie amaze excite story filmmaker like way movie shot good color grading
101,easy say film derivative btw derivative cliche expect consider topic film evokes sympathy though certain plot element unrealistic say plot element seemingly spot fruity apocalyptic film like fill exaggerated cgi like limited special effect diminish action film edge seat
102,man lot really bad movie yet despite still watch movie great accent another disaster movie star premise estrange wife young son embark perilous journey find sanctuary planet kill comet hurtles toward movie mostly miss one high expectation terrible like disaster movie actual good one appreciate movie take serious ground tone well fair amount disaster movie feel really top bit cartooney slapstick like character act like human interaction feel human breath fresh air type movie element movie quite distinct heart kindness within movie movie show tend focus bad people focus opposite scene bad people sure recur theme movie act kindness watch movie pandemic easy appreciate good deed show movie director writer show different way people handle cataclysm include individual party riot remain kind feel believable action scene destruction occur movie human drama main focus action scene rare visually spectacular lead stun tense moment part cgi pretty good get really bad jar third act cast pretty good job give good performance fiercely love mother desperate protect son lot well movie lot previous movie even though still mostly gruff look dad child actor unbearable like fair amount child actor three mostly give okay performance every one one moment performance shine come flaw mostly concern way story progress movie last hour lot moment main character tend make jarring decision concern wife feel make lot dumb decision movie kind shut brain watch movie else constantly question lot thing movie also pace issue opinion point feel like drag bit slow movie movie start feel bit long cut minute total run time point character quite bland movie never really delve character much instead focus situation work movie feel explored bit character dad structural engineer know much wife know much kid apart diabetic main thing keep movie go hour slightly difficult fully invest caring character also get revelation near begin third act feel irrelevant anything make difficult care character surprisingly right movie garbage great gloom happen real world movie provide mild entertainment hopeful message maybe something kind need time definitely feel like bad hour spend watch movie
103,type audience stay away movie feel intelligence insult facing bombardment contrivance movie satisfy look standard disaster blockbuster type entertainment one small budget stuff compare recent flick genre lock away brain safety deposit box walk theatre chance may actually enjoy degree case maybe three actor cast particularly enjoy watch sure easily mention meteor catastrophe movie another one anticipation extinction event level crisis government set underground shelter select individual immediate family member ride criteria selection obvious people skill set contribute rebuild world construction engineer natural choice together wife son trajectory journey whole slew incredulous twist turn include three get separate back together father house go spend time plotline ingredient see see movie likely well handle enjoyed movie mention three actor include sorry household name favy familiar successful series complete season earlier year one favourite evergreen veteran act credit date third one mention yet act credit date best remember recent series people unfortunately cancel two season small part
104,bad review nonsense one single party person expect action terminator movie responsibility unbelivable terryfing struggle fight family stress entire movie want end run kid hold really good movie hard watch emotional good movie leave nasty aftertaste fear need learn astronomy able look sky get knowledge
105,come expect level schlock somehow someway closer thing want eye rollingly test fill drag flick comet rain screams explosion upon humanity endurance test long persist watch unlikable character sake requisite shot char battered national monument go cardboard family plot disaster filmmaker please least make likable like actively root character survive indifferent
106,first act worth watch seem like put budget first act second act budget go also script tension drama cliche bad write kind movie also allt moment second act ond need hurry minute later talk past misstakes eachother first act actually really good second act awful actually
107,ride hour pure intense entertainment really good movie show good bad humanity time chaos recommend movie must watch sure
108,really great movie honestly understand rat low thoroughly enjoy story line great act action way quite time heart sit throat
109,theme vibe movie abnormal enjoyed much recommend intense surreal realistic time con slight meh cgi couple scene thing say wish long
110,sucker disaster movie intrigue see movie get serious realistic tone remind deep impact fight get away incoming disaster well think direct well vod next month recommend anyone want sit back relax watch decent movie holiday
111,intense movie basically deep impact age minus space element really like though listen negative review watch
112,genre movie change astronomical mesurements plot believable good thrill work watch
113,expect low budget low quality especially butler movie surprise cheese top real life reaction end world scenario time felt emotion camera angle give cgi story backseat deep impact write director
114,far say one best disaster movie see year possibly last decade story unique plottwists shock visuals great strong cast good character last least intense rollercoaster ride start finish
115,waste time movie start well liked suspense wear thin thriller aspect come character make dumb choice comet come earth panic scene come back really loud music wow annoy
116,play classic disaster movie bingo movie check every box traffic jam get separate find old veteran hero loot kill loose car finding abandon home run water car key kitchen note return car last plane etc etc mayor city seem survive come next make good movie restart civilization disaster
117,like actor story go place well overall nice true sadness able see cinema
118,movie make cry like disaster movie drama family midst chaos try find disaster movie enjoy great
119,beg movie attract good scenario nice role playing sometimes film think happen reality comet come hoping well effect catastrophe well end different catastrophic action movie
120,note film focus good bad human nature rather disaster story well write get realistic feel compare disaster movie destruction chaos happen drama fill dare say kind scary look fun excite disaster movie like watch
121,movie effortlessly bridge human emotion interaction good bad science fiction disaster genre act like always say one best realitic end world movie ever must watch
122,awesome movie see yet highly recommend
123,expect story line end world movie realistic find suspense perfect cgi good
124,reasonable premise however fit many trope become tedious
125,film great story great acting end world heart top movie
126,always movie apocalyptic future positive negative review negative review people go cry inaccurate thing plot positive review people enjoy genre without picky people like kind stuff think show perfectly human capable case cataclysmic natural disaster also thing unlikely happen case scenario really matter want entertain exactly get stop entertainment good actor decent cgi maybe perfect good enough like genre movie certainly worth watch lot bad movie genre one one
127,disaster movie day tomorrow one interesting couple different path movie love start end
128,god get influence low rate like end world kind movie love one great action special effect act start finish
129,help think saw movie perhaps something similar happen earth future exactly like show movie something similar impossible know stuff space one day hit make movie realistic way felt scary see movie movie fast forward something similar happen earth scary thought movie great enjoyed story never get boring scene role perfectly see movie
130,descend root babarity dog eat dog etc story however
131,brutal depiction human react situation like really hop endure even political correctness force upon movie movie sadly abundance well familys travel towards salvation encounter lot people course bad guy always white men good guy woman non white politically correct preach movie gotten high grade
132,give movie low rating believe voter brain
133,movie do right go quite low expectation nothing else leave watch cinema decide give try actually like starts typical cliche genre family issue kid forgotten medical kit etc way execute subtle many emotional moment ploy actually make sense people behave stupid kid annoy top cgi constant last second rescue zero scratch feel real danger catastrophe feel real people feel real actually always interest follow kid great performance wish movie end minute earlier without cheesy feel good finale well expect general recommend see cinema
134,solid disaster movie never bore audience unexpected twist like government choses allow rescue plane cynical kidnap look action movie get doubt rate movie top score unlikely romantic end bird sky undoubtedly survival human race never end resource insulin surreal lip job also annoy factor though good actress hard focus act low part face sometimes look completely anemic
135,fan movie little disappointed saw cliche scene expect event movie story well write father law part also weak like act also think act kid good actress bad long history make fantastic movie expect quality stuff
136,yes anything new take ride experience realistic scenario people desperate stay alive
137,frequently give high score check click user name confirm real review well movie definitely underrated barely time review give several reason say underrated hope raise final score bit movie perfect good disaster movie mere copy exist one flavor find certain period although detailed highly realistic especially come military management psychology important place movie intra family relation general human interaction confront threat life develop role usual less muscular next door guy well become subtle actor an gain big role yet find hard relate barely likable go rest cadt actually find kid annoy honest way fragile whiny even age suppose plausible overprotected etc though bond character worth follow quite thrill spectacular picture always entail explosion destruction spoil simply say build frighten atmosphere disturb young viewer conclusion hollywood grade movie two hour never bore make opinion think movie deserves least even
138,movie year many movie year one engaging excite enthral throughout realistic pre apocalyptic movie cheesy top think movie whole family enjoy
139,choice watch normally cup tea however surprise good way sad grateful family dog make want visit grandad situation probs get piss cuddle beagle cliche film normally emotional action scene comet debris film exceed expectation
140,expect good act disaster movie important noticable choice director bring best people end near different disaster movie main character perform best
141,good movie think especially love every minute cgi
142,honestly enjoy typical action movie edge seat whole movie
143,guy bad rating seriously watchable miss family part cliche rest pretty good
144,great movie well do top good story line realistic compare disaster movie good point yet take mind give shot
145,rehash half budget get movie make feel cheat saw theatre disaster prn without disaster movie like watch bad bore episode come actual disaster nothing serious bad first new movie scene cut away monster start fight time see
146,surprise read review go movie open mind typical disaster movie true style anything else great see disaster family rather government plot storyline role play main character less stereotypes genuine role well movie add library come
147,first relish idea watching film today attempt world disaster flick glib largely big budget predictable typical venture fell flat earth pardon pun personal result grip nod film get track part start everyday relatable tension maintains throughout filled moment feel real well told direct production mercifully minimal necessary highly effective really need
148,book greet act typical movie present mean survive
149,keep short movie refresh exciting keep edge seat hour character intersting act beautiful felt like highly recommend fell short stupid decision character take around midway necessary keep movie go still noticeable course annoy less average child cause way cliche drama general really minuscule compare good movie general
150,character movie human realistic look people react ultimate disaster provoke fiction suppose make think feel movie succeed many level
151,entertain watch movie like type movie act everyone
152,absolutely amazing pantheon great gerrard butler performance rank highly
153,movie emotional expect much sci think good movie people willing safety one love actually surprised positive side love performance feel character desperation actually make post apocalyptic sequel
154,absolute stunner end day movie act cgi story everything practically perfect see movie keep engage every moment long time bring game felt every pain felt want character film couple dip tiny plot issue maybe couple line dialogue may love one hell ride
155,movie butler great actor movie good watch
156,expect anything really fun movie top cgi use moderately need boring overly pathetic hero save planet yet focus human aspect catastrophy
157,make short want relax get entertain give shot totally worth want something serious something else bad review
158,trailer suggest another big stupid disaster flick finely balance mix popcorn family drama genuinely emotional scene enough explosion apocalyptic sequence keep fan happy trailer also mislead good way regard story structure pan unexpected logical direction well pace throughout performance good production good everything best film do
159,lot movie deal world possibly come end movie focus type destruction hero impossible save humanity whatever come course kind human interaction include storyline key aspect ordinary screenplay special movie emotional rollercoaster drive dig deep human nature scratch surface human being capable world face disaster drill inside actually feel actually understand scenario really mean first time watch world end scenario movie actually believe everything give screen absolutely unique learn tenet review platform rely publics opinion come taste live theatre open favor watch incredible piece cinema away distraction video demand come along forget subcoinsciously know pause movie get suck plot theatre fun
160,movie absolutely great think give good insight people react crisis fan well make disaster movie go book one great disaster movie course happy end live
161,love good disaster movie gerlad butler quite different usual top disaster film hit realistic take natural disaster look like emotional scene throughout really worth watch
162,movie great acting cool story hate movie recommend
163,easy film predetermine course good time spending hour cinema expect good movie
164,enjoy disaster movie focus plausible movie exactly good movie sometimes want see movie like pretty interesting plot movie feel long act pretty good many aspect seem believable realistic small part nonsensical do sake extend movie add action scene movie many weird twist turn alright understand people might enjoy much since drama lot talk slow scene predictable plot people enjoy think rating time review pretty accurate solid movie people
165,love emotional roller coaster act great effect awesome pretty realistic make cry time
166,character act like real people consistency plot overly improbable strange thing say disaster film
167,mind bad review low rating best end world movie see
168,story great tutorial authority prepare disaster use technology contact people
169,kind movie produce right get tell really need creative scriptwriter right pretender
170,bad movie shot handheld camera picture bounce around make nauseating watch waste
171,idea good followthrough awful really like kind movie think bad write especially bad direct actor make complete flop fall short bad cgi point like fire arm scene rhythm strange people short time look like hurry definitely one bad decision another make bad swallow keep edge say man hurry god damn
172,do term intensity atmosphere setup act effect story tell liked honest kinda want sad end go well end like watch recommend
173,movie belivable like good end predictble
174,production motivation average story point view family wise flaw scene really believable others somewhat big screen eye candy suspect genre
175,think alot effort put great actor really job like see dissaster call planet killer hit earth overall genuinely think hard work put camera guy director kudos belieave someone rat movie acceptable mean dislike movie rating real gonna give
176,watch easily irritate stupid decision leave medicine car mam get plane etc etc stubborn character react warning accent come character show tell stranger special chosen escape bracelet expect kid kidnap act one cliché another nice nothing else watch bag nacho
177,movie overrate trailer convinced fan go awesome luckily see trailer enjoyed movie heck people may tell edge seat tell completely forgot covid virus hour know say say true watched movie edge seat hen movie end actually started think future completely forget virus spread around world actually start think happen movie completely change mindset time recommend watch human emotion get kind feeling telling find
178,liked maybe like character depth well act actual apocalypse go overall perspective slower sometimes drag especially come boy character arc however need make sense
179,bad movie pandemic depression time look think everything even bad one question
180,seem every marriage edge collapse need save apocalypse
181,movie asteroid drama someone tell search something like roland emmerich movie watch interesting
182,read review watch movie naysayer want blood gut gore action type movie movie show different human emotion responses extinction level event movie similar well scripted movie believable event human range selfishness murder absolute care understand generosity movie bang bang shoot good movie enjoyable person take something different movie human react cataclysmic event happen movie hope
