,0
228,great movie know masterpiece funny movie happy end well play main actor want relax two hour advise
229,movie lot potential great cast plot lot well absolutely love felt writer do lot well side note role absolutely hilarious iconic
230,take someone adult face scream youth much chemistry gonna lie typical silly romcom cringe line like even think deep romance silly drink beer end cringefest cheesiness bad good good one time watch imo
231,cheesy corny full cliche somewhat enjoyable manage watch entire movie
232,film twist feel good end romantic comedy recommend
233,love concept get cheesy part admit love
234,someone usually enjoy romcoms start watch background noise know like film put phone watch haha start expect romcom start play inside joke step like others obvs quite funny likeable main character top perfect super typical likeable abit silly make stupid real life type error rather sickly sweet actor good chemistry buy moment watch know
235,cute like romcoms predictable cringy time overall enjoyed scene make zero sense seamlessly add drive story scene along wedding song antacid etc like idea story feel effort put cast decision write annual movie play character well always amaze never hear like played role say see much chemistry two star churn definitely great
236,take acted cheesy legit belly laugh sound track
237,tear country use good bad use bad good disappoint every person connect movie tell fantasy really people like
238,actually laugh loud several time movie usually happen happy surprise lead good chemistry good movie light hearted cute also edgy moment romance rush character relief
239,craziness stress movie light hearted cute enough make feel kind way solid hour half dialogue totally unrealistic plot million one clichés film lack originality something work raunchiness make fun think home run stick see mean
240,bad movie ever stupid sense waste time watch movie understand people like movie actually ridiculous
241,movie bad good month quarantine lower standard well person
242,single joke laugh film joke recycle trash even qualify future cult classic even play trope twice within film like girl drop whilst dance favour stay clear film
243,good movie quite entertaining original script although always film bring together couple least see type story original
244,story predictable also annoy character push story create comedy something actually funny cheesy romance hot guy girl even notice hot act careless around write even well year old seem like desperate attempt movie thumb light skin tone
245,romcom fill cringeworthy script full awkward moment chemistry two main character star movie super awkward
246,fan disaster chemistry character even story bore mom family obsess get boyfriend husband one know course someone appoint holidate know fall love wait sooo long uneventful romcom classic really really bad
247,movie fun watch enjoyable halfway realise weird stuff guy always hot well dress well speak charismatic aka perfect boyfriend girl walk around pijamas without make time guy still want friend cheat husband acceptable bacuase never around old lady end hot young doc always perfectly dress cool well realise cater lot woman yeah meant woman demographic well woman relate old lady single girl twenty middle age one marriedi watch girlfriend thoroughly enjoy like yay girl power kind cringe end line guy avoid watch together especially lol
248,predictable writer tastefully acknowledge script always talented actress great frankly even gorgeous look accent chemistry real look give authentic favorite theater actress become one favorite film actress performance reminiscent role living always enjoy get distract look talented
249,apprehension read mixed review find really enjoy make laugh make care character engage story throughout thought lead great chemistry fun need
250,cliche every way saw every outcome way mediocre really funny
251,language crude character harsh unlivable movie suppose clean magical
252,good watch watch recommend odd jade good approach social pressure single dateable guess people see wasted resource know much breakup recovery movie romantic comedy cast great job subtly express thing without obvious cute charm little movie jade socially abnormal stand point big problem spend lot time say work normal impend implication get together romantic comedy obvious conclusion fan definitely see grow prove range
253,go sound like real prude find swear movie put expect enjoy watch expect element go think go sweet smaltzy comedy romance enjoy actual storyline quite bit genuinely funny think coarseness spoil unnecessary
254,tried mindless entertainment distract chaos election flic harken back level dimensional trope tokenized ethnic aka nonwhite character way might pass blatantly tone deaf today climate script feel like write brainless romcom generator terrible act offer relief either movie belong channel
255,another romantic comedy nothing new different offer solid time watch must say actor somewhat save film become another lazy make film stupid character predictable plot stupid joke get wrong film plenty way actor able make ignore staff enjoy little bit happen screen lead cute together fine chemistry course predictable enjoy turn brain obviously another genre troop fine time
256,romcom interesting part nothing keep interested character switch weak hero want back away relationship hurt heroine scar ready move forward push away felt odd never address back away first spark later heroine need long afraid one allow together though dude make first back away character seem two different people instead realistice character
257,cheesy film struggle get really know star invest predicatable love story chemistry great laugh moment far romcoms film probably watch also think script great millennials young people talk blow hand job oral sex like big thing think work chrismas film felt intuitively morally wrong give star generous also felt like waste even wish watch something else felt like watch prefer greatly power marketing
258,hater expect least one okay kinda cute funny line new actress first like men woman
259,hate stick kid table another family meet store return line hate single holiday decide good rom com idea meet cute good almost good rom com issue construction stake never high since end always inevitable one thing one person actor fine filmmaking functional premise problem write little bit
260,movie alright cheesy cliche funny moment act script mediocre movie definitely seem low hang fruit throughout movie predictable like rom coms might worth watch definitely see worse
261,nothing special cliche family holiday drama fake date top dialogue little bit engage totally predictable
