,0
0,official pandemic break choose watch romcom enjoy horror crime fan understand go film funny lead definitely chemistry actually jeeze believe go say want get together course try gin properly first time life also normally hate added mix booze make drinkable overall funny feelgood film watch pandemic drunk expect die soon
1,film pretty good romantic comedy nonetheless act good good support cast storyline expect keep engage thru even shedded tear two last scene look depth probably choose another genre film fair film touch important issue face many democracy today loneliness film cheer minute least
2,see good comedy romance yes cheesy sometimes need movie know end original funny romance recommend
3,high expectation much well expect watch funny feel good movie
4,basically need holidayé ti season gonna similar romcom story different actor yet still love movie actually way good average holiday movie chemistry two main lead visual adorable
5,gosh actually still watch last couple minute predictable cliché top stupid show absolutely love really know see actor elsewhere know act many overact slightly moment force together make stereotypical romcom ever bad good maybe great mood
6,even begin say bad movie make mad terrible script act cliche plot make absolutely sense uncomfortable throughout whole movie put
7,basic crud always gotta fight near end break character realize love rush airport make speech well tired awful trope
8,bad review seriously get scared lol enjoy nice simple matter win movie think cool enjoy thought everything good sense act storyline chemistry character way cinematography pass hour half pretty good guy know love lol enjoyable movie hater get stop taking seriously make boring movie
9,one bad movie ever see movie look like modern day masterpiece next
10,movie ever see punch face whole time barely finish
11,wow trope stock character regressive sexist dialogue way satire formulaic romantic comedy film
12,misogynistic bore story contrive character completely unlikable rate zero need well
13,bad movie worst ever see think
14,typical rom com follow something similar friend benefit storyline holiday add go fun feel good expect enjoy
15,movie ridiculous cliché way work parody romantic comedy one bad movie see lately even kind silly movie light hearted funny nothing funny cringeworthy moment message pass movie also terrible happy unless someone else matter fill clingy needy hole character substance character vapid script horrible collection bad thing romantic comedy one character talk romantic comedy dash hero naïve heroine always end together surprise fall love end together skim along part keep wait punch line moment reveal hey make fun kind movie never happen life never get back watched something else even well
16,first three minute already bad movie ever make remainder round rest top bad movie existence love never inflict upon human race question everything way satire table read service must hand crack instead food write funny line eulogy people like even know else say look awesome comparison officially embarrass alive
17,love cheesy rom coms everything go right great quarantine movie story alone holiday need someone spend day alone enjoy fun cheesy cute movie go win award great start run movie get mood holiday
18,must computer program spit script rom coms mix match element look program rest structure sort accent every movie someone accent almost always male character reason certain woman think accent cute sexy imagine none woman ever travel anywhere except maybe spring break hate mostly someone fall run something funny die new comedy rely vulgarity synonymous humor ask review contains spoiler nothing dreadful movie spoil spoil even watch trailer
19,lot well know actor typical holiday movie enjoyable watch cliche unlikable character
20,really relax mind little disturbed amid pandemic end satisfy mind love kinda movie smile face heart eye
21,one single funny joke throughout badly act cheap film writer obviously sense humour point embarrass score actor kind handsome
22,much unnecessary crude language joke situation sad com try original complete opposite pretty basic boy meet girl devise plan fall even though say girl hang ups apparently one realize jump bed chase realize wrong live without everyone live happily ever actor make zero sense together look compare leading man make sense great match horrible rude completely unnecessary unimpressed depress
23,bad verry worst pennible ugli grotesc movie ever lose time
24,easy mess rom com cliches somehow director totally mess much com comedy one romance push forcibly work seem make piece different people climax one bad low budget romance movie well totally mis cast covid boredom enough save disaster
25,rom com fan even far say watch nearly every hallmark movie everyone know expect much acting lease still manage make end cringe every minute one acting brutal really push try make end unfortunately last min
26,film couple still make night club manage clear dance floor realistic thetr mall scene everybody stop speech dude also hand mic cause everybody put problem aside listen scene anger early insulating one cultural level
27,eye back head predictable many scene unnecessary
28,title say bad film ever watch watch
29,head sum failure basic plot similar meet kindergartner learn write say need get whole new group creative people start scratch
30,god bad movie felt uncomfortable thru whole movie plot nonsense guy netflix mon good thwn theese stipid cliche romace crap
31,act movie play whiny brat horrible movie original movie name waste time
32,romantic funny lousy script bad act chemistry character really bad begin end stop move onto something watchable resume several time get list
33,omg believe positive review site movie absolutely nothing redeem movie poor script poor act netflix think new ever award
34,want watch overhyped movie look futher want watch movie give literally stars people regurgitate concept new another rom com even worthy star get balance bore corona victim nothing well inflate rating point meaning
35,bad humor bland misogynist gender stereotypical joke cup tea character unlikeable one really like especially main character well hop high
36,cliché many little thing annoy main character litter steal twice lick dirty finger time gross especially time covid squeales hour
37,still enough make work well many deal breaker act nose dialogue first encounter believable people talk like premise plot forward fast serious backstory protagonist completely alone nye grand romantic gesture speech protract hung little payoff performance decent redeem average scripté conflict romcoms still like happy ending gangsta rap egg hunt funny see backdrop instead usual nyc one
38,overall genre do say laughs clichés enjoy cinematography decent also give low rating watch decide
39,storyline mean revolutionary way rather generic rom com plot execute fairly well charismatic cast chemistry main character portray mention absolutely hilarious light hearted film though little cringe worthy saccharine sweet time easily watchable
40,see people write thing like stuff like still get make make wonder earth expect compare answer question get make people enjoy kind lovey dovey feel good movie around holiday enjoy far feel good movie one good many
41,resound yes laugh modicum sappiness take seriously look good time nice see
42,make feel queasy predictable romcoms still enjoyable pull heart string one write shock act choppy direction wannabe wooden painful
43,cliche rom com work do well protagonist good chemistry neither
44,love watch type film timd time work feel good romcom cheesy american romcom go back
45,nothing well afternoon one dumbest badly act silly story line movie think see bother
46,come perfect light movie binge watch even popcorn enjoy
47,someone tell mix try act sarcastically director make movie direct predictable bland
48,reframe negative thing want say replace word kinder statement cheesy unfunny lame cringe cringe absolutely stand big like open present rom com well rating somehow perhaps viewer seem like kind com find entire movie definite example make film really one level act really find sort stuff good
49,rubbish script even worse act misogynistic rom com mess effort anybody part learn put masterpiece masterpiece example quit act
50,absolute piece garbage get past minute mark horrific person green lit lock room make watch repeat hr straight screenwriter back school learn screenwriter shift quality offering movie stink
51,suppose cliche typical rom com trailer really remind friend benefit say gonna deep innovative movie lot potential funny lovable movie even fail really wayyy clingy story wayyy cliche formulaic story make sense know start talk really blue randomly meet randomly fall love really much sense feel formulaic like story develop scriptwriter want develop like many scene like straight close execution story development bore clingy hard even finish
52,really watch romantic comedy movie quarantine cause get covid thing watch movie know actor performance good well movie want spoiler something good movie worth watch alcoholic drink well
53,use cliché romcoms season one really empty act cultural appropriation unoriginal script
54,think one exactly like every rom com actually totally unpredictable even though bottom line say raw like spoil say
55,actually good movie great storyline love relationship development different holiday together feel good movie give watch
56,disappointment expect feel good holiday movie level movie mean spirit crude annoy charm funny character whiny unpleasant completely wasted role support character horrible make movie look like winner leave really depressed big trouble
57,go movie really expect much start somewhat movie still take place around quickly rush lame clichés movie claim want avoid two main protagonist chemistry movie funny usual joke pot seem another example creativity surprise relationship number dwindle woman grow think aim life sleep around smoke drug flash boob dancefloor say lot ground role model like character stereotypical girl actually still dreams nuclear family rather watch story force stuff admit zoom movie since tell begin play movie predictable least charm make laugh movie none
58,lockdown finish mess good bad cheesy romcom mix indigestible sauce
59,worst holiday movie see year love movie embarrassment waste time
60,much good annoy character ridiculously unlikeable every possible way overreact unfunny desperate etc typically love rom coms cut something else
61,fun need bring lead couple adorable playful cute together secondary character hilarious take break reality enjoy film regret
62,think movie suppose new take holiday rom coms add curse grand gesture carry girl rather guy curse superfluous disappointment movie underdeveloped character people semi witty semi nice adequate job hobby interest thought hop dream except someday single find reason like inspired line underdevelop character lack character progression expect big hurdle overcome scar result breakup short relationship post relationship emotional scarring unbelievably significant also easy overcome one article hype clothe movie think unremarkable per character
63,covid make actor forget knew act something like performance movie phone stilted shallow cinematography amateurish even continuity glitch first scene talk sister obvious distract pas
64,course know go typical go silly predictable plot line even spectrum particularly silly mindless look review contain spoiler question bottom review realize way review contain spoiler utterly evident happen within first minute doubt end girl get boy course particular movie broadcast harder sooner certainly inoffensive feel worse watch sure heck feel illuminate happier watched either little disappointed chose choice available feel little duped though somehow list top choice site mon viewer need little discriminating
65,movie bad part okay almost pooped pant
66,romantic comedy twentysomethings thirty ever suffer heartbreak boy one spend holiday accompanies woman parent house unleash chaos come someone party continue label old maid meet decide party friend unleashing kind situation like kind joke people age sexual language light nudity joke sarcasms comfortable character fear commitment sometimes difficult feel ideal movie heart broken take ice cream
67,high expectation movie ready spend time watch disappoint cute find character annoy male lead also cute annoy annoy character make lose interest movie real fast find anything romantic comedic interesting movie cast great potential lose meet cutis annoy banter side storyline waste time fast forward much lose interest barely even know end care movie lack something wish well really
68,know movie low star rating great holiday romcom absolutely need story see time sure critic expect must watch like holiday romcoms
69,start watch movie cause first think cliche cliche ever see started notice every single thing ever see romcom holiday nots like every single plotline trope see pack rom com realize movie totally meta actor sometimes blatantly point thing go end make fun always work type movie obviously make fun romcoms romcomy romcom ever say director way good making camera movement right beautiful
70,really enjoy tight base low rating predictable honestly surprise throughout movie time act felt bit forced overall fun watch literally lol throughout movie watch
71,like film exactly expect bit friends benefit write genuinely funny laugh loud time right amount adult humour cheesy much eye candy
72,moro negative agree great definitely entertain enough excellent much though think go something like budget version seem build comedy comedic timing bit
73,best movie ever think cute charm funny different take romcom genre know go end together still enjoy much worth time
74,romantic lot character development anddd yes wa intrigue probably gonna watch next time reccomend like clingy friendship romance movie
75,fking break christ dead fking resurrection idiot miserable life shallow writer character pathetic hollyweird film obvious degrade year take back peep give loser anymore power
76,even though might call predictable laugh much enjoyable love must see need laugh
77,hard find great comedy anymore perfect think bad understand comedy feel good movie emotional part movie release theater
78,funny movie cast work great together
79,enjoy romantic comedy film probably cup tea character fall love leave fall love way rom coms case set watch cause opinion funny actress bring character life rightfully even plot best see work superior film show honest
80,romcom wonderful movie must get funny adorable hand aunt element show easy gracefulness screen ability connect actor movie plenty laugh two lead actor show spark add another level genuine connection two partner living room watch movie smile laugh smile face sunglass
81,never optimistic go movie nowadays movie good reminder bad thing see memorable think two main lead chemistry write bit cringey time harm watch want typical romcom
82,feel good movie adorable character laugh loud moment ridiculousness people take romcoms wayyyy seriously review drink watch fun
83,expect amazing movie terrible jump around much believe one hour fourth four minute suppose rom com even funny romantic waste time
84,movie fun love write funny realistic people talk lot real life gross thing happen movie normal rom com
85,start promise even refer predictable cheesy romance movie hope know pitfall avoid halfway go funny nice predictable cheesy cringeworthy make want fast forward
86,lead actor good like laugh loud moment take cheesy romantic comedy sprinkle liberal amount profanity
87,forgive low budget rom com compatriot make smile formulaic like family recipe tradition decide instead take formula add quality act dial back cheese factor throw dash realism diversity viewer really want grit suburban middle class white girl angry smoke date pageant girl overly enthusiastic family happen talk fellatio gift never know pissed girl put upon fare year holiday even save one
88,movie least two people watch movie twice especialy hour inspiration consider watch movie happends attend sleep dream actually good movie
89,scene reveal kiss blame fail relationship blame husband kiss go horribly hilariously wrong heart attack tell blame fail relationship kiss tell love
90,say make movie raunchy honest kind work large part thanks
91,job do time quite funny manage get end year holiday spirit think much ask film like much say film deepest remain quite shallow offer little way story emotion however make laugh expect consider fill type humour self aware think quite hard get right also hard care main character great emotional end piece struggle make impact quite frankly think good thing long funny even somewhat entertaining job big problem however length film stun check much film leave find watching hour first hour felt like eternity almost felt like trap endless simulation holiday awkward sometimes funny stuff happen felt excruciatingly long time consider quite problematic film like end day though film like try great even particularly good try entertain funny succeed accomplished set many problem accomplish two thing
92,thoroughly enjoy movie sucker rom coms cheesy like also address expectation young woman single genuinely laugh scene tear
93,quiet thud holiday romcom sort trough new offering late pair extremely good look single people like much find total minute worth reason together plenty dialogue rub surface romcom snow globe ala little beneath felt like open present every year diminish interest viewership
94,pull hat head elastic get catch around earring pull earring get hat next scene earring miraculously reappear predictable nonsense watch
95,want rom com decent act good look lead make laugh make cry even cringe worthy moment check box rom com formula enjoy
96,great christmas rom com get really fun watch main character great chemistry laugh get irritate probably little tear recommend like cheesy christmas get bad review clearly rom coms thing skip one really enjoy thought
97,lead chemistry good need figure funny husband like movie
98,laugh hard hurt script act well do
99,feel good rom com minute really expect much giggle often know people like relate judgey enjoy
100,justo amaze funny film lot love laughts
101,see well way kick holiday movie season save grace movie chemistry part pretty good banter feel believable best elevate project give little content work concept bad though young single people annoy one spend holiday decide date various family event throughout year something work much humour fall flat blame primarily write silly joke enough provide enjoyable time much lead good story predictable humorous beat quite land one occasion definitely original skip wait yearly holiday season fix likely one surely well stuff come soon
102,bad thing long paint particular way mundane script bore storytelling burn whatever good remain particularly likable character chemistry two main character feel force anything else
103,cliche trope romcoms genuine sweet movie fun character get nom feel good film highly recommend
104,literally fell chair laugh good joke good people write bad review must person different name movie finally good holiday movie good joke see good laugh movie long time
105,cast take seriously feel good think enjoy great
106,laugh laugh think cast adorable glad artsy enjoy light hour fun
107,movie silly chemistry great act hysterical love plot do hello movie screw probably already hearts shrivel dead get date save life
108,attractive unintelligible favorite actor support role criminally underused movie need get overload
109,love love sexy laugh cry gasped film
110,except good cheesy movie way complicate romance nice end
111,romantic comedy star tell story two singleton name hook every holiday occasion two fall every romcom one predictable know gonna end fan check niece legend star
112,impossible completely unique fresh romcom every angle play death mash character chemistry act sub par especially family friend absolutely terrible stereotypical idiot scene speech get together misunderstand predictable samey overly funny moment way long felt like three hour weed hospital forcing nice girl say bomb felt force cheap badly act middle road boredom filler
113,movie view fun way cute romantic comedy look bore think movie try insert joke secretly laugh sneak lollipop throughout story addition heroine movie also cute beautiful add woman still lose male protagonist look good well say movie really good look people whole story part operation consider story fast move hesitation male protagonist female protagonist agree girlfriend vacation ask find watch movie get tell one idea order love someone really show identity person pretend show side party want
114,movie surprise span whole year expect take place go cliche thing fall madly love less month despite time movie release poster truly movie see see see film cliche predictable rom coms certain formula like rom coms probably go detract much comedy hit miss genuinely funny moment wed scene instance also felt like try hard laugh early scene girlfriend parent house misinterpretation couple exclaim loud know well enough mouth get gift sat think say front parent felt really force cheap get laugh wise think cute story element halfway film make sense cause portion wake drunken night sure sex plot point never really go anywhere catalyst actually get closer together catalyst act awkward around even wonder go surprise pregnancy route nothing probably thrown bit comedy honestly felt bit random edit like really add anything one way another bad film though keep engage throughout
115,movie try funny cute corny awkward like watch something super embarrass happen someone else get complete secondhand embarrassment grimace face male lead awful actor bad work date think go great darn way disappointing expecting
116,use bad holiday movie despite cheesy actor convince scene well execute suspend disbelief enjoy journey case two perfectly decent actor combine become less separately convince perhaps character unlikeable point time hope get together bit shock bad able articulate problem love love lot original make think need strong vet process spend fund
117,impression movie revolve around holiday throughout whole year begin end premise movie quite original since family know arrangement usual fake boyfriend holiday type thing make fun genre clichés yet follow anyway character behaves horribly second half quite charmer together good chemistry see anything look familiar put finger maybe like mixture something real fun also full cringey moment last minute really drag seriously movie without embarrass public declaration top always consider painful watch far romantic rom coms much well without remember last time genuinely laugh much watching movie deserve high rating end probably best holiday rom com far one best rom coms past year general
118,today husband two teenage daughter sit watch another christmas movie think one look cute family mommyjuice anyone need well sorry say turn less half minute start see main character smoking time also say bad word even like holiday turn husband long talk daughter appropriate language important holiday parent please careful watch child clearly appropriate rea reviewercommunity talktoyourchildren notmychristmas notmyhallmark notappropriateforfamilies mommyjuice
119,typical romcom expect crude humour honestly make feel realistic cute mushy moment terrible watch
120,right amount cheesiness yes whole lot cliche care need amaze usual
121,kind romcom know end really mind end long make laugh good seasonal joyful movie want say drama queen movie
122,love movie automatically potential every time blindside movie get ruin someone please stop casting thing
123,fun different holiday movie cast enough cheesiness funny bit naughty definitely adult holiday movie
124,film quite good plot little bit predictable veri nice cute lot simple good joke cast great main actor good look amazing actor actresses support role funny wonderful good romance comedy holiday
125,story boy girl decide spend holiday day together without entanglement everybody know end fall love
126,love chick flick love like genre chick flick cringe fest film produce good chick flick know wear prada etc dialogue cringey unrealistic idea film kinda make film like message find guy bore do move onto another era stand infront mall declare love one world many thing do premise yet trash hard watch enjoy trash
127,cold war protagonist bother little force bar relation relationship sound unnatural amusing
