,0
128,even yet already give viewer taste offer holiday season start raunchy rom com feature predictable plot man hungry woman everywhere look give viewer bland story twenty something single meet two bump return unwanted present local mall two get bump form agreement celebrate holiday around year without messy relationship behind though agree completely platonic non sexual relationship obvious two stay friend runtime pair classic trope every rom com probably ever watch always two finally rekindle love cheesy speech front complete stranger mall meet play twenty something single living make even relatable viewer writer turn friend family pile character mush incapable focus anything men find unwanted beau play hunk inevitably fall love vice versa bring type charm role make slightly likable compare nearly every male lead rom com see thing painfully evident throughout desperate writer titular phrase take today society practically speak every scene explanation plentiful among various scene cinematography practically non existent exactly go make film enjoyable viewer probably focus two oddly good look lead hey lack many classic filmmaking trope make fact comedy surprisingly tolerable even base fact testosterone obsess bimbo definitely fall category slightly tolerable rom coms come recent year include film like fantasy promotes idea find true love idea pre covid lifestyle people pack shops store without wear mask worry infect relative overall sucker cheesy rom com one watch hop something little less cliche predictable might want keep scroll plethora option available million viewer
129,much hope film go far bad expected character caricature yet somehow still manage flat throughout entire runtime first hour film almost exclusively dedicated show holidates final half hour decide give plot anything development first part movie never properly resolve humour worst well mainly consist sex joke reference reference however either relevant least decade understood audience usually fan however combination exaggerate act poor script make lead generally lack mention male star portray incredibly sexist character understand thing say joke feel add dislikability course redemption scene bad attitude rest film make impossible feel sorry conflict arise script sure writer interact real human certain point film dialogue clunky unrealistic awkward costume quite nice nothing special thought match character wear cinematography definitely best part film quite nice shot take notice chance small chance film parody number clichés king bach character write exaggerated interpret film parody however think intent instead symptom bad write star cinematography star costume star attempt
130,etc rating focus two single people tire alone holiday season agree platonic date holiday fall love along way lot fun lot loveable quality let get started movie interesting plot hilarious likeable character good set two main character actual idea movie someone holiday string attach really interesting set concept leave lot humour fun movie also hilarious dialogue clever character comedic time chemistry excellent movie infectious put smile face hold back play safe comedic moment well character also extremely likeable every singly character play perfectly within film especially fantastic comedic performance character excellent also love set main two character love movie spent time character love life one single one family get crazy relationship set meeting well set tone well rest movie next couple positive cinematography great self aware tone dialogue movie actually fantastic visuals expect beautiful set piece transition different festive period really nice us colour visually strike especially club party scene love self aware movie term dialogue plot develop movie knew kind film dialogue exchange especially make film lot fun easy watch know kind movie watch sit back enjoy movie plot develop negative movie still generic corny dialogue part lack development change plot long period time movie self aware tone still generic nice surprise slightly less obvious character decision plot effect movie slightly also think dialogue corny place part dialogue different character awkward joke land lot dialogue lack freshness big issue movie lack change development plot like decision main character together whole film get stuck rut constantly change holiday relationship still development make part movie feel repetitive make original cool idea slightly stale fix eventually definitely effected movie fair amount final positive chemistry character development main character relationship satisfy end think absolutely fantastic screen chemistry relationship believable charm heart warm watch evolve throughout movie also love relationship develop fact stay friend work really well add really interesting dynamic movie get see two different side relationship final act also despite predictable satisfy despite see get together mile way execute final act excellent polish dialogue work character end film positive way despite dialogue issue creatively stick rut much movie funny charm likeable movie well holiday season shine light comedic talent involve within movie
131,movie set feel good cheese solid job hold cheese lead role historically talented convince viewer dramatic emotional roller coaster exact reason cast script seemingly positive comment understand mostly angel advocate tease good mostly poor film
132,act weird edgy another romcom period wanna shrug ice cream cry
133,love genre rom com may watch like honestly predictable lot cliche bore watch dejavu movie like string attach superior movie honest like male lead act look sincere
134,maybe ever top one love honestly write market scene near end hilarious much say look cast anyone already like love rom coms fire nice surprise crabshoot past decade two whatever get classic romcom every year rona do money wanna single one actor cast fire write top sure romcom top
135,misogynistic bad clichè still hear want husband act like first min movie gross stop min
136,film last night next day still feel weird usually love movie like seem ingredient thrown together bad mix cute girl handsome man somehow attract weirdness mind rude convince stuff want old fashion mother constantly belittle daughter try set someone weird top family member sister seem unhappy marriage obligatory long boring convince speech time square full people apparently someone think get diarrhea scene always funny think might try hard
137,good moment always come bad one
138,fest movie bore old rom com movie worse rom com movie bother watch rate avg holidy movie
139,wife put stop watching terrible movie joke typical cheesy stereotypical romantic movie give one star
140,nice simple story festive fun old family lot stupid pun giggle moment keep watch least listening
141,best holiday movie pretty good get laugh movie realistic reflect today young adult commintment issus say entertain leave think late night try
142,good moment movie overall main actor actress selfish rude crass shallow unlikeable chemistry good thing carry movie
143,look forward watch movie see trailer week ago premise promise rom com destination clear disappointed seem work positive side enjoy character act genuine believable reaction probably whole cast interaction conversation character sound realistic another reviewer note people talk overact particular help character pretty one dimensional permanently wind never tone expect wise movie begin protagonist attend different family gathering grill mother single people contact usually mother push daughter much holiday proposal mix girl misery self centeredness happy brother establish join casual date misrepresent relationship parent house side character seem caricature caricature help viewer get movie story really flow keep wonder everything strange mention woman bit nutty good way meet return counter act like never return anything live premise get go bit negging later agree date various occasion underway first event go well best scene movie tell family whoever else want listen date holiday date seemingly oblivious defeat purpose holidating first place main character especially seem fight every natural romantic tender moment come way make unsatisfying view experience want romance nice moment kill every occasion include end require intimate moment instead sell story since character emotionally stunt throughout watch find movie base premise execute good way worth watch comparison movie overall meh watch leave warm fuzzy feeling really care character end emotional payoff really want like unfortunately felt many thing bit
144,awful really like romantic comedy definitely set around holiday one lose interest fast act storyline useless thing like see
145,fairly formulaic romcom plot belly laugh moment line seem bit fragmented jump month time overall worth watch
146,nicely god know happen unnecessary sexualise dialogue completely uninteresting useless side character point include king exactly watch untill end cause goddess get reason top
147,get movie fill quota use business model mean force childish script poor act people involve production pay well script horrible reflective quality deliver finance creative come director producer actor etc instead go cookie cutter type film say cheap laugh give start never watch movie recommend anyone
148,film little different usual romcom take way long get knew go make female protagonist character whiny giant chip shoulder forbid young woman actually portray single happy film fail miserably respect laugh enough make slow trudge
149,know target audience movie single feel bad afterwards marry also know far reality probably movie work hop something fresh witty basic story
150,one flop really funny bit sad lot big moment seem fall flat many redeem quality movie
151,imagine worsen screenplay bad actually create movie outé parade non funny joke inconsistent storyline believe
152,romcom fan watch movie laugh pretty much way course much predictable feel like main character kind address subliminally joke one scene light hearted fun movie genuine joke someone pretty much watch thriller horror admit movie good laugh
153,make slightly raunchy movie sound like backhand compliment movie adult watch plus want watch kid
154,plot smart dialog main role play really good cast excactly appropriate role whole storyline different know rom coms end remind little bit movie
155,fact include holiday perfect love movie definitely watch funny sweet end adorable
156,cute funny like romcoms movie cast good get sick hilarious
157,people give movie star save time turn something well
158,laugh horrible movie love movie predictable tell movie end minute watch good holiday rom coms good movie feel like hallmark youtube lifetime movie one spoil like cheesey silly sleazy rom coms probably become new term still call funny movie title ever hear read watch something well get repetitive wait well movie short list christmas movie
159,sure post negative opeds yes get irony film absolutely love silly ridiculous point make cute funny sister passion hat rom coms never watch year decide open heart cause know quite decade get watch love downside rom coms watch seem corny grin face sweat look cheesy top holidate movie watch enjoy
160,write review year yet hat log comment crap make plant inside skull place brain well think ever watch anything horrible happen like drug read script yet agree take part atrocity
161,must way real life role go get time funny time full cringey overall meh rom com give one thing watch pandemic little chemistry busy cold mean predict breakthrough convincing
162,waste time drivel unsure go understand star poppycock
163,bad movie see lately far far best bore probably pass time pretty much average run mill cliched romcom need describe see million time pretty much story different actor occasional laugh
164,cliche cliche end bore bore boring end
165,know movie lose plot average romcom claim within movie average rom com right blame point co take time figure figure make even less sense away movie core concept kill plot hr together every month apparently bad behaviour enougj normal relationship decide
166,romcom usual still good thing expect story development girl always girl get unreasonable sour angry extremely unlikable writer watch romcoms girl cool funny like real funny know go romcom cliché unlikeable chick like poop pant scene though poop still cool girl mean unlikeable guy douchy still cool likeable cool join bring likeable character male female frankly type character write build men negative stereotype woman make film kinda misogynist
167,huge romcom fan daughter crude taste
168,course stupid predictable movie enjoy act good
169,movie make cater audience little less vulgar vulgarity reference casual sex example scene car look like somethin sexual add anything story make funny think performance overdone cringey care two main character really get premise except need subject set ups well intentioned family get avoid friend benefit point astute family member asks part usually like character overdone felt forced summary movie well cute movie dialogue focus slightly different
170,movie formula romantic comedy bad number problem script nothing new hate holiday day return clothe store meet commiserate agree first reluctantly platonic date anyone else agree something romantic relationship course rear ugly head lead couple seem mis match seem much old though understand lead actor close establish close age seem actor strain seem version character far uptight sympathetic much upbeat time mostly zero chemistry script brave eventually find broken heart like holiday rather make single woman happy life hat way holiday put much pressure woman really reason agreement want serious relationship come bit cad utterly bore typical rom coms also number subplots imho need movie kind seem like welfare actor plot bore one little insulting look end fast forwarding though nothing watch expect great
171,movie fine really feel invested end end together movie good quality reason feel like one chemistry people maybe script another do walk away say horrible people leave review say bad movie ever see make wonder limited movie view really really bad movie like rating say best movie ever see line want waste time feel ripped think one knock sock nudity lot inappropriate discussion nothing wrong cuss nothing wrong either laugh might smile little need feel good quicker picker upper find something else look something pas time work
172,objective romantic comedy movie since love much one sooo sweet heartwarming bring smile face entire time heart ache together end sooo perfect course cheesy corny beauty romcoms recommend like romcoms
173,rom com almost embarrassing watch cheesy every cliche book thrown worth watch
174,shallow romance comedy base outdated stereotype depict character classic depress hysterical single woman totally hung men function past
175,cliche unoriginal horrible especially good either current rating ridiculous accurate
176,love give good performance work poorly write romcom like someone want write movie see crude set record drop bomb good movie concept good main character ton chemistry enjoy cheesy movie cringe cheesy movie
177,looove rom coms holiday movie standard high whatsoever unfortunately one worth time felt rush even sort confuse pass quickly movie without even realize month next holiday get bore interested character whatsoever even finish
178,male lead cute likable rest truly awful expect masterpiece insult
179,waste time story line everything movie horrific
180,ever see romantic comedy feature protagonist hit friend non sexual benefit later fall love package form perfunctory cliche film number keep eye close randomly name lead end exactly way expect real surprise screenplay ragbag see ooze cheese gloss lead look great play stock character appear dreary easy brain rom coms humor big letdown time even chuckle mother two explains kid
181,movie like even play joke watch relate yuck single yet bland twenty something girl denial grow star fun fast pace aunt bad part movie
182,movie poorly execute trope none feel good emotional payoff holiday movie movie leave feeling tire underwhelmed disappointed
183,movie surely put smile face listen outrage comment everything become subject condemnation fake people internet project frustration miserable life everywhere even classic holiday movie escape fate people relax enjoy nice fun comedy actor even fantastic job enjoy laugh sweetly
184,rom com kinda ott idk phone half duration miss anything
185,afternoon film real feel good movie glass wine tissue ready agd film critique extraordinaire
186,romcom fail take seriously understand romcoms big business decade time change film moment exquisite silliness moment much rom enough com film obligatory genre fall flat face element terrific film bad miss mark
187,rating go lie look movie movie rating watch movie avoid watch one today finally silly joke every really make laff endear character good romcom love got mail two week notice know talk cheesy end scene end quickly
188,terrible script act even sound though actor record room dub without enough real sound add crappy music bother
189,big fan hesitant first review convince give try pleasantly surprised movie take unconventional clever spin casual dating put function dysfunction come family self reflection date single commitment debate find refresh sarcasm self deprecation occasional bend break wall end deviate much trust formula appreciate rendition imo miss opportunity character growth reaction party leave little perplexed movie pretty entertaining
190,bit raunchy lead couple cute together though poke fun certain stereotype pretty funny
191,movie many bad cliche wonder plot money something actually fun instead something make roll eye wonder long
192,cringey moment overall pretty good act terrible either good movie watch nothing else provide good laugh recommend
193,somehow trend number make halfway stop bad many part hard believe lot like without sex less charismatic acting
194,movie good bad potential great feelgood spectacular ruin crude unfunny unnecessary joke
195,kid table single mother push find partner mom call remote work hour point lounge clothes go parent home mother show girl photo include one day get period mom bring daughter bedroom fill doll trophy know fine sleep sex daughter come bedroom attack sex insist go home give pull pant give present pair khakis get oversized pajama hold hand gift get agree gift yell know even though sex twice last night let cum mouth parent star disapprovingly take sweater take gift leave home meet store return present find present two season ago worth five dollar sell stuff together odd girl behind forty dollar two agree holidate able partner holiday without sexual commitment judgment pressure invite big party end go together look like blast compliment breast black dress butt beautiful woman wear white look sweaty point get engage bathroom beautiful cry white dress stain wine say look like switch dress woman know important come back stained dress party enjoy night bring air dress fall crowd yell breast two enjoy holiday together come contact sits table two woman note let base clothes go buy candy store run try look presentable possible despite wear lounge clothes see outside store come rescue wrapping arm around tell couple beautiful see pretty blonde tell beautiful tell attract told find attractive outdoor day blow firework finger fall smoke pot hospital later home lead couch sweet tuck young brother wed girl wit last name hat one single sibling put even pressure family already want sibling marry get argument end making date ditch aunt struggle air sister lace corset tightly sexy pirate go party also dressed pirate get upset see pregnant wear bra show bare belly take think antacid sister offer take home elevator feel good actually laxatives demand take costume stomach make loud noise elevator door open old couple star door close manages finally rip costume right front washroom door asks make groan sits naked bathtub arm around knee spray shower head look away turn around check really look say tuck bed lie next morning romantic moment sunlight look pretty look handsome move kiss cover mouth cutely blanket say dislike kiss morning give roll around switch implied sex sister come upset kissed end fight grocery store leave woman run escalator woman tell fate stand stage confesses see reel photo end
196,prude winced obscenity sexual reference direction meh good thing movie
197,formula see million time sometimes work sometimes one surely funny sweet original main character look great together say gorgeous feel good film overall
198,gorgeous maybe gorgeous review short others write best bad movie ever grace screen enjoyable
199,another one romcom make thousand time cliché line type character soso story important disappointment chemistry god hate actor chemistry atleast something waste talent away cringy scene well
200,super predictable watch like romcoms life know gonna happen watch give
201,look nice romcom fill heart holiday spirit beautifil winter scene keep look annoy never connect character vulgar time trivial simply stupid
202,awful steal plots channel let add new formula making movie start checklist story funny line meme give good funny line without waste time
203,like someone think dozen random script idea romcom laxative slap movie fail try piece together one plot confuse make sense time good character role come super obnoxious entitle stand character make goofy awkward even smart shy anything size hip millennial whine mins trust men bother everyone around male main character also laughable tired use poc side character idea holidate great concept cast annoy skinny beautiful white people problem waaaah narrative exhausting
204,think movie cute follow rom com recipe well issue unnecessary use language personal pet peeve child curse movie need rate mature really need
205,actor zero chemistry act ability save mediocre movie
206,yet make movie waste time live never get back watch movie mistake
207,understand average good review receive end must great since continue watch whole thing bore childish stop watch odd minute
208,cast really elevate humor movie end seem drag little bit hence decrease star
209,new comedy start awfully first min want turn reason persevere happy piot fairly original two lead actor work well together make laugh general good feel thumb
210,cliche girl end together even though say duhhh scene funny unexpected ironic robert character comment another character look pubescent like teenager look chenowith cast role look
211,usually act lot well film come royalty really act top film aunt hilarious play charm charismatic handsome funny play role holidate well rush see cinema disappointed night scroll kind film forget total cliche well watch film look romantic film swear pas film suggest get tip aunt keep next
212,go film think light hearted maybe bit funny easy watch cringe throughout film find get angry character behaviour film sexist misogynistic unlikeable constantly put come across damage person surround toxic family fixate fact marry someone goal life every time say single people happy shut throughout film tell unattractive talk woman act certain way manipulative hoping address reason mum also take dig cancer patient noone find bald girl attractive odd film toxic throughout felt need write review disappoint make film horrible main guy damage main girl try play romance
213,school play good line delivery actor movie
214,grow watch movie worst one yet understand recent film agent really mess one paycheck big pas script terrible watched movie otherwise way long misogynistic sexist fails comedy part
215,ghastly favour watch something else plot character single funny joke
216,amount tokenization bipoc character astound thing ancient woman trope two main character constantly argue men woman feel like movie peak somehow make
217,stereotype misogyny crude language write bad point expect little cheesy since movie movie awful
218,sit favourite chair think last time watch really bad movie year movie call
219,hurt cash something min already watch bad movie life improve even little bit funny horrible write poor act filthy mouth sad sack live like two inept peter pan chance become actual functioning adult movie come warn side effect label may induce vomit
220,funny stereotypical yet extremely unlikeable character become extremely cheesy drop jade sarcastic tone another new generation movie try avoid every cliché book list one one write globalist ridiculous even semi decent cast salvage humor mess part try funny five minute movie
221,believe watch begin end write awful genuinely felt bad try act
222,character unrelatable plot predictable scene look photoshopped even finish movie
223,groundbreaking cute cheesy movie watch lazy day want watch something nerve wreck light easy lead actor convince enough way worse
224,portrays perfect girl next door cheesy corny rom com first hour fill hilarity feel force corny joke fill air second hour cram emotion bottle along way chemistry make romance eventually felt feel real true person live single life character always bombard mom sibling question boyfriend pressure true love able bloom meaningless date decent romantic comedy brings laugh tear yell screen believe film enjoy offend drink odd one night stand maybe stay away family friendly rom com definitely gear towards mature audience describe rating
225,know story every romcom ever write somehow lead actor great chemistry even care always predict happen next side plot
226,always look scruffy even dress transformation surprise blah
227,much wide audience appeal full sleaze smut sex stuff add nothing cuss like proverbial sailor believe versatile word language kinda low brow crap place movie unless holiday porn
