,0
1230,know penchant irreverent comedy immediately pop mind grin talented pair along turn hand beloved item stranger reboot time subject yet another death scene tell origin story another plucky teen energetic grapple infamous help number inter dimensional people include washed cynical voice nonchalant drawl watch grapple find foot unfortunate interaction radioactive arachnid hearty humorous adventure feel distinctly noticeably different adaptation friendly neighbourhood superhero outset film cheekily satirise incessant reboot character flashback certain moment give perhaps big laugh fun poke comic book movie trope change fact however plot wise little offer term originality narrative predictable morning cartoon film almost make redundant however stylish confident execution feel fresh script full wry humour quick witted yet full heart honesty also flesh lead use despite slightly easy resolution arc band misfit whilst largely one note fun enough carry film ease unfeigned father uncle respectively simply brilliant incarnation hitherto undreamt antagonist form disappoint force motivation leave uninteresting decidedly number movie leave little time think fault though take relentless yet natural pace rivet action sequence comedic montage ease web swing great strength however design animation unique aesthetic delightfully reminiscent old school comic strip film feel like real homage source material comic comic book movie always come first remember break ground plot character design alone enough make want back assemble fun frenetic film whilst standard paper execute artistry flair incarnation world favourite superhero surely remember
1231,glorious excite well tell film fan character since original film confidently say film pay tribute creator legacy even comic book medium superhero color year prove anyone mask hero cool interesting character also date back original character comic rest bring different interesting perspective character genuine comedy depth motivation make character full life stylish fast pace well told movie movie recommend even know much wall crawler
1232,movie delight funny heartfelt lot cool action lot bright colour really love know much character go totally love see go forward film man thoroughly enjoy movie teen comedy also like mixed different animation style together also felt like comic book literally come life also shock expect death certain character say menace show still pretty good good still overall prefer man even though villain lack little definitely make various spider man love already state think really good somewhat bitter funny surprisingly work world man great think perfect fit also really like like see credit get fantastically funny song well funny credit scene say felt make sense catch sooner really track back apartment cry loud think big coincidence guess small nitpick overall recommend film think good adult teen kid super young one though
1233,movie work many level include visuals animation feel unique like lot really struck movie character story bind together good way love movie although feel certain interaction character bit forced overall love
1234,comic style naturally beautifully animation interest compel cleverly craft realistic engage rather rush character development though
1235,amaze animation visuals film absolutely incredible write cool use comic book dialogue soundtrack fantastic want listen long film story laugh tear jerk moment cease entertain message film take leap life get need movie
1236,story great bring humor sadness time also fun group character
1237,huge fan see movie stunning animation great soundtrack three dimensional character like mother main character screen time brilliant movie time animation almost seem like live action much take sure second third view reveal thing even notice time hope sequel job team fence see see theater sit end credit something funny afterward
1238,love film way around affect absolutely stun
1239,movie absolutely amazing colour plot character development etc make thrill watch highly recommend watch even non fan
1240,start movie mean spider man fan fan watch character evolve big screen video game eye movie spider man synonymous change write movie content call man movie help realize spider man person rather ideal make people want right end spider man animation plot theme imaginative lively movie perfect final battle predictable method overuse movie perfect earn high rating count twice visuals
1241,feat multiple level animation style never see anything like take bit get use animation make feel like read comic book story big concern go filmmaker explain concept multiple parallel universe audience without bogging plot despite none spider people show films element character make one feel indeed person cameos reference canon make film especially fun longtime fan refresh take superhero genre whole get comedy drama action heart do
1242,animated verse movie feature along person throughout multiverse team stop threat destroy every parallel reality lot buzz around film even mention nomination best picture animate feature big one quite like movie walk away agree talk surround film even say may perhaps best film ever make know agree either glad character finally get time spotlight contingent fan call live action film feature character still think year away happen give one hell performance fact impressed voice performance entire cast especially impressed performance really great emotional beat moment film especially dad well uncle though enjoy film wow expect film never go live hype enjoy reviewer say favorite comic book film year disagree money first act drag bit pace felt bit start second act onwards thing really start pick story seem flow bit smoother well love fact character include film character add lot levity film couple dark moment tonally overall call tone dark mostly fun emotional cameo get bit choked especially consider context scene spoil really beautiful moment main big bad film couple notable villain turn well see film find delight great job character different version one see screen add lot dimension importance character definitely recommend film fan version version stick around post credit scene another yet see screen make cameo
1243,gotta admit week ago take family see must say expect much hella movie move point fast hardly dull make laugh feel rush action complaint really complaint bit age mark thing action high bother intend audience personally think extreme flip side say see best animate movie year
1244,lush astound stylised artwork meticulously blend screen print style graphic edginess colourful super funny sweet almost hammy type humour movie really enjoy visual treat sure
1245,save best last hand favourite animate movie year innovative dramatic pack powerful slow moment
1246,funny moment confuse part convolute story movie really need make
1247,enjoy movie worry face much flashing image light difficult concentrate movie
1248,comic book fan enjoy comic book movie entertain visually fast cluttered good cgi film year best far star
1249,best cringe movie award person stop abusing main character shoddy behaviour non work brain
1250,movie actually really good follow stop machine combine dimension become next gotta say really impressed animation absolutely stun ton animation joke really gonna talk anymore visuals say death movie gorgeous action also really engage fast paced get weird time still follow ease animate film movie surprisingly mature moment think make great mean damn character actually die many emotional moment theme divorce depression among others think movie best movie even amazing movie say movie definitely understands character love theme everyone become real problem come character character get significant development movie respect excellent really great emotional moment great job voice fact whole voice cast phenomenal job apart character get significant character development mean get movie develop character character really dimensional alternate dimension entertain really care old do really well though little arc movie definitely well developed see reluctant mentor know right thing need apart character get basic information everyone else character give origin know anything else scene handle well though without make repetitive character barely anything thing unfortunately happen villain severely underdeveloped villain know anything get motivation early do well thing know thing happen prowler except even know motivation connection character really hurt movie old well developed everyone else kinda fell flat bad feel like shell character like good despite know significant flaw movie still great focus negative everything else good soundtrack brilliant think music choice odd theme fantastic score humor do well issue film kinda cliche mean remove travel stuff average coming age origin story example movie idea use power need suddenly perfectly know use power though do well either way consider extremely fast paced movie feel rush sometimes noticeable plot convenience especially act specific issue movie might consider minor spoiler warn begin mentioned turn machine else end destroy dimension however later movie change let enter dimension quick enough part convenient use basically flash drive stop device somehow control dimension character go final issue specific one moment shoot certain character awesome moment make sense shoot mean probably dodge bullet spider sense know make sense think overall movie great mature animate movie animate extremely well great voice actor great overall
1251,perfect mixture drama action thriller comedy well mark dub well artists super cool movie far best animation movie ever make element ice cake love comic book strip element
1252,good one time watch movie far well recent movie enjoy part especially excite see bring future
1253,saw star voice movie movie animate movie give look different alternate dimension also first animated movie rat familiar comic know spin hero play run original notice name tell apart book cause dimensional rift others visit world couple make rift also robot others help train use new talent little different make ready make usual cameo hear last voice act role lot humor throughout film pretty good sometimes hard time hear everything audience laugh loud even nod live action film show make sure stay end credit nice scene another show earlier rat action violence thematic element mild language run time hour minute big fan otherwise really enjoyed look different version beloved hero buy one
1254,far best movie believe able pull hope rush sequel
1255,type movie love animation hope get star
1256,film brings light hearted touch world dominate superhero movie take seriously even poke fun old movie arty animation fit tone film perfectly visually stunning pleasure see believe anyone look easy go feel good film certainly satisfy watch film
1257,high hope come fear confirm movie felt like rush spin weather classic line place little character development good one get lose scattered sub plot might like traditionalist likely scoff average best film rush holiday
1258,week ago confront opportunity attend early screening courtesy watch movie find actually succeed expectation landslide review one rotten review decide movie good great somehow find way combine look graphic comic completely disorient viewer animation style unique new think ever see anything like movie look single frame pick random movie look like still image comic put many frame together seem animate perfectly enough soundtrack contain many song new let say artist music mixed cinematic action movie music create almost great soundtrack new soundtrack seem aim towards young people listen artist like soundtrack do without music opinion crucial towards develop young adult movie use song calm feel stress scar often time see wear headphone hum along movie full variety joke understand everyone others understand true fan movie show hidden place give people reason watch come digital dvd hunt little easter egg rating truly enjoyed movie age able come watch movie still feel entertained movie runtime two hour honest sat go longer want see swing around give feeling satisfaction trailer really trick plot element hit nowhere like movie studio completely mis lead trailer show something never saw come character play crucial role plot imagine movie without even one many different character play father figure help learn true meaning hero sense really thanks invite early screening reading review
1259,real high expectation start watch movie top list even claim movie best movie end bit dissapointed way well one one movie focus much animation pay actual plot visually amazing plot pretty vague unclear seem like thing happen different place kind beautifully animate
1260,really see movie important young black community whose hope dream always possible history tell different story struggle animate movie make sense wonder white male living make black black panther still politics history hop story gut less cliche many loose end opinion spoiler get animation wise never see anything wild interesting mix comic book style ever imagineable animation detail amaze felt sometimes read comic book read one year lack interesting story many cliche make rate lower fact black exist make give point production character plus voice actor
1261,think seriously delusional might even need help film immensely entertain hilarious wife watch huge grin face first hour superior meet watch become also best one go rail climactic altered reality battle animator go haywire loco also lose point hunchbacked unnaturally strong manga pig also stupid everything else spectacular spot twist one villains shock death love see movie first movie delivers high praise well deserve
1262,everybody say perfect yes right perfect huge fan rating give might get little bit bias still great fun funny cool unique mention deep message carry throughout film man mean one strong perfect time persistence stand believe right despite odds win rise matter many time one get punched matter strong punch matter fall hard fall make man woman woman course web sling thing learn way teenager new place seem cold despise human uniqueness gain new ally friend alike way never imagine even wild dream think also find betrayal loss scar life put verse par year fun family kid friendly root deep message family find acceptance world seem need care another one movie remind well important similarity kind compelling far keep good trend cartoon movie next project beyond definitely entertain wave wave top spin offs solo movie character verse gwen woman noir ham
1263,film direct trailer film excite lot anticipate film long time see today satisfied team different universe take direction close heart ever since watch cartoon fan character film exactly show respect character audience love character almost year story engross connects instantly see every perfect make unique family dynamic nicely highlight film see character something begin end feel every one likable end film even decide one like well melt heart good way like animation also closer comic never see animate film recent time like way thought box comic introduce never expect visual effect fight sequence surely treat watch comedy spot joke make laugh maker even make joke everything know without offend lot due intelligent write voice act also great cast spot score awesome fusion action pack score along song cool pinpoint one thing good seem like maker want arc decide make character less interesting scene heart heart talk son behind door due situation open door like small pep talk father son inspire kind brightens ray hope inside may place film par series seriously good mesmerize every aspect film second felt bore tired watching film film obviously post credit scene advise stay till end standard film sequel spin offs ready well good fan sure disappoint go
1264,amazing film animation style phenomenal easily one best look animate film ever literally feel like comic book motion pop life art cinematography ooze style hence lot amaze action sequence breathtaking trippy visuals film merely visual spectacle also really heartwarming origin story new witty dialog poke fun superhero trope past man history visual inventiveness lot heart humour character development film rightfully earn place alongside flaw film short want see multiverse animate style never think man film top man film man verse
1265,go watch movie low expectation absolutely blow away hugely funny scene brilliant animation aswell like real life comic book recommend watching
1266,luv morale think first gonna way different parker turn share shoot web also goofy clumsiness animation unique comical yet feels alive story good amazing fit tone movie fun may badass like pennywise guard cave make suit stuff lovable character fit support well best animate far maybe fun say
1267,enjoy never really huge fan superhero movie specially saw teaser end really intrigued animation graphic style forward month fanatic friend tell theater watch still interested watch clip never care watch trailer boy glad experienced amazing hour beautiful look visuals animation blow away pretty sure visual orgasm first time story tell smooth think one thing get wrong tiny nuance character attention detail movie something set bar high others watch hit y favorite one totally different level gonna watch never do life theater thing worry live sequel
1268,round brilliant movie good voice cast except good balance humor seriousness many lesson learn young movie goer warrant try watch line fresh entertain engross okay turn brilliant comic book type narration good see arch rival make first appearance movie miss cast miss spider pig cuter
1269,movie ever best animation movie year save world together see new normal kid responsible skilful hero whole movie use unique style feeling audience read comic book feeling like old comic book printer error everything look little bit obscure like director producer bring comic book back life speed movie good new kid get bite spider idiot master base line story give family line issue best friend uncle know die fix family problem another line writer give third one bad guy teacher call motive line want become real movie absolute protagonist say pity movie use much part talk luckily otherwise movie gonna lose focus charm unique special still let steal thunder surprise way manage come flaw bgm really loud even cover line sometimes flaws buy ticket watch
1270,personally still prefer classic original story movie little bit many version spiderman true special power little bit confuse overwhelming wow scene watch version animation well do
1271,unique animation style plenty clever write movie like none film center teenager find possess power reality well another reality path collide well several others must stop villain name film stylize animation style intend look feel like comic book viewer might find bit jarring time time animation look outstanding extraordinary level attention detail scene near climax web swing utterly stunning film plenty egg throughout well superhero fan certainly appreciate well great soundtrack story engage entertaining film well pace without ever drag narrative open many dimension pun intend plot able properly tie loose end film thrill engage climax superhero movie real emotional connection many principal character form actually feel character also quite well developed even development form somewhat repetitive manner time real criticism film villain besides always enthral always add much narrative scene appear highly entertaining original take breath fresh air get tire derivative superhero movie recommend saw film friend agree format really enhance experience sound picture quality strong use rumble effect effective immersive use frequently film see
1272,lucky enough buy ticket early screen let say think absolutely amazing true love letter big fan even know much enjoy movie reference comic show movie make happy film hilarious mature surprisingly dark time stellar voice cast get forever hear shameikmoore fantastic see get due film capture attitude personality perfectly love mrjakejohnson fan capture deadbeat attitude version still classic charm haileesteinfeld really good job voice actually cause like character previously others ohlittleasianone johnmulaney fun really enjoyed always great mahershalaali voice lievschreiber voice menace great cameo animation action stun beautiful recreate way thing see movie creative way serious animation probably stun ever see begin tell fun worth credit beautiful story script flawless post credit scene one hilarious yet best movie much love even dedicate honor soundtrack fire well huge fan whole life recommend enough wait watch
1273,write smart animation best ever see must film everyone even know spiderman
1274,enjoy hence give mixture funniness hapiness sadness good
1275,refreshingly multicultural spin genre traditionally predominantly male predominantly white love film like wide range young kid watch film see people look sound like resembles world actually exist rather worlds super hero movie white men constantly save day also funky sound look movie teems urban flavor animation purposely pixelated recreate look old fashion comic book gorgeous still disappointingly super hero movie popular sentiment indication pretty much problem fine live knowledge movie formulaic draggy central story line kid whose insecurity prevent rise full super hero potential guess one many scene character give lecture become true self etc etc story weak confuse mish mosh villain mega weapon alternate universe super hero movie convention filmmaker try disguise messy screenplay bury avalanche loud hectic action scene throw lot stuff hope something stick dislike super hero movie everything come prevent fully enjoy movie go watch super hero movie want look sound like one
1276,really scary part parallel universe character storyline might lose young kid think gear high school kid nephew year old say liked good cover ear scary part soundtrack invoke fear movie ever cartoon cater good low age demographic visually stun feast even though prefer look classical look cartoon
1277,realistic burying headfirst hype best since story good pace unique animation seem enchant everyone good moment humor thanks huge fan series help compare new cartoon animation make new generation kid modern song style fan dash style animation still enjoy action pack sequence two favorite love see something two big knock throughout first hour develop nice steadily sudden plot require get whole new level acquire ability instant honest way man work see cinema feel look way home
1278,plot messy multiple dimension pull well really nice see story become instead story already see many time great movie absolutely anyone even never watch movie life
1279,proper title reason poorly open release try guess lol
1280,story best movie ever one thing huge mistake movie possible come earlier world put head dimension machine suppose appear crash remember met school scene tell
1281,enjoyable movie kind reluctant go animated spiderman movie glad visuals world never see pretty animation story fun engage recommend
1282,idea expect walk love since child permanently scar iteration totally refresh phenomenal cool visually different anything else ever see voice act point weak spot absolutely perfect plot original script funny watch probably ten time point still catch joke first time good little random classic fun literally think one tonight kid grandma upstairs neighbor think insane much laughing watch
1283,soundtrack thrill emotional actor good funny
1284,superhero movie release lately feel kinda disconnect make feel like really cool sequence accepts role awe inspire bring smile face like movie watch past year
1285,movie amaze truly worthy spider man creative well write super hero movie ever must see start finish short wow wow
1286,solid story amaze edgy visuals include cameo wink face like
1287,amaze animation visual style incredible really bring mind detail real colourful comic book story excite mash many different protagonist another new use well classic underdog story make surprising hit really surpass previous work hope keep
1288,treat movie fun exit beautifully colourful efficient every aspect surface nice comic book story new learn deal power time take mantle previous generation rich enough premise yet movie keep twist turn every corner movie gleefully subvert expectation superhero trope work frankly well do movie sufficiently self aware twist story something unrecognizable know put back subversion gratuitous part narrative lead satisfy end bold enjoy style much movie try trick first make bit alien bizarre bit jar time narrative go forward becomes impressive confident also fluid enjoyed visual style different also like narrative stretch limit form come back together course movie lean heavily contemporaneous sensibility word meta rather explicit way comment reference cultural place world enjoy every minute leave wonder translate future audience minor nit pick meta text come addition action adventure view movie pretend canonically accurate definitive way movie perfect time delivers story anti story address mythos worthy interest provide answer decade comic book movie ubiquitous movie go beyond establish trope twist allow go back original intent movie joy light fun excitement touch gravitas reconcile varied audience young old movie smart technically proficient sincere honest honesty visible screen movie fully animate feel fake artificial impressive visuals innovative way story tell celebration homage power comic book clever commentary film genre think movie best film extra comic book layer without sarcasm without pathos
1289,hate movie art style cool story voice act point good story representation show anyone hero also great superhero movie wait sequel
1290,probably favorite movie long time come
