,0
766,heard set movie thought way already entirely many man movie concept kinda weird try fit way many character plot one story wrong degree difficulty super high still stick land introduce new man pay homage man story create something felt entirely original without rehash origin story moment little much happening choice almost entirely pay almost character give due animation plain gorgeous soundtrack great great movie experience might like simple story little mostly want man life
767,go animated way ever become least real action life movie give something else really dig relish fun share fun movie quite self aware whole origin story happen even make fun one mind work fine culturally appropriate add mythology dialog feel fresh story cool get many funny thing thrown way fan previous movie comic really great say big mcu fan make happy continue thing stay creative one movie evidence need
768,movie insane visuals stun give great plot origin story protagonist antagonist whilst still keep spidermen character development best see spiderman long time great twist one best end superhero movie
769,great side story spider man phenomen fill amazing animation plan watch think typical super hero flick wow wrong animation next level combine everything new make look like old animation style accustom recommend hand
770,watch extremely disappointed heard movie ecstatic finally watch let one bit character really likable funny one favorite movie last decade
771,brilliant action pack star give movie base around one favorite topic well love movie witty time perfect storyline interesting unique make want read comic read know story likely real need play catch see yet highly recommend
772,little bit long side start thing whilst sort become numb visuals good family sunday movie
773,movie beautiful art sound design fitting music well character likable story whilst complex one nonetheless compelling
774,new game come thought good time watch much acclaim film review film funny film come go cinema watch animate film today first time ever watch film review premise film see teenager grant power must unite five hero dimension stop threat every universe play think fantastic likeable character film great job make care want succeed throughout first film focus do wonderfully add humanity role despite animated character feel humanity well rounded character make one best main character superhero film see long list support character plays good really interesting take character something never see screen burnt veteran see dynamic really cool see much need nice story arc play also good job friendship nice part film make likeable something unique character flesh add something fresh character favourite character might fact yes play brilliant cool clearly love play part really interesting cool character want need see future play really interesting antagonist really easy make number generic villain really flesh character make interesting motivation actually relatable weird way really rise film really good role story really interesting make bold choice afraid get dark order tell round story help stay fresh alot go never feel like much everything important character interest well write mainly due care depth give plot fresh tell interest story different build new world really want see sequel spinoffs script fantastic film plenty humour lot reference live action film nice see also plenty heart emotion film consider film family film pretty dark adult great choice make film accessible fan ever style film superb animation style vibrant colourful really stand time look like comic book buy life really anything like around action scene great really feel true mythos film new generation older fan love important movie honestly believe good film honestly one great comic book movie ever make see film must see soon possible many introduction great hero inspiration new generation might even see main future excite time
775,always favorite superhero time possibly character well general character mask represent full blend moral code self improvement film show best fact never give take responsibility face matter afraid might course know get chance opportunity make good world duty make possible animation course one main aspect movie tell everyone tell really astonish manage make sort animate comic book action work perfectly animation style even well fit due fact talk take next point design know character considerable change counterpart comic book begin convince cause always like everything similar possible original source remember universe main one say really get like interest change villain amazingly keep natural essence yet pilar movie listen track durong sequence teach swing without know movie tell melody listen something melody really fit something universe say song select movie become iconic movie best movie date
776,reluctant watch huge fan cartoon superb start finish build character brilliant amount comedy criticism keep story slightly realistic level even superb film wait watch
777,really enjoy movie never normally like marvel movie one great animation stun gorgeous character great recommend movie anyone like spider man recon spider man fan enjoy great kid movie highly highly recommend animate movie
778,new amazing pice do storyline different kind spider man feel like crowd everyone perfect animation signature work one mix traditional animation animation best adaptation best story animate movie make
779,decided view work exclusively third party therefore personal initiative lead view wow wow wow great back marvel anticipated vision purely involuntary stupefy even true work worthy new new draw technique new subject nice artifact might seem like usual superhero story mixture true cinematic art brotherhood friendship full respect pure reality director manage create great completely new atmosphere like emphasize draw technique give comic style immerse fantastic draw sequence poetic metaphorical color bond family accurate detail interpreting common reality tell opinion best animate movie ever see point
780,visuals engage story hook begin end
781,astonished animation let much creativity heart film visuals best ever see amaze pace character feel need improtant music amaze good score progress character along perfect
782,firstly watch trailer really surprise expect new animate film watch first reaction wow plot interest base story show different look new fresh animation technic wonderful new take lot time create lot easter one best animation many year
783,good cartoon animation amaze extremely creative fitting like read comic book act pretty good well although villain develop bit still complete unit physical presence every scene woman nice twist well people pretty fun well nice individuality bit confusing time travel dimension travel always bit iffy overall away think plot bad fight scene repetitive excite fun must watch fan like comic book love
784,fact one help way save lose life world little movie finally save every parallel universe also return historical background face world dilemma
785,good interest intriguing movie enjoy every aspect detail movie
786,especially want movie win best animation year stylize style design make people shine many year see many animation light really change taste core story also rich layer extremely strong action scene strong final climax simply make everything extreme super blood last carnival happy viewing
787,new era computer animation one raise bar least two notch render worthy multiple viewing appreciate artistry
788,love spiderman since small child watch old show keep movie imagine movie remade live spiderman legacy must watch list
789,like everything movie graphic character story moral really nice surprise generally like an mcu movie
790,take second truly appreciate movie brings feel good story give necessary amount character background help love relate character plot action pack enough twist turn keep viewer hook like watched mcu movie death tire usual superhero genre plot somewhat tiresome predictable tire know actually nice break risky movie pay massively fool comic book style animation hugely complement film visually stun true fashion fill moment comedy quip bring smile face laugh chest also boast unbelievable soundtrack add wait sequel watch proud one
791,especially liked music animation excellent neat thing color like statick split universe one come liked character alot like say music super
792,verse film get everything right refresh impossible believe seventh film third origin story creative amazing somehow brilliant writer behind movie manage story revolves around young teenager get bitten radioactive spider character may sound familiar story use rather clever way somewhat similar enough personality hold relationship father emotional backdrop entire story something lose uncle well death character quite different like teenager simply try find place world adjust change body try get girlfriend goal go becomes superhero rather exemplify try adjust change spider bite try ask try decide hero end taught secret path success perfection rather constant road try try always best word leap faith character great film old cranky mentor spider man character probably close get main depiction story surface might come funny quite tragic really think character two decade half life initially start enthusiastic gradually become bitter grow old cost marriage trap constant loop save people keep always sick moment film mention sick line great power must come great responsibility show somewhat resent line throw miserable life end however decide go try give thing another chance character arc like moment extremely funny kingpin motive understandable presence intimidate animation truly boundary push frame feel alive full sort movie watch lot little eggs hidden joke constantly lurk background try failed capture feel comic book sloppy editing film every scene naturally feel like page comic best way describe comic bring life visually stunning way rare superhero movie joke cleverly write well deliver burst laughter course story comedy feel like natural part story instead force tacked dialogue equally ingenious movie respect character truly understanding stand inspire also contain one last cameo really touch emphasizes fact anyone whether american teenager middle age divorcee detective fight girl future pig love letter entire animation industry whole prove much potential creativity gain animation must live highly recommend movie easily one best ever see
793,amaze mind blow story quite good original amazing experience good watch first time
794,best movie ever make concept multiverses multiple spider people flawlessly execute movie almost entire villain rooster spidey origin story twist rarely second movie thing slow notch animation visual effect quippy dialogue one another fill quick meaningful character development help create masterpiece movie recommend
795,burst combination comic animation refresh new soundtrack place universe unique movie worth watch grow original child end hero well interpret fact everyone become earlier
796,three dimensional image good story finishing
797,love style joke point influent color look great topic strong indicated diffirent spider men think idea intersting joke film make relax story normal ask point emotional
798,whole movie full laughter laughter even make deadpool loyal reflect even make joke story seem full tense low scene plot also let avenger superman batman justice league low scene great tragedy feel really sad deserves treatment dull hysterical deep level helpless disappointed animation mourn without harm music people solemn silence child uncontrollable sob softly echo cinema
799,get one version classical superhero seven enjoyable action film follow high school student drum roll get bitten mutate spider give similar superpower legendary plus invisibility ruthless crime lord experiment cross dimensional travel various alternate timeline join quest stop plenty superhero movie might hard persuade non fan genre watch comic book fan lie say majority film cinematically groundbreaking however fresh sip hero comic book adaption combine bold vivid animation eccentric storytelling eye pop action sequence colorful imagery film wrap excite plot invite humor emotional weight lift tremendously well ensemble particular unexpectedly funny tedious moment timeline travel film sit end couch fight sequence dramatic revelation beloved uncle brutal criminal hope see much well craft animate film time superhero hysteria amaze might crucial genre future
800,highly acclaimed movie really different special movie previous live action movie series broadcast form animation say new fusion hand drawn comic animation plot still confrontation justice evil look special channel film unfold parallel universe open six different time space different personality different age bring together future fight justice order defeat ultimate villain universe really special subject real life definitely encounter various problem anxiety terrible angry stressful etc time believe parallel universe happy self thing occasionally hope person parallel universe help solve thing encountered end still solve thing life universe parallel universe also rule life like little black spider movie save think parallel universe help solve problem day think solve save hero universe
801,colour comic book detail use groundbreaking animation canvas highly entertaining fantasy adventure skimp character story spectacle match impressive ingenuity display unique animation style constantly find way evoke comic book look timely use caption split screen panel frame waste ever compliment array character different dimension thrust together must work one take immovable force comedy emotion story responsibility family film manages prove exercise style substance something say happen style animator deserve credit bringing adventure life time effort talent visible every facet screen series epic live action movie invigorate breath fresh air miss
802,admit expect lot movie many movie think see anything new interesting skeptical multi verse well happy say wrong even surprised admit must favorite movie
803,movie big surprise winter movie finish let shy people want hand hand stranger street cold wind invincible visual effect put real superhero movie year level frame picture activate cell body devastate cold winter give courage career frustrate mood fall low ebb watch movie walk cinema carry backpack tiptoe excitedly among crowd watch atmosphere windows side street street lamp gradually light gift shop sell hat mask cartoon character seem take red hat mask also become spider man also shuttle building become great hero small world
804,see one strong animation film without visual wallop mirror rich colorful picture never appear clutter filled element valuable miraculously worthy great picture story key set plot twist character choice theme service growth protagonist fit six spiderman character film narrative focus never overdone especially second character parker charismatic minor glitch climax stop film model similar animate commercial film
805,give star know watch think bad movie actually one spiderman movie
806,assure movie perfect animation amaze probably main advantage film great casting well performance rest love story bring whole multiverse thing every spiderman movie represent different dimension example spiderman noir represent movie spider ham come looney toon kind dimension love really
807,strong random change movie maybe even best movie history script visual scheduling artistic design even soundtrack perfect classic make people tire special effect blockbuster rekindle passion
808,movie smooth plot lively rhythm sense humor natural warmth funny life watch think everyone man regain love plain life love much justice without hesitation fight big evil small heartwarming move right super power mean become superheroes important thing heart
809,spider suit fit one day sorry hear movie run movie word mask ordinary people daily trouble also people want make spider man animation movie amaze lens rich imagination colorful color incomparable real shoot eggs final subtitle away multi universe spider man officially
810,verse one best superhero movie see decade new comic book style animation extremely charm character charm main character great arc allow journey experience grow pain become superhero superhero movie far eager get spandex costume explosive showdown soon possible movie spends time learn control power get know normal teenage kid get identify make final showdown much meaningful happen end one criticism movie get pretty overwhelmed spin spider character get introduced maybe spider even hear character like kind distract part like take screen time rather look even suppose hardcore fan enjoy absolute best end credit sequence see movie keep watch see real good art
811,first time watch production fell love brave true everyone
812,story still story old fashion superhero whole picture really give big surprise plot dialogue interesting scene particularly comical give strong visual conflict excite watch various spider appear end style paint like comic strip move directly lot imaginative expressive shot achieve live action movie advantage animation draw something real people believe still feel cool charm animation different live action movie
813,like part start control power get suit way save doc ock incredible save others return home
814,movie truly world story simple cool mix loads different technique simply amaze really give movie edge music superb mix comic style various frame rate really great use variation color wonderful love
815,skeptical movie see trailer pay much attention review whole new seem stupid finally watch movie say impressive easily best thing animation studio put since even know impressive solid story perfect definitely work
816,late out vibrantly colourful fast paced comic book love letter amaze superhero fit tribute late great time focus particular reality due universe shattering machine use classic villain come touch dimension indeed include personal favourite really enjoy one part much fan visually inventive animation prove distraction emotional entrance point story character shame intentionally aesthetic background watch version make feel like walk wrong screen simultaneously strong point term spectacle different animation style mix together quite lovely watch come masterfully together excite final showdown sequence worth see big screen possible think quite memorable reboot last year still damn fun out
817,exceptional animation piece work unique style animation credit film explore different style spider verse fan enjoy get fresh new experience franchise whole new outlook perspective spear straight comic book franchise point view actuality look comic book perspective side spider verse seriously need scene fan awesome movie
818,great slow burn comedy definitely stick know unpopular opinion try crowd honestly think overrate
819,expect level quality sony movie well write lot say real emotion mix tremendous art style glad see crackle big screen credit stuff great
820,visually stun animate feature film rich content story origin story multiverse travel adventure one involve incident leave spidey superpower also witness incident see murder hand fallout also cause multiversal rift somehow pull various multiverses spider people existence hour half film well equip keep audience grip entertain something new audience well people well versed come look aesthetically good mix various animation style really enjoy film
821,start obvious movie aesthetically gorgeous art style work perfectly nice change typical animation see mainstream movie today vibrant colour small text description character model purposefully realistic comic book style work perfectly favour movie story however spectacular bore predictable hero gain power afraid capable handling nice montage realise responsibility continue save day quite couple comedy moment great timing turn funny others quite succeed moreover forced scene begin dad ask front entire school say love bit top think hand message movie send really nice everyone hero right incredible movie watch much understand still enjoyable experience like superhero movie like give least animation style
822,surprisingly hilarious many different way become somewhat core movie stay end top tier end credit scene
823,wow blow away animate film well able take separate character give much development without film feeling like drag
824,spider verse fan want long time delivers excite thrill journey beloved superhero good story pretty immense score top level engages till end world class superiority mind blow keep eye close one sec good want character mother enjoyable experience
825,expect enjoy movie much trailer look hyped think flop like one eye glue screen awesome animation creator put good job
826,asleep time watching film time awake enjoyed animation look like something enjoy busy doze
827,easy see become visual masterpiece creator put lot love passion make result amaze
828,proud story great message great animation
829,blow away good movie expect mildly entertain really get pulled character one best animate film see quite time animation style visually unique fun watch want little nephews see movie get old good
830,cold weather great place good time come overseas lunchtime
831,spider verse one best animation movie ever see process create kind animation unimaginable revolutionary fusion comic texture effect create visual show help mood narrative script great best great example give color life character think idea anyone wear mask great target point drive movie think make feel inside movie end feel really good
832,overcrowd oversaturated mess superhero movie easy overlook pas another silly superhero movie movie really league animation blend countless art style one beautiful picture amaze story really explore uncharted territory character development come origin story
833,voice act animation story perfect perfect comic book adaptation mix everything enjoy super hero movie perfect mix diversity without shove politics face
834,film manage make leave cinema feeling satisfy certainly succeed feed audience laughter feel joy like childhood feel aspect present nicely wonder film get rating rumor film sequel know story discus relationship go forward sequel make let watch film first near cinema
835,best movie even say good one spectacular watch animation fluid except part look like stop motion necessarily bad thing actually like character also quite lovable especially know much love recommend
836,action start movie slow good action many smart joke spider character similar essence spider creature unique style music choreography close really good production
837,really enjoy quirky movie animation style character plot like everything movie expect get wrong love animate movie like super hero movie really like usually watch animated movie bit lowered expectation generally entertain cheap weak write weak voice act weak plot full blown make prime time blockbuster movie act great use lot triple actor role plot pretty good although feel bit rush nothing overlook style crazy kind disjoint work well felt like omage literally bring comic book life well wink nod general direction fast pace movie suitable age scary loud scene couple death scene little sensitive might much watch pretty sensitive use movie compare future watching animate hero movie
838,watch marvel relate animation expect bad plot dialogue film movie far one good animation keep want see hope make sequel project writer course
839,creative exciting film animation unique take spiderman story feature various version spiderman tale mark good storytelling humour fresh look superhero film film hook start finish great story meaning
840,saw another review say cinematic euphoria possibly think good way describe raw creativity film legitimate astound artist wonderland
841,best animate film look far masterpiece
842,man fan since toddler always love watch movie watch cartoon read comic book hear movie super hype great fast paced story line great character action awesome music spot love way story tell comic book style reference old movie comic tick box man fan
843,perhaps well expect superheroes never really high hope movie surprise straight bat couple reason one thing animation expect significantly protagonist movie regard bore character protagonist half half teenager bite radioactive spider subway plot fairly interesting allow multiple men woman get much often pay complete attention think animation style totally fit fact watch whole movie probably sign good since explain really kind thing watch regardless
844,movie incredible surprising attention dominate film pheromone one visual graphic please spectacular eye fell love movie quickly thoroughly enjoy love story
845,lot hype film surprise first glance trailer dismiss saw direct film hype give pause time make wait time settle reality outside hype award open expect pleasantly surprise pleased creative several area production term narrative take risk silly alternative able balance engage reasonably serious core narrative manage funny fun engage enjoyable way wise mix many style approach well felt ott visuals still somehow worked feel beaten tire sometimes happen visual overload overall design film add good use music shot frame animation make feel cool fluid throughout wise felt like get sense humour script make work otherwise do performance also seem get everyone play character well creative funny engage excite get accept term
846,kitchen many cook think even thrill minute whirlwind soul iconic superhero ancient new go filmmaker never forget make grow pain care believe animation transform something new funny fierce revolutionary whole army interdimensional webslingers coolest epic ever one year best film expect
