,0
365,movie great bundle fun colorful crazy active funny move like live comic book time much action laugh thrown story flow character great personality build climax keep edge wait one
366,movie great get great story great action great humor important great animation
367,find wrong spider verse perfect stan love visuals extraordinary really dig comic vibe story great really feel morale movie wanna web sling good sign soundtrack music fit perfectly movie make moore cool lee steve ditko creation spider man tough much live okay special kid super power normal soceity learn renew version spider man peter teacher mentor leave stick mile morales new spider man
368,make aware pretty early something special curious project long development unsure sit canon make know canon love letter every single piece know love even stuff might movie cartoon comic character icon want definitive think look oozes much style help suck universe animation slick gorgeous perfectly form translate big screen like never see beautiful technically impressive playing sort style help diverse support character never lose sight spirit never true comic adaptation far back mind alongside every comic book movie use many technique feel everything expect actually like yellow box good movie feel much love make film full everything hardcore fan casual movie goer work knowledge go impressed actual story character even touch review far get groundwork right course everything fall place subverts expectation give exact payoff want smart humour touch emotion everything great every piece fiction almost none flaws surpasses even like hammy beyond cheesy full bad get soap antic land set outside none thing reinvent alongside reference reinvention give origin story suck know know time know smart audience know know story beat instead give show give everything slightly different know expect leave happy familiar thing entire cast crew truly make something special write direct animate act soundtrack everything show work go stands apart animated movie recent year make yet another good case animation need mainstream blockbuster highlight well pretty much superhero movie make date breathe yet necessarily go big well human funny earth take journey take get weird get fun star voice cast praise sung people involve celebrated great power give get rein come great responsibility however say go glad go perfectly movie
369,look forward movie two reason great voice cast whimsy multiple character vary dimension instead build interest character hero villians present number long chaotic action sequence rob dramatic comedic tension lack well articulated character interpersonal dynamic also production anomaly puzzle time animation blurry draw version one view hastily put glass happen hand still blurry odd hop good story entertain character interaction disappoint give film meh
370,write fun voiceover soundtrack action almost look incomplete rush blurry minute ask theater manager accidentally play version search net guess look
371,best story great relationship father character great comic style never see still love best animation movie ever well favorite
372,open favorite comic book jump universe spider verse case good every minute movie even troll ppl hesitate watch animate movie enjoy thoroughly
373,low world really need another movie year already three different one basic origin story reliable formula run ground yet clamour fresh funny fantastic film prof entire universe mileage leave thing introduce brand new hero also dissect reinforce love good story voice high school kid try figure purpose life sharpens somewhat terrifyingly focus bitten radioactive spider find literally climb wall force assume mantle battling save world heartbroken insanity tall order half half kid fortunately soon discovers alone universe good even begin delight practically every way foremost remarkably refresh see character like young man mixed race descent get superhero origin story help enormously screenplay credit equal part sweet sharp snarky superhero movie cough cough take seriously skewer cinematic history cheeky charm impossible resist also lead cast enormously appeal character include clever twist fan favourite like redact good almost much go time stuff brim multiple character multiple universe multiple plot line much emotional weight fraught relationship dad uncle tear audience apart come close get lose amongst shift shuffle plot hardly deal breaker though narrative beat ready savour rediscovered rewatch gloriously geeky book fan rejoice one soul deep love lore threaded every gorgeous frame movie right plot alternate universe collide truly cult character tumble life medium animation make real difference embrace comic book root way live action movie film visually arrest sequence leaps soar frame trail sound effect narration wake live breathe comic book effect crown achievement animation arm fluid stun ridiculously inventive mix match animation style plot develop character watch egg galore aficonados keep eye peeled reference pepper throughout film late cameo break warm heart equal measure create name checked concept term well know fan comic credit series wonderful silly reward include song novelty album intrigue scene hint new animate franchise might sequel spin offs already greenlit raise hand also film feature possibly best use movie since recommend yes best movie nobody ask one best movie ever make period also top contender best animate film year fine voice year genius nod life long goal play stick voiceover work think face
374,shock like movie much never guess one favourite expect usual standard cgi movie look credit notice people behind write produce started make sense well best movie ever animation stylish mix cgi style art movie take seriously many different universe go crazy give real packed hour entertainment use music decent alot heart surprise good gag felt fresh interesting series real standout high bar set movie give movie run money
375,first second act amazing watch action scene sometime hard catch due stop motion lego movie style cut mix quick camera move stuff fly block visual effect eye get tired really fast first hero villian smash battle rest third act boring
376,homerun well plan theatrical release definitely great man movie right element balance regard humorous great plot great cast awesome action scene great character development glue screen absolutely love every minute
377,wait fot movie since first trailer come got fascinate animation style completely read conmic quite liked man appear much well expect visual part never see say little shaper use yhe color effect beyond ordinary style literally love scene remind abstract art painting wait animation process piece plot simple yet effective character likable sympathetic fell love perfect main character summarize highly recommend movie literally everyone beautiful fresh superhero movie industry
378,movie animation voice act top grade action piece full color energy comic book movie think one great honest least best comic book movie since heart break fun crazy one hell fun time love see
379,expect much honest introduction awesome character development execute nicely animation next level
380,pageantry costume wow movie start thing like say big fan past movie except couple original come movie plan like much although hopeful hear great review receive keep review simple much detail think great rather state overall opinion hilarious moment countless action scene perfect amount character development phenomenal soundtrack match today modern culture animation different standard really make feel like watch animate comic book definitely recommend see movie entertain people age leave want watch
381,spoiler review best movie make date much stretch others good great best state faithful source material mainstream mcu fantastic movie adapt mainstream audience morph law establish sense reality movie straight colorful page comics one true man appear movie main character alternate dimension exist part great universe create late great pass away year create man write majority comic past year someone read comic life happy report first theatrically release superhero movie faithful adaptation comic create amazing universe thank visualize original creation big screen thank thank thwip makeminemarvel nuffsaid
382,least discount bad cast entire universe
383,best movie ever make great movie best animation ever make get overrated
384,movie abysmal protagonist insipid super hero ever see hurt give personality plot generic zero plot twist innovation change pace nothing keep viewer grip seem continuation hollywood trend produce politically correct film expense plot pace story development dismal bore watch film way make entertaining movie
385,sucker really pretty film great visuals one best department story stuff great
386,watch day ago want think movie good new old fan spider man medium animation story character great say enough watch also put lot spoiler contain trailer two side villain character trailer make surprised female character reveal uncle work lastly universe relationship first call olivia octavius sinister personality look know love throughout year villain spider man good change paste film lot character balance appear movie first time think character appear anything plot change examine late another dimension seem version sort date blond late great character film hope come full villain second movie expect twist happen child film uncle look year moment refuse kill nephew top house shot uncle back tell fail family member make even sad father see dead body alley break even though make much money still brother universe become spider woman instead like comic much point turn lizard instead kill though lied want help get back universe say friend case either stop bullying happen notice expression throughout film imply love dated event become lizard universe thing movie sort hard viewer get movie slow begin look story also jump scare jump scare see radioactive spider ground glitched make loud theater heard kid scream make jumped seat recommend say end film man universe come post credit scene talk go another dimension go point spider man meme
387,skeptical movie watch trailer overwhelm positive review convince check anyway glad movie basically perfect fan animation stylistic cool music voice act great story manage somehow coherent juggle craziness lot content throughout movie fan comics one knowledge still good time highly recommend see amazing movie absolutely spectacular
388,talk animation really enough knowledge thing tell visual even though kinda get little bit dizzy sometimes color speed movie know much animation technical stuff still tell movie dope love story culture movie bring little twist give emotion since get movie like strong story music good genius movie lot little detail make great
389,movie first day excite movie since last year first trailer drop different kind animation storytelling character development point big screen find disappointed
390,hype movie year comic book fan mcu fan although enjoy especially love sucker teenage come age tale animation style lovely movie plot humdrum little character development none witty repartee hallmark best animated film appeal child adult focus get disillusion train get mojo back iteration unnecessary truly little mediocre kid animate movie small audience morning theater exclusively adult little reaction audience throughout theater recliner use actually think take snooze least couple time movie
391,think one mostly someone never read comic book grow enjoys idea movie leave visual experience much undeniably creative unique particularly animation think best ever see premise self aware original breath fresh air superhero genre voice act good comedy pretty good though found joke revolve around young goofy learn power trite overplay ready love many plot point leave scratch head sense real stake frustrate plot point absurdity new spider people especially make sense uncle coincidentally person work task chase backstory scene follow escape nowhere cut memory family die background felt place poorly edit minor point story quite predictable followed rote story arc contribute significantly sense outcome never doubt keep emotional investment engagement low throughout classic deus machina form struggle gradually improve use power right dad talk magically complete control win fight beast nowhere do good job show struggle value succeed task flip switch effortlessly suddenly powerful disservice rest movie feel like anything unique standard come age story message anyone superhero pay obvious honest homage comic book form genuinely adapting style movie see many thing really well various plot point frustration lack emotional investment due lack stake make forgettable pleasant movie experience certainly recommend others minimum get fun amuse visually gorgeous movie like comic book style time great
392,story sooooo mess good way like different animated movie perfect love iiiiit smile face heart eye
393,get rid sound track always head perfectly every scene animate movie
394,prop everyone anyone involve make film amazing experience movie make woah cool whole hour overreaction find beam lot masterpiece amount adjective enough praise visuals colourful edit sound mix importantly originality display hour movie know humourous emotional quite refresh meta overly pushy joke industry nowadays top amaze cast kickass soundtrack must watch matter taste experience film lover
395,beyond perfection gem live comic book
396,know story itsv touch upon briefly move away nice fresh take boot franchise instead fresh really fun see grow spider power people come universe also offer fresh alternative live action film since take mask performance round present well visuals music behind much reccomened
397,movie cartoon like watch non animate marvel movie much humor emotion kid movie age family family movie enjoy teenager want see animate movie go angry pleasantly surprise actually love want watch
398,animation great storyline great film purely awesome family film way story tell purely brilliant definite watch especially family time
399,voice act music cinematography humor plot story good good antagonist felt real genuine wonderful character protagonist humor feel weird genuine well comic booky animation make feel nostalgic make remember first start read comic book
400,wow totally underestimated movie story visual effect outstanding movie right element great plot character development lighthearted humor fit soundtrack highly recommend movie like comic book movie totally surprise much
401,animation humour adore movie animation mind blow beyond word comic style animation work great film quite risky move pay film polish best joke hilarious one time laugh want think speak everyone screen negative moment really rap music kill mood moment film really touch personal level confuse film everything amazingly care like need see film
402,usually hyperbolic review reaction movie movie seriously deserve accolade get lately let get something straight wrong room theater forget give glass watch movie movie go stylistic choice color background like old comic misprint color paper outside line animation choppy character animate time fps background seem fps sound weird huh feel weird first realize stylistic choice get clear movie visually stun first movie really say seem like comic brought another medium without lose anything perfect translation comic movie form video game movie movie piece entertainment style movie giant plus rewatch movie say one fine movie experience year last time come theater feel like watch something absolutely fresh expect expect yet another movie leave review film enjoy much watch twice see style movie replicate year come far storyline go story good pack punch might necessarily expect comic book fan old fan owe watch movie literally fill fan service throughout fan cinema medium want something stylistically fresh also owe watch movie really excellent movie young audience adults age come age movie visual spectacle feat achieve consider fresh movie come whole ocean comic book phenomenon credit scene go spoil talk soundtrack yet listen testament true character risky movie go expect sony studio actually make movie quality simultaneously set possibility movie style necessarily mention people involve movie yet people around involve unique movie last year give movie shot pick movie accident arrive late another one end love movie immensely movie compete title best movie date
403,stagger achievement superhero animation heart charm humour also take bold direction style art music seamlessly integrated create level effortless cool many character movie give plenty wait sequel
404,point view one best movie series movie maybe par good story line lot comic book reference character develop true emotion cgi show lot respect comic book etc etc great movie
405,pretty dark element movie overall thoroughly excite enthral movie manage completely new original combining element first film several comic medium real show stealer comic fan never predict list villain whenever effect music come entire cinema hold breath get strong show gladly pay see another verse star big screen villain really well design amaze finally do right first out sweet fun corny famous voice graphic bloody murder low point otherwise perfect film almost every way
406,year seventh movie last sixteen year somehow end creative stylistic comedic one bunch really overstate good movie animation utterly astound character dialogue well write story fresh unique special quality energy film give cinematography frame overall visual style see fully understood truly nothing like happy give high score possible note make hit miss studio make even please enjoyable movie truly
407,movie fan well rest animation story drop fight scene easter egg
408,go movie excite see prepared good worry movie incredible one best movie see animation incredible actor perfectly portray character use well single one fall flat feel place movie need get darker serious perfectly never felt place leave cinema feel much different come show movie message anyone able really hit taught audience right thing
409,single thing movie freak brilliant art one beautiful word describe sit appreciate visuals enjoyable experience story great flow naturally character development great love every single one even villain great story reason thankful get bore watch movie since begin feel amazed best movie ask best superhero movie year
410,story animation great voice act film start finish come
411,love movie right think marvel exhaust franchise surprise graphic amazingly stun cool concept comic book theme young everyone say spider man lame movie make spider power look cool always amaze
412,shirt get pant anymore enough say
413,best movie ever make character great animation funny
414,rich plot fantastic character fast entertain easy follow dialogue storytelling finally hilarious movie suit anyones expectation
415,first dammm love animation mind blow best annimation see year story great especially different story line entire spider man series comic cartoon easy everyone follow even read comic indeed know spider man hope mile morale spider man version remain animate certainly lot potential
416,strongly recommend movie funny animation impressive
417,big fan cartoon movie even low expectation begin disturbed kind glitch movie scene show spider verse gather around make realize concept glitch move comic look like movie make feel like move comic beside amaze movie image learn many thing mile happen mile father happen parent child relationship everyone wear mask
418,read comic thrill way feel like watch movie turn page along tell loud dynamic sound idea big leap dare present animation film style enjoy see soon
419,think much animation style movie saw trailer catch eye learn involve first think might straight vod release see theatre blow away animation fantastic sense style colour palette bright movie constantly move throughout environment look good big studio animation movie kid well make even amazing action scene put together stun movie inventive use character never lose focus happen feel hit character get bad moment show bloated superhero movie landscape get something keep engage visual standpoint impressive prefer superhero character rough edge flaw dole justice one reason superheroes like anti hero like work well liked character hard time pick hard time make tough choice new job also relatable problem homesick try live expectation choose right easy help endear audience good kid difficult time life also like fact superhero character like others provide contrast style also human character present real world consequence represent different branch take depend chooses family thing get dark really sell drama go consequence action get action drama best part comedy movie gut bust hilarious dialogue razor sharp afraid get meta poke fun genre saw friend describe kid film point dialogue box go comic visual representation origin story pull scenes movie make joke much funny content movie come alternate universe specifically version nail line line leave giggle every time small complaint movie entertain comedy get dramatic fair part do well wait edge seat till joke start fly voice cast good across board continuous praise everyone minimum descent job favourite alternate universe category unique take character round cast solid brief appearance really like get many dialogue heavy scene get job do also think decent give nondescript performance movie outright joy watch heard good go surpassed high expectation advice lump group represent superhero movie need avoid plateauing change thing try new thing think version sure eagerly await sequel team although late see make mistake love genre wholeheartedly recommend close give still couple small misstep
420,appearance little bit fast movie longer repititions
421,course producer visually stun wildly entertain work many level repeat viewing absolute treat wait next movie excelsior
422,visuals give headache due choppiness framerate personally find story clichéd connect character beyond surface level film tonal stability well direct connect way many animate feature give one time watch solid film kid nothing still pinnacle animation formulate opinion see hype
423,excited watch movie heard much hype totally disappointing bad spider man movie ever see swirly color literally doze good stick homecoming far home nice concept bad cinematography sequel please
424,want agree everyone movie amaze fantastic perhaps best thing since invention slice bread look closely significant problem start good comprehensive construction personality dialogue joke sing clumsiness realise micro gesture facial expression father uncle brilliant piece animation movie create comprehensive atmosphere style plan execute inch life grip start whilst watch movie great dramatic impetus desperate conclusion music graphic minute detail brilliantly realise good take character development must secondary story boy infect spider try stop use machine bring back dead family hardly substantial story believe case story incidental real story everyone wear mask use abuse vehicle advance forward political agenda parallel dimension dimension dimension alternative dimension nothing perhaps jumble think best blatant gender racial appropriation whole array divisive stereotyping use underpin political agenda perhaps even gross tokenism let say right use movie promote ideology globalisation political correctness identity politics embed within core movie need call indoctrination liberal authoritarianism border brainwash enjoy movie whilst watch afterwards felt cheat preached manipulate political world view late fashion trend place identity everything citizen nowhere
425,great flick pretty mature dark theme decent humour part half way gig turn quite literally poor script decision mean get across age transform potentially piece within two minute cringe disappoint
426,simply word verse fun thrill funny self referential trip history man film comic one best film see year one best animate film ever see conduct dangerous experiment street open wormhole alternate dimension bring radioactive spider bite young wormhole also drag various version across multiverse must team put end plan save multiverse animation style top notch beautiful blend computer animation element aspects rip directly page comic sound effect write screen occasionally split image panel unique dynamic experience naught though script story much fortunately film excels story find legitimate excuse drag various together actually give something funny self referential universe medium film highlight humour probably detective version web slinger whose whole world monochromatic voice laconic style darker moment though couple death bit much young child audience cameo though nothing specific cameo sad still pretty emotional first one since pass ignore least screen saw occasionally image seem somewhat watching film without glass minor detraction take away magnificent film really like see
