,0
0,say pun intend total marvel way stylish diverse style animation bold sophisticated storytelling visuals absolutely enchant colorful distinct always nail character pronounce look movement various kind villain feature story animator go give unique identity case whose universe take place boast dark shadowy vibe similar bubbly anime look bouncy eccentric cartoon character take full advantage absurd existence deliver film best laugh different identity film slow balance character serious nature one hard hit poignant line speak breakout comedic relief majority character share art style really enjoy blend model traditional movement appeal watch seamlessly match comic book theme also appreciate stylization certain villain character think portray accurately outside comic appear generic heavy set bald brute really enormous borderline non human tank look excellent film titanic body small head intimidate grimace powerful force legitimately scary antagonist another example portray brilliant outlandish female scientist psychotic passion villainy feel like need know character fun villainess watch really add suspense action sequence really love story thought rich charm thrill notice familiar element do death superhero fiction animation canon alike surprise villain reveals major character death obviously see come certainly wish character espeically uncle screentime one fact overshadow flaw write mature product look company past work soulless marketing pander audience incessant pop culture reference juvenile comedy welcome departure integrity put project write ground treat audience like people want see genuinely captivate flick first third film somewhat slow nonchalant almost like arthouse film never cool yet beat engage feel watch animate film big screen force nothing felt place nothing take immersion tone pace adult even something excessively goofy like screen like dark distress lighthearted amuse perfect balance never sacrifice integrity appeal niche audience credit scene quite hilarious let pas say without spoil lot film want see absolute marvel eye close everything hop game changer superhero filmmaking animation altogether colorful funny emotional frenetic film skillfully balance element never moment felt force never talk audience mature stylish take mythos perhaps best big screen picture date best animate visuals ever see single issue film dazzle move throughout apology apology goddamn accept bravo
1,movie worthy approval animation great story great message film live hype honestly surpass expectation reason think negative review never please everyone vast majority viewer believe find film great recommend see theater amazing animation style
2,hardly anything improve film visuals concepts soundtrack character pace humor animation best ever see film worry hype ruin always even group kid theater stop loudly talk ruin visually engage beautiful every scene mention incredibly unique art style honestly something animated movie look long time real issue think flash light really alienate epileptic audience even do beautiful artful way
3,review watch movie time since get digital ray safely say rare near perfect movie course opinion understand movie everyone break reason point list everything do make near perfect movie movie check every box visuals talk endlessly know great story great give new skill personality bring table script tight production execute laser precision voice act nothing short top notch easily second best thing movie right behind glorious visuals quickly grow ten time watch movie range good veteran actor injects much life phone short amount line whatsoever superb cast sound pretty similar boy never understand gotten wildly popular last several year movie finally understand get click moment pop movie around minute mark till end turn one voice act performance perhaps time succeed bring past prime life run gamut dramatic sincere intense funny single comedic line never fails make laugh loud gag pop head work something else chuckle repeat line always enjoy shine movie along support cast great thing movie also happen weakness visuals second none review title sum perfectly visually stunning movie ever see agree take little time usually minute eye adjust frame rate people apparently adjust imagine poor view experience bad really thing since use actual motion blur instead chose animate blur like artifact trick make seem like blur image double overlapped ghost effect confuse people think see image version without glass lastly sheer intensity rapid action sequence combine visual aesthetic push beyond break point dial ever slightly back direction team simply much people get far continuity plot hole thing nature think movie actually stand minute longer really many issue though maybe greedy visuals review dissect critique praise use number word choose end actually appreciate truly great art simply must experience medium create movie lovingly craft opinion fully realize viewer comic book movie make great original first saw comic book hero fly dark stylized graphic novel style live action ensemble men entire mcu comic book movie depend personal definition probably range good great live action vary degree special effect animation pick one feel like comic book probably pick overall look phase mcu film combination visuals capture tone spirit comic book story arc literally animate comic close probably animated movie right number animate movie really cartoon mean bad way simply cartoon version comic book quite literally animate comic book yet much time explosion comic book ink paper dizzy palette superbly rich color jaw drop display digital artistry meld live breathe character care story perfectly derive medium create yet one single moment ever feels force hollow soundtrack fuse endless exploration massive city staggeringly size scientific chamber gigantic forest neon electric digital dreamscapes action set piece whir click come life exactly mind child read paper movie breathtakingly good every aspect question sanity really good think yes yes old game like wow comic book come life like modern technology crank thousand time important part do right way right people right time feel like project greenlit hand people create comic book full creative control way unlimited budget resource much fun make great movie possibly first job work movie theater take full advantage able see free movie build decent surround sound system creature comfort grow library movie release original trilogy prequels ongoing trilogy today original many go many many big movie theater event experience safely say hand best moviegoing experience ever great
4,stun storyline cast soundtrack jerk cameo culture post credit scene decade make movie everyone love
5,ever sit film knew film never go forward example first one almost rather perfect film say stylished animation top notch comic book leap page see practically super hero film include animated one feel take comic book animation come perfect look story great pace wonderful able tell story origin without bore tear like do universe story quiet touch allows pretty interest without thrash like experience villain well do think see lot type animation future think announce presence authority like awhile see something unexpected cool
6,movie absolutely incredible animation storytelling character movie completely one kind easily best look animate movie year surprise really caught guard story able tell short amount time character distinct personality give separate characterization without make movie feel bloat knew end like movie movie completely exceed expectation enjoy superheros animation definitely watch theater
7,go talk review make separate one film laterm feel like deserves review great film verse remind love much original humane way use love kid get obssessed cartoon star well original movie trilogy one actually help get interested character marvel whole love character thing dissolve never get around build even constant remake wonderful performance never felt spark love felt charm dude go dead verse come whole world turn upside felt fire inside stomach long forgotten love one thought never experience expand continuously movie progress hit right place even dare say movie make understand reason spider man universally love everyday guy super power flaw pure heart relatable belongs people one movie fresh take exactly need fully grasp compel character without use super power version fat subtly depress tire yet charm lovable version character yet something see quite genuine humanity make charismatic character one thankful man cool totally different perhaps even good way everyday dude take leap faith give audience relates struggle courage character character teach anyone hero real true freak back home
8,see movie imax lsd experience life masterpiece
9,world superhero movie superhero comic similar seem surface film studio extend universe see many different title character shove one franchise make easy way squeeze extra buck lesser know property well course also something modern movie really tap yet story one offs chance storyteller create unique tale constrain implication large universe get playfully take fun convolute absurdity extend superhero universe hear possibly need another movie understand question take fact two also anime center though teen must help get back plane existence fight cop dad adores shady uncle hate simply smart kid room want something matter idea hey radioactive spider give power choice sort hot take movie look great humor pop surprise voice cast beyond perfect simply stylishly excite refreshingly unique take superhero genre sometimes enough
10,high expectation movie fail meet film great animation great humour emotion heart pretty much everything people want animate movie
11,hardly post review watch omg far opinion best movie ever story well write character awesome music actually awesome omg art style choose movie amaze like watch live comic book know sometimes superheros usually come superheros like actual people well actually show emotion development oml see geeked enough face tear joy creator somehow see post create something brilliant film make proud team
12,high hope afraid might good hype say damn movie underhyped love every second animation gorgeous character fun soundtrack flawless twist never see come even get start beautiful end fight scene film best animate film opinion best film definitely worth see
13,first sony good animate film great animate film reedemed book create definitive movie process
14,movie honestly much much well expect trailer combine justice thrill emotional hilarious really masterpiece eye favorite movie year
15,film storytelling fine really transferred art comic book story tell onto big screen level film match fresh animation afraid try something new definitely pay hope set example future film definitely raise bar film parent child favourite memorable
16,movie exceptional time watch worth literally watch atleast time gully enjoy every single frame
17,much enjoy movie animator storyartist love visuals honest say bit unfocused mess reason see movie first hopefully trend innovative creative animate movie look shoulder movie creature think deserves see visuals opportunity hopefully support trend say movie substance recommend people see movie note think movie may get treatment animate film visually impressive degree people gloss bad write everything look cool first half movie brilliant think everything first half work really well super effective felt like real kid real kid issue funny tragic flesh exist get later eye glue screen excited story genuinely surprised couple twist turn story certain moment happen movie take film go shoot go downhill real fast introduction spider verse character moment film shift gear entirely different film first half fit professional impress seem hate due lack experience take leap faith already begin movie even relevant story sudden new theme plot development completely derail first half film set degree felt like giant schism cut film second half film wave goodbye first half clear issue spider verse character share screen time film issue add much term character development interaction character serve help grow movie seem like another pair fists punch bad guy well example unfortunate issue completely irrelevant story important vital character character growth arc character witness best friend die someone witness die universe discus surprise excited see someone know dead alive happy see best friend two character punch bad guy like everyone else growth development two make matter bad even really work help develop character begin film build one main character second half develop begin experience character growth help develop character exist film different weird pace issue second half film suddenly get super powerful skilled nowhere odd people complain film complain go zero hero one scene single cut comedy scene tragic friend split scene loose character thread dad tell cop chase spider man never see many instance odd pace choice poor juxtaposition emotional story beat end positive note character enjoyable get moment think write father really good typical large life father honest strong stubborn dad flaw yet likable reasonable wish scene together dynamic bit flesh still like regardless additional scene deserve see want support innovative risky animation warn perfect film visually
18,amaze watch one best movie watch year one best animate movie ever see good great character simple compel interesting story really good time great loved insecurity weird thing say character feel relatable real feel struggle pressure face life parent release uncle work live spider people expectation real feel like kill universe start movie another version come immediately kinda ruin death sadness little liked couple scene maybe one day jump introduce new spider man introduce everything kick whole sequence break lab wonderfully entertaining entrance well spider people introduce later less useful aside look cool memorable moment talk animation yet freak amaze watch actually inspire work art project put detail sky scraper reflection whole climatic battle scene end beautifully do really really good satisfy look plot character animation yes good peace line deliver also really funny emotional well spectacular amaze see definitely recommend movie even fan watch please need sequel movie hope restore
19,superhero choice begin energetic capture attention animate film impressive visuals music create fantastic rhythm want watch story follow high school student name change school go abandon subway station uncle get bitten radioactive spider since day start stick everything touch meet team friend dimension attempt save world villain story original make impossible possible take ability far beyond action scene film also show real family atmosphere humor smart love non traditional character embrace diversity yes surely speak also fun new character film create film celebrates comic film visual art course celebrate make super hero relevant contemporary absolutely eye poppingly beautiful really pushes boundary genre color texture camera movement several different form animation one film feel actually read comic book comic book come life film touch tribute genius feel filmmaker take risk bring new idea iconic character adore year result must see family movie even appeal new generation also love film animate different never see film like one think unique sure stay credit see something special include another set credit end film set new era animate movie recommend age well adult give star include prediction possible winner film parent love kid watch kid enjoy many different way great power come great responsibility hero idea behind inclusion vast universe idea hero make right choice best help everyday life kid first review youth visit kidsfirst dot org
20,lucky son get see movie come impressed animation work alone impressive work ever see fluidity movement make comic book come life motion picture soundtrack great edgy hip place heck even work fire surprise excellent humor throughout old male knowledge confine classic line know multiverse see believe make sense film idea exist love part spoil story line imagine good bad many excellent fight scene battle several spider people like animated movie comic see movie fyi stay way credit funny finale
21,knew movie good first moment heard last year disappoint one bit meet expectation go beyond animation blend cgi stop animation pop comic book art realism vibrant color pop action sequence really enthrall captivate beautiful piece art movie writing choice leave nothing desired story traditional start superhero bunch twist throw movie actually follow past comic part minor change true comic book fan general anything criticize movie fan want see movie multiple different variation film special moment shine end credit scene rocket movie past already positive expectation get movie enjoy young old alike trust blow mind animate film one best superhero movie ever make deserves award kudos surely garner
22,movie see far animation stun love glitching theme tie animation style framerate music level
23,blow away movie absolutely beautiful animation stun soundtrack amaze dialogue storyline heart warm character memorable bring emotion rub audience humor right dare hilarious seem force like might see mcu film film last year might best one yet pay respect past film driven storyline adventure know character movie still come original cinematography animation gorgeous definitely oscar worthy say one best superhero origins movie ever make numerous amount easter egg lookout say movie underrate cause treat one thing underrated soundtrack funny thing soundtrack exact type music listen guess say touch realism end see see movie visual experience amaze touch serious funny witty brings emotion superhero movie see today best sick superhero movie complete different fresh start genre forget wait till end credit
24,scale movie deserve never see animate movie mix together entirely different art style well truly produce masterpiece talk comic book movie often think everything marvel produce past year spider verse reveal comic book movie movie special
25,many spiderman film cut sequel reboot alone stand much good spiderman film comparison spiderverse take sci adventure multiverse spiderman film wait animation alone stand best feature film new style comic book animation top notch must watch especially comic book lover effort take create rendering film worth film innundated much high quality design byzantine animation one take eye screen even afford miss scene though small run time animate film film offer good character development good storyline unpredictable time make shout wow especially spiderman geek adequate amount humor humor force good one liner make enjoy film begin spiderverse fun fresh take spiderman story fill excellent quality content brilliant animation lot humor excite action sequence
26,overload pop art sugar rush bugeyed reel amaze sheer level originality barrel speed light reach potential massaging brain till spine tingle experience
27,best spider man yet proud best animate movie year
28,doubt say make new cartoon movie consider last outing trailer display artwork pretty well still want get hope review make sound like best movie ever go movie theater watch brother short absolutely captivate teen protege grow hard nosed cop dad love mother uncle help explore ambition graffiti artist problem new school go life look get family wish change meet three people girl class name year old blonde guy name radioactive spider portal open dna attracts alternate mean drag neighborhood include middle age cynical pig depress grungy stop use portal rip hole space time continuum say touch bit hilarious heart break endear scene moment moment animation concept art hand hand give film high tech pop art appeal like nothing world ever see scale skill describe way movie move feel like best comic book ever write recommend enough watch movie right disappointed watch epilepsy anything like get pretty flashy
29,remember movie soundtrack gooood whole film
30,animation style trailblazing awesome brand new style movie making work well wonder movie make duo behind stellar entertain beautiful film yet hater understand want movie prove anybody wear mask love different people add awesome come lot emotion tissue one best story tell yet stellar voice act script animation style amazing animation style see yet perfect comic book movie
31,movie brilliant animation awesome story really cool compel humour genuinely funny come production company give movoes
32,first saw trailer planning fantastic unbelievably wrong best movie ever opinion movie understand mean people universe build story feature character never see movie capture personality straight comic movie also feature side character make room new love part story introduces many character feel crowd animation also beautiful fluid unique never bore also funny kid age enjoy interested comic animation comedy heartfelt super hero movie movie great flick age definitely see
33,start well know trailer go expect wait something beyond expectation become weirder definitely become lot weird see episode film story feel like meh dialogue definitely bad write main character completely clueless spider man writer need use skill voila know like back hand say visually stunning film ever see see film give rating stand point something blown visuals film great every film basic foot lie screenplay sloppy writing kind moment every new super hero film hero fall short confidence scene lot scene later confidence regain happens next scene load man sticky web stick hand easily disturbance conveniently easy villain break sticky web kid way talk make irritatingly meme funny character complete waste definitely much good film visually stunning animation excellent animation artists writer need write good
34,really enjoy animation art music movie real comic feel far masterpiece everyone talk storyline predictable kinda childish new excite around many unnecessary character story make lot sense many recent film overhyped
35,long since first trailer year ago dissappointed
