,0
0,"Watched ""Greenland"". Doesn't add anything new to the catastrophic events genre, yet it was the perfect movie to watch amid the coronavirus pandemic. Sitting in a sparsely populated movie theater, wearing my facemask, I was thinking ""it could be so much worse!"""
1,"We went tonight, my girlfriend and I, as two people who likes this kind of movies and we loved it.English is not my native language so I will keep it short : this is a well made apocalypse movie that evolved from those made in the 90s and 00s. We can feel a contemporary vibe here and it is refreshing.What I liked : No downtime, lots of emotions and twists. Intense.What I didn't like : bad CGI at some points"
2,"Lot of end of the world movies follow the same storyline but this one had that little extra. Felt like the way they handled this was more realistic, so in a way 'scarier'. I usually like seeing a lot of the destruction and action itself but I definitely recommend watching it"
3,"Very hard to watch. The feeling that you have already seen it, but oh no, it is a new movie.
Family problems - check . What does it have to do with disaster. Why?
Annoying kid - check. World War Z
Annoying kid with health issue - check WWZ
Drugstore scene - check. WWZ
Shooting in drugstore - check. WWZ
And so on...
Oh, almost forgot.
View on earth from space at the end - check
And special- Paris, Eifels Tower in ruins - check.
Oh no."
4,"You know the scenes where you go ""oh come on, why in hell would anyone do that ?!"". Well, this movie is packed with characters having poor judgment and taking the most idiotic decisions possible (and being hysterical), and it's all done for the sole purpose of generating obstacles and create tension.
And it works ! It does create a lot tension, but it's all aimed towards the scenarists, for blatantly taking you for an imbecile.
You'll very quickly find yourself wishing for the death of some of the main characters, which would make things so much better, but then the movie would last only 15/20 minutes."
5,The planet is about to be destroyed by an asteroid and we only have x hours before it strikes. I expected them to call Bruce Willis again to do some off-world digging but he must be under house arrest.We're following Gerard Butler and his family as they try to get to a safe place in Greenland while the world around them turns into chaos. Other people seem to put more efforts into looting shops for toilet paper or holding end-of-the-world parties making their route a bit like the Road.Gerard trying to save his family and driving his ridiculously oversized car through meteoroids: it's all forget-about-corona-for-two-hours mindless fun!
6,"This is just an overall mess of a movie and I love disaster films.It seems like the disaster theme takes a back seat to the family drama in this film. There are loads of scenes with the parents and all of their scenes trying to pull he art strings or get the tension up. The comets could be easily replaced with a California wild fire and this would be the same film.A lame film with a few truly awfully bad scenes with overall terrible plot development. The lead is a guy who constructs buildings, so of course he's going to be a VIP in the new world after the comet hits.Extremely poor writing. The lead character drives onto a runway and prevents a plane from taking off. The pilot and he argue says it's at full capacity. Hero Gerald says take his wife and son and is refused. So Gerald replies that no one will be leaving, basically blackmailing the pilot here. Pilot reluctantly agrees to take the kid then and the mother erupts demanding he take all 3 of them. Pilot sighs and asks the hero Gerald how much do you weight? Hero lies about his weight and is called out. Lol what?! The pilot then accepts them all and this entitled family says sorry to the other passengers as they board the plane. GTFO."
7,"What a mess, the child just keeps sitting and waiting... for christmas?"
8,Nevermind the bad reviews! This movie is awesome. I swear people are so hard to please these days. This film definitely had my heart racing. It got extremely intense there several times. This has to be one of my favorite disaster flicks. Deep Impact eat your heart out. I highly recommend giving this movie a watch. 8 stars 👍👍
9,"Let's start with the good: the natural disaster, the way the media and the people seem to react to it, the somewhat limited amount of cgi to leave a lot to the imagination, all make for a nice background to the main story, which do drag you into the atmosphere.However, the main plot is such a poor written mess, filled with age old recipes, a which seem to turn the movie into a series of fetch quests, which just are tedious to look at, and make no sense at all.A waste of potential by trying to add some drama, which wouldn't even be needed as the event is dramatic enough as it is."
10,"This movie is a classic end-of-the-world hero flick that ticks all the right boxes. Of course, Gerard Butler is awesome and although there are no surprises when it comes to the main plot, enough unpredictable events happen to keep you entertained on the edge of your seat."
11,Barbecue. Small comet hits. Driving. Airport. Loosing people. Looking for people. Driving. Fighting. Looking for people. Driving. Finding people. Driving. Fragments hits. Even more driving. Flying. Army base. Big comet hits. End.
12,At times i found it boring and just thought to my self when is this going to end. Didnt impress me at all. Effects were good tho and characters were not that bad either. At the beggining of the movie i thought this had potential of being a great film. I was clearly wrong.
13,"I love disaster movies but still had rather low expectations for this one. I hoped for a pleasant surprise but unfortunately it was an unpleasant one. Everything was cliche and not in the way that still can make a movie exciting. Everything was expected, even when the director tried to surprise the viewer. That makes for a movie that really shouldn't even be screening on the cinema, but be released straight to a streaming service. I was truly disappointed as I like Gerard Butler movies normally, but this script just didn't cut it."
14,"Horrible movie, characters are so annoying, the wife and the kid is both annoying and stupid, hope they died in the film"
15,"The following sentence wraps up the entire movie: There is a giant comet headed your way, when an automated alert suddenly appears, you continue to shop as if nothing is wrong, then when it is confirmed, you let your family waste hours packing clothes, lots of them, yet you forget to take anything that will help you survive a perpetual cold and dark world. Genius!!! Who writes this things?"
16,"Greenland is a raw, tension-filmes disaster film that showcases both the noble and dark sides of human nature, when everyone knows the end of the world is near.With spectacular visuals and an emotional narrative that is framed by the harrowing experiences of one family, this movie should definitely be enjoyed on the Big screen"
17,"Don't waste your time with this boring movie it is very very cliché, and all the action scene can be seen in the trailer."
18,"Whenever I see a disaster movie, I want to know the science and the cause behind it and how the world will or will not change. What I don't want to see is a guy trying to save his wife and child for 2 hours, the egoistic pursuit of a microorganism (family) to save their own little asses, ignoring friends, other relatives, neighbors, other children, stepping on everyone and everything to get themselves saved. It irritates me endlessly whenever I see a movie, where the actor is repeatedly screaming ""MY WIFE AND KID, PLEASE PLEASE PLEASE"" I don't want to see a disaster movie being romanticized, and idealized into the happily ever ending relationship between man and woman, and the idealized version of a sweet little happy family. Why does Hollywood need to center all their movies around these biases? This movie is way too cliched. Man and woman divorced, husband cheated, woman is angry, man is trying to do his best, has major regrets. A child being ill, needs constant medication. What exactly was this movie about? According to the short description: A family struggles for survival in the face of a cataclysmic natural disaster. No they are not struggling for survival, they are trying to get to a save place, and once they finally get there bumm, it's all over.Dear Hollywood,Why not write an original script for once without these clichés? Please Hollywood can you do that? Can you give as a real disaster movie?"
19,"SPOILERS........Compared to whoever wrote this nonsense I'm a towering genius.......They copy the Supermarket chemist scene directly from World War Z. Same reason for being there, kid needs medication. This film was so poor I couldn't quite believe it could ever get green lit. Totally unrealistic scenes. An apocalyptic scenario outside and yet they open a huge cargo plane ramp door to let one man off and it results in the whole plane being destroyed. Pathetic. Can't comment on it after an hour as I stopped watching. My brain hurt"
20,"Heres whst I found out by googling for two mins.. 9 mile wide (14km) is around the size that killed the dinosaurs possibly a bit larger, so that would mean massive tsunamis, extreme volcanic activity around the impact zone and accross the globe, the ozone layer would be destroyed, the sun would be completely blocked out, most of the earths crust would be damaged and thrown into the earths atmosphere which it would then rain down on the earth as fire for possibly decades, the earth would be like living in an oven, and almost everything on the planet would burn or die due to lack off food or the initial devestation. No way would you be able to go outside hours, days, weeks or even months after this happened and see the sun shining and a few birds flying around. I like disaster movies but come on, make some effort to research the effects of a giant 9 mile wide comet fragment colliding with earth not to mention the numerous other fragments."
21,"In the last few years Gerard Butler, sadly, has become a synonym for a movie flop. There has rarely been a movie in the last five years with Butler in it, that was not either bad or completely awful.
The last of which, to name few were, the last part of the Fallen Trilogy, ""Angel has Fallen"", the less than exciting WWII thriller ""Hunter Killer"" and one of the worst movies to be made in the last few years, ""Geostorm"".
Knowing all this I went into ""Greenland"" with a certain level of skepticism. Luckily, Butler seems to have gotten a lot smarter in his choices because ""Greenland"" is a quite entertaining motion picture.
While I am not a fan of disaster movies, mostly because they always follow the same boring concept namely, a family or gets separated for some stupid reason and tries to find each other again over the next two hours while their journey is complicated by various obstacles of human or nature kind.
""Greenland"" is no doubt a disaster movie but fortunately it is a little more exciting and creative than most of its kind over the last few years have been.
The movie begins with John Garrity (Butler) visiting his wife Allison (Morena Baccarin) and their son Nathan. John and Allison are separated but they seem to get along fine. Nathan is fascinated by the stars and the asteroid that is shooting towards earth. Soon the Garritys invite some friends over, when a presidential alert appears on their TV and phone telling them to pack some bags and drive to a close by airfield.
When they get there they are ushered in and just before they are about to board the plane the separation plot kicks in. Admittedly it's not as stupid as usual.
Now this might sound like your typical disaster movie but trust me it's not quite.
""Greenland"" is smart in how it handles it's characters and the plot is not always straight forward.
The movie tries less to create tension with the looming disaster but rather does so through the human element and the different characters the family members meet on their way.
We only get to experience what the family members do. There are no five or six main characters that each have their own agenda.
Even when they're separated, the Garritys stay the focus of the movie. They meet good and bad people along their journey and what I liked in particular was the honesty with which the director handles these characters. Many people are selfish and greedy and even in situations like this one, where working together is most important, people still only think of themselves.
The movie works also because Butler and Baccarin have a very good chemistry. They are the couple that has had hard times but still loves each other and would do anything to stay a family.
Butler is really good here. As good as he hasn't been in years. It's not a very difficult role or something that would be beyond his skillset but it is more serious and dramatic than his usual tough guy parts. Quite a few times I was happy to see that he can do more than growl and butcher an American accent. Granted, he still butchers it but at least his character is so charming and likable that we can overlook it.
The love and tenderness he shows in his face a few times is one I have never seen of him and, in a particularly important scene, we see the self loathing and disgust in his face.
I believe he always had it in him and I am glad he finally chose a movie that allowed him to bring out his full talent.
Baccarin is good too, especially on her own. She hasn't had too many major roles yet in movies but I hope she will soon. She really is a capable actress.
""Greenland"" is certainly worth watching and if you have the chance and the current situation allows it, go see it next month when it's released. It makes for a welcome change of pace."
22,"Generic 2020s Cinema from start to finish, 1 Hour 59m later. Title 'Greenland' was a one-word spoiler, symptomatic of this Big Hollywood's biggest failing - a patent lack of imagination. The flic was at least entertaining, released as it was to vie for top Christmas spot, but it was just too darned predictable. With these vast sums of money to waste to deliver sophistication, why on Earth couldn't some of those dollars've been used to find a Writer? The movie 2012 was a terrifying but original concept. But sorry, that one's been taken."
23,"A man is warned to seek shelter as a comet and it's smaller gravity-locked companions decide that planet earth would be a good way to break its fall. Gerard Butler is that man.Thus begin the trials of Gerard and his wife and son.
Not in attempting to stop the comet or to survive the impact or it's aftermath. Come on, that's been done. No, you are instead a witness to their attempts to find shelter, for 2 hours!Why Greenland?
Could it be because the largest impact crater was recently discovered there, under an icesheet. The biggie that is now believed to have triggered the last ice age? Nope. Something to do with the previous location of the magnetic North pole perhaps? Not even close although both would have been worthwhile.Greenland is the man's destination for safety when an extinction level event occurs. That's it.
If the safe haven was in Wisconsin or Jumanji, that's what the movie would have been titled.So what goes on for 2 hours?
World leaders uniting to save the species perhaps? Nyet! Missiles? Railguns? Armageddon-style suicide missions and secret projects for evacuation to Mars? NOPE!
How about the impact itself, do we get to see that? Sorry.
Well, everything except all the above.You get drama, with dad getting off the evacuation flight for his son's insulin that was left in the car. Who knew?
There's action, like rioting and looting.
It has traffic snarls as people try to drive somewhere, anywhere to presumably get off the film.And it has clichés, notably, one at the start that is destined to be the new must-have disaster movie clichè. Being informed that you must evacuate immediately and to only bring your wife and diabetic son, while your phone is set on speaker at a neighbourhood get-together.
Talk about a new record for losing friends. Anyhow, new clichè and you saw it first in Greenland!It goes downhill from there.
This disaster movie sets the bar so low that Deep Impact would be Oscar-winning material.
To be fair, Gerard is an actor in demand and he is prolific, so one can forgive him for this stinker.
He was due and I vote comet.Is it too early for Razzie nominations?
Skip that. Let's announce 2020's winner now, please?"
24,"I must admit that I was certainly expecting more from this 2020 disaster movie than what writer Chris Sparling and director Ric Roman Waugh actually managed to deliver with ""Greenland"".Well now, don't get me wrong, because I am not saying that this is a bad movie, nor am I saying it is a movie that isn't entertaining or enjoyable. It certainly was. However, the movie was just way too generic, mundane and predictable. And for a disaster movie, then I am afraid to say that the movie was frightfully devoid of massive scale destruction.Visually then ""Greenland"" was good, however, I was hoping to get to see a lot more destruction as the meteor and the fragments made contact with Earth. There were a few destruction scenes, and they most definitely were good to look at, no doubt about it. But for a disaster movie, then there just wasn't nowhere near enough of destruction and pure CGI mayhem throughout the course of this movie. It should be said, though, that the CGI and special effects that were in the movie definitely were convincing and looked very real and good on the screen. So thumbs up to the CGI and special effects crew.""Greenland"" felt more like a family drama laced with some end-of-the-world disaster theme. At no point throughout the course of the movie did I really feel like the world was about to end. Sure, it was mentioned in the movie and the premise was staged for it, but director Ric Roman Waugh just didn't come through. I have to admit that I didn't really sit down to watch ""Greenland"" because of the family drama going on between John Garrity (played by Gerard Butler) and Allison Garrity (played by Morena Baccarin) amidst an end-of-the-world scenario. No, I was here for the end of the world and the spectacular effects showcasing the destruction. But sadly, ""Greenland"" wasn't really all that great in terms of being a disaster movie.The movie does have a good ensemble of actors and actresses, and I will say that both Gerard Butler and Morena Baccarin carried the movie quite well, and the child actor, Roger Dale Floyd, definitely also added something good with his performance. It was nice to see Scott Glenn in the movie, just a shame that he wasn't given more screen time.While ""Greenland"" is watchable and entertaining for what it turned out to be, I just felt cheated out of a grand disaster movie experience; one that I thought would have put the 2009 disaster movie ""2012"" to shame and knocked it off of its seat in the throne of disaster movies.My rating of ""Greenland"", once the ash has settled, stands on a very mediocre five out of ten stars. The movie was just way too generic and following a very strict run-of-the-mill-how-to-make-a-disaster-movie blueprint."
25,"The idea that the USA could build a enormous 'secret' bunker in a foreign country to save only Americans in the event of a global disaster is lip-bitingly difficult to get past. If you can though, enjoy the rest of this "" I love you Daddy, I love you Son"", comedy-drama, which beats Armageddon hands-down for tongue-in-cheek end of the world humanity scenarios."
26,"A decent end of the world movie that deals with what would happen on the ground.
Follows one family, and their interactions with other desperate people.
Reasonable acting, and nice special effects.Worth watching."
27,"Great effects and Tired story,
but don't like to be constantly bombarded (no pun intended) with Woke messages.
These scenarios of White bad non White good are just as dangerous as the other way round, just make it real and stop preaching please."
28,"This movie had everything to be good and how come it ended up this?
I just couldn't stop wining since after the first half hour of it because it was just terrible, almost painful to watch. I actually got headache watching it.
The story is not based on the disaster about to happen, is basically just drama, bad decisions and bad everything. I don't think I can write all bad about it otherwise I would write a testimony here.
How a mom let her soon be kidnapped like she did? She couldn't untie the boy from the sit belt, grabbed his hand and didn't let those people take him? And if he depends of insulin to live how come she don't have it on her personal purse, her jacket, pockets???
The whole drama started because of the God damn insulin!!!
Many scenes I felt like was a cheap copy of 2012 and the rest is all about drama not evolving the catastrophe about to happen, don't waste your time!
I gave it a 2 just because the history has potential to actually be something good, don't get it how it ended up being so bad."
29,"Wanted to like this.Found it impossible.It's a 'dumb' film. One of those films where the characters make dumb decisions at every turn. So dumb that as the film goes on, you hope something bad happens to them.These types of films are insulting to the mind.
It's not even in the mind-numbing-veg-out category. It's simply bad.Bad, bad, bad, bad.Acting is whatever, filming is whatever, storyline is bad.We should be able to sue film makers when things are this bad, for recompense for the time of our lives wasted watching it. In this case 2 hours.If you like dumb films, with dumb decisions then this is for you.Sure was not for me.1/10"
30,"I liked this movie. Yes like most disaster movies it has the standard recipe of a divorced/nearly divorced family, I still don't get why. The movie shows some special effects of impacts but this is no 2012, this movie is mostly about the breakdown of society when all of the sudden everyday people are confronted with despair. I find it amusing how some comments here are about characters in the movie are portrayed negative and selfish only caring about their own family. Newsflash for you ... that's what people tend to do in a situation of life and death. You ever look at reports in the news of people clawing each others eyes out at food distribution in war zones? They know very well more food is coming. Now imagine the whole world being faced with imminent death ... it will not be pretty. Frankly I would be like that group partying till the music stops.Spoilers:
Now as regarding the ending. They arrived at the base in Greenland with the diabetic kid. How did this kid survive 9 months when it was clear in the beginning they were avoiding people requiring longterm medicines? After all when they ran in the Cold War shelter it clearly looked unused since decades. Everyone only knew about the comet since a few days so it's not like they could prepare the place.Since when did places like New Delphi and Sao Paulo have nuclear blast grade old Cold War shelters?Also 9 months!?! I know they need some positive fluff at the end of American movies or they won't do well in the box office over there. But anyone paying attention in science class would remember that after the Yucatan impact it was suspected the skies did not properly clear for several years.So I am still giving it an 8 because the acting was good and so was the overall story. Science and disaster movies have never been the best of friends, it remains a fiction story after all."
31,"Its way too long with not much at all happening, its all drama no thriller. everyone is stupid and do only stupid shizz :) in real life they would be the first to die."
32,"This Movie is an absulute piece of trash i know usually disaster movies are not oscar winning but this one was really bad feels rushed same dumb trying to save my family plot like always, movies like this are always about family drama but i think The Day After Tomorrow,2012,Geostorm they were enjoyable and had much better disaster scenes"
33,"Too cliché, nothing new. A one in a dozen movie. Nothing I will remember this movie for. Last 30 minutes were mediocre at best."
34,"I will suggest people to watch ""Deep Impact"" again instead of watching this total waste of time piece. No one wants to watch 3 people trying to survive running here and there.
This movie should be removed from Sci-fi category and put in family cliche drama. There are tons of better sci-fi movies. How can someone rewrite script on well known subject, as this useless garbage."
