,0
254,This movie had decent acting. What I fail to understand is why was it important for the father to not give up his band. I mean they were refused in already so what was the issue to just give the people.
255,"I'm always looking for movies that hit you the right way. Growing up, I feel privileged having watched film change from everything being about the actors and superb dialogue (60s movie and before).
...all of this before the amazing special effects that we have today. I enjoyed this movie on many levels. You can care about the characters and can put yourselves in their shoes to emphasize with their pain and stress of each situation they encounter. Yea, could the decisions have been better? Maybe, but can you really tell yourself that you would do ALL the right things. HmmmmThe ""magic"" of Hollywood is also in true fashion with superb effects and sound. This is what I call great entertainment. If you are not able watch this film and ask yourself, 'what would you do' every step of the way, then you just didn't let it grab ahold of you. Go see it again!"
256,"Can be series, can't be movie tgis story.. 4 for Morena normaly 1"
257,"Its not movie about catastrophe , its movie about social behavior. 99% of the movie is focucing on wthat we already know - that peple will always act like morons, idiots and aggresive hordes of sheeps when comes to survival.. 1% of the movie are meteoric scenes and destruction.
So the movie show nothing new in terms of human kind behavior . everything bad about humanity is in this movie.. One hour, thirty you see separated family finding the way back to be together..
So boring , so predictable and so out of the line.."
258,"Just giving it 10/10 cause why the hell not ?
It have good script, proper storyline, best acting performances from great cast, great action stuff, just like when I'm watching all those action films back in the day.. (p/s I'm a teenagers, not that old)
Gerald Butler always giving his best, he's one of my favorite actor.
Overall worth a watch. People who gives bad rating maybe expect an Oscar worthy thing, but this is just a film which you sit back and enjoy.."
259,"I don't understand some of the reviews, I watched this tonight and both me and my partner thought it was brilliant. Very well acted, believable characters and good plot. It had great special effects and well thought out writing. We were on the edge of our seat throughout most of the film. I can't really fault it in any way - even when I try to nit pick. We've all watched a good few of the apocalypse type films by now but I don't think there has been any of this type so it was something different. Would recommend to friends and family. Well worth a watch."
260,"They could have done more with him, he's an charismatic actor, he could have saved this flop. The messages this movie tries to send are wrong and insults one's intelligence. Gerard was tired, his lines were the same, some old over used quotes, made this movie lose credibility, some romance misplaced, some funny memories utterly out of place. Portraying some dysfunctional family that comes together in difficult times, didn't sell it. But they made it, while the normal families didn't. Rebecca is still gorgeous but not enough to save this flop. At some point I wished that they all failed, but even that expectation wasn't matched."
261,I just watched a 2-hour film about crying...sprinkled with a few scenes about asteroids! #SoMuchCrying
262,"One good thing is where was that first target choice;) and realistic general public panic with a lot of shooting at each other. otherwise one brain cell generic script and 2d characters. CGI and art work also poor for 2020.
PS if you wonder in case of deadly comet, there will be no selection of program. big shelters that can support large population at least 2 years just don't exist. the small ones that do will house only military personal. PPS plains will not fly with skys filled with ash. and earthquakes can destroy even bunkers"
263,"It was really hard to watch, half the time I was fast forwarding, the beginning was promising but.. not even a good story there, just endless car rides and long goodbyes and that's about it.
Find some better use for 2 hrs!"
264,"Good start and then it got mediocre very fast and to the end. Also their are a lot of just stupid over emotional Karen moments that make you cringe, while the world is going to hell and everyone is in distress one woman thinks that her needs are the most important issues for all involved and see get's somehow always her way. That's just annoying and stupid. Also it is catering the classical cliches of womn. Very disappointing. Also, I would rather face such a crisis in a more orderly country (like Japan) than the US with all that chaos and immediate collapse of sociaty, order and moral at the get go depicted in every movie of this type."
265,If it wasn't for the terrible script writing! Was looking forward to this but found it really boring and korny.
266,"For nearly a decade, Gerard Butler has been involved in many underwhelming actioners. Now, I wouldn't put Greenland in the league of a Geostorm or a London Has Fallen. Because it's definitely not THAT bad. It features a neat performance from the oh-so-lovely Morena Baccarin and some level of suspense in its mid portions. The plot is once again about a family trying to beat the apocalyptic odds (this time due to a large comet named Clarke: what the hell, NASA!) and get to a ""safe place"". The characterization is quite generic; there's nothing that makes John Garrity (Butler) a memorable person other than the fact that he's a structural engineer (and so, the world needs him post-apocalypse).The bigger question in a film like Greenland should be how well the action and the disintegration of the Earth are crafted. Well, the CGI ranges from crappy to decent - Greenland's relatively low budget (for a disaster film) becomes evident at times. The better portions are when the family gets separated and as viewers, we start pondering over the probabilities of their eventual reunion. Ric Roman Waugh's filmography is mixed: a watchable actioner like Snitch, a couple of gems in Felon and Shotcaller, and a half-arsed Angel Has Fallen. What becomes obvious here is that the storytelling in his films is (a lot) better when he writes his own scripts.Chris Sparling's screenplay loses all of its suspense in the third and final act and ends up telling a story that we've heard a zillion times before. If you've got 2 hours to kill, Greenland could work but keep that bar of expectations pretty low."
267,Of course it has all the typical tropes of a world ending movie. The most annoying thing however is butlers change of accents lol
268,"If you're looking for a tense, edge of your seat film... This ticks the boxes 👍🏻"
269,"...a disaster!I was a teen at the height of the disaster movie trend. ""The Towering Inferno"", ""Poseidon Adventure, all the ""Airport"" films, etc. While each had its human drama they also had plenty of disaster! Even moving a few decades up with ""Deep Impact"" and ""Armageddon"" we got a pay off of great special effects, cities being destroyed, etc.This film gave us none of that but the human drama on steroids. Sure some explosions, but they were quick, on TV, or less than spectacular.The very end was absurd. High School students know that after such a cataclysmic event the earth would take hundreds of years for earth to recover. Be it a comet, asteroid, or our own nuclear stupidity, the atmosphere for ages afterward would be poison, the sun blocked out, and well... just a whole lot of dead stuff. Showing the people in the shelter emerging to sunshine and clean air NINE MONTHS after impact was just plain old movie stupidity.When the shelter doors opened, if they still functioned, only the descendants of the people saved would emerge.About the shelter... pretty much it is known that new better designed and better equipped shelters exist these days. Some I have read about are like mini-cities! They have recycle water\air\waste facilities, botanic gardens to grow food, etc. They are designed to outlast the effects of nuclear or celestial disaster after effects. An old cold war bunker in Greenland would not be.On the plus side the actors were all good in their roles."
270,"This movie is an example of no frills storytelling, there are no super space ships ( Deep Impact/Armageddon) or magic Earth subway trains (The Core) to save the day, this is a story of how humans confront catastrophic natural disasters in their own individual ways, and the continuing theme is to never give up. As I read some of the negative reviews proclaiming Greenland unbelievable, when I saw the movie ""Contagion"" I saw many reviews saying that was unbelievable as well, yet when the Covid 19 pandemic happened , suddenly people changed their minds because they saw it with their own eyes. Greenland is successful storytelling of the strength of will."
271,"""Greenland"" is a soft disaster film, the characters are unrealistic, the cinematography is conventional, the special effects are fine, the script could be better. Not a masterpiece, just a watchable flick similar to ""2012"" (2009). There is a lot of better disaster films!"
272,"I for one appreciate this take on a disaster film, focusing on a family and their quite reasonable struggles to stay alive. It's down to earth and enjoyable. At times, at least.Some cast members are quite awful though, including two thirds of the main cast. Only Butler pull through - although, to be fair, it's not his best effort either.Sadly, part of the writing is pretty lackluster too. Hints are much to obvious and characters make stupid choices for no other reason than to set up supposedly tense scenes.Still, worth a watch if found in the three for ten department."
273,"Got to admit, I was expecting it to be a disaster, but this was a lot better than some annihilation movies. The acting was okay, the script, fairly predictable, the effects weren't that bad. This movie is not nearly as good as 'Deep Impact', but was a good way to spend 2 hours."
274,"Engrossing and nail-bitting; ""Greenland"" is surprisingly entertaining and makes a huge impact (pun intended).In this disaster film, a family fights for survival as a planet-killing comet races to Earth.If you think this is just another disaster flick, think again. ""Greenland"" keeps the tension rising scene after scene and features a really good performance from Gerard Butler. Some of the scenes even feel like you're watching a zombie film and makes you want to yell at your screen. Of course the film has some blockbuster clichés but all around it's a great time and I promise you won't be disappointed.Follow @snobmedia for more reviews!"
275,"Check it out, it's suspenseful & holds one's attention throughout."
276,"John Garrity (Gerard Butler) is a structural engineer in Atlanta, Georgia. His marriage with Allison (Morena Baccarin) is troubled and their son Nathan is diabetic. A comet is coming. John gets a Presidential evacuation order as a part of a select group.There is a section in the middle where the movie finds its mojo and becomes quite compelling. The problem lies in the beginning and in the last section. In the beginning, the people are too sanguine about the comet. Even with the smallest of chances, the news would play up the doomsday scenario. Apparently, there is a government secret program if not a worldwide conspiracy to keep the impending devastation a secret. There is no way that such a big danger be kept secret for long. John could have told his friends to do certain things. I would have told them to gather all the food and essentials, then find the closest deep mine or cave system. It's not all bad but there are problems with the calibrations. These people are doing too many dumb stuff. The middle is the best when the family gets separate. I think they stumbled onto a compelling theme of the story. When things start going badly, they get more worried about being separated. That's the emotional heart which leads me to conclude that the climax should be them reuniting. The problem isn't the end of the world. The problem is losing each other. So the whole last section becomes anti-climatic despite having some pretty good thrilling meteor shower action. It's not like it makes any sense anyways. The last section is a lot of non-sense."
277,"In my opinion..There weren't a lot of action scenes. But every scene gives chills and curiosity to watch. Especially like the scenes at that airport.,,,,,,,,,,,,,Few felt the feeling of 2012 or world war z type of survival vibes, that Suddenly a disaster is going to happen in this world. That panic..preparation moments. Even tho It's not even 50% it come close with those movies tht i mentioned. but similarity of somewhere. And showing the love and importance of the family in between. Definitely worth watch! :) as most of them said.. one of good film in 2020. btw Sry for ma bad eng :("
278,"""Greenland"" is based on a disaster cliche so old its offspring put it in a retirement home.So what's on offer? Formulaic working Joe who's doing better than average Joe's has a nice formulaic wife and family. Of course he loves them so much he has a Hallmark style photo is on his phone. He lives a formulaic life in the burbs but has had a few predictable personal problems with his better half. That's all disrupted by a nasty, inconvenient, formulaic extinction level disaster event.Yet, in spite of the fact he's presented as a working stiff, he and his family are ""special"". Their special bacon is, in fact, so postcard perfect, its to be plucked from the terrified ""expendable"" mob, that is humanity. If only they can get their entitled selves to Greenland.Thus starts a well choreographed, competently directed, special effects laden disaster romp that looks like every other disaster romp we have seen. It might not be boring if you are new to disaster flicks. If however, you have been around a few decades, its tired fare, that offers nothing terribly new or fresh. It also pushes the notion that we are all equal, whilst showing, quite clearly, we are not.5/10 from me."
279,"Chronicles of the problems people get into just for can't help talking so much,"
280,"The acting was good, too good at some points. Some minor plots were predictable but done well and realistic.
It's a bit frustrating watching one man bully so much to survive though. It's no wonder the US is where they are in this current time of covid.
The visuals are stunning! If you have a lazy afternoon to watch an end of the world movie with little commitment, it's ok."
281,This movie was extremely entertaining with good acting.I saw Let Him Go yesterday and it has a 7.1 on IMDB! This movie blows that Let Him Go out of the water. There is no comparison.
282,"I didn't think women in Scotland wore kilts - that it was only a male outfit. Oh, well, perhaps it's a non-consequential goof.All the jerky camera movement gets annoying after a while."
283,15 hours for the end of the world and people still working on the roads.... wondering if they are getting paid double for that....So many bad decisions everything that just do not make sense. I am giving a 7 because I love the genre and if you can look past the incoherence you can still enjoy it
284,"Movie at start feel intense. You can feel something is coming. It was so intense. Soon, this movie will turn into family struggle to stay together, to stay alive. You will see some beautiful landscapes those will make you feel how beautiful our planet is and now its on verge of destruction. Ending scene is not so satisfying if you take realty in account but its also not like big disappointment. Overall this movie is something you shouldn't miss."
285,"""Greenland"" surprised me positively.
The story and events unfolding isn't surprising though, fairly cliché.
However, I feel the acting and dialogue is overall good from all involved, Gerard and Morena both decent and not any stubborn, hysterical kids as is otherwise the norm.Isn't as ridiculous as the 2009 movie ""2012"" where whole continental plates flip upside down. ""Greenland"" is much more believeable and all in all, seemed alot more realistic and plausible.There are a few points during the movie that scientifically don't seem right, and a big part is the ending, which doesn't really hold up to science either. However still quite nice. Not so much focus on CGI effects, more on the people and that worked well.
As mentioned the story is a bit of the same with all these disaster-type movies. The main cast constantly runs into obstacles along the way, and some would be expected and also a few times they make poor dicisions, but not nearly as many of one could have feared.Despite the very ending, that I considered the lowpoint of the movie, I will still give it a 7."
286,"Even the world in disaster this movie very good in showing humanity is still exist among us even we have different races,colour or language.. its balance some people turn good into bad.. we have some strict soldier,nice soldier .."
287,"Greenland has just hit cinemas here with everyman action hero Gerard Butler leading the charge.I went into this thinking here we go again, Gerard Butler saves the world, or the President, or the G7. But this is in fact light-years away from being a Greenland Has Fallen, and we're all the better for it.Sure, Greenland is a disaster movie - there's a planet-killing comet called Clark barrelling towards Earth - but this is a much smaller story of Butler's character John, who must do everything he can to try and save his estranged wife and son.The story explores the notion of the human survival instinct more than the end of the world as we know it and it makes for very immersive and often stressful viewing.Deadpool's Morena Baccarin is Hope, and as a woman and mother pushed to the very brink as they face the worst of human nature, she's very compelling. Opposite Butler, they make for an authentically troubled couple who will do anything they need to save their son and themselves.I'm not gonna lie, when I saw the trailer for Greenland I was certain I was in for a pretty much done-by-numbers disaster movie and was so very pleasantly surprised with what I got instead, with a narrative which unfolded in a plausible, convincing way augmented by a kinetic and concise delivery.We are not talking awards-worthy or life-changing, but Greenland really is a great big screen COVID distraction and I thoroughly enjoyed it."
288,"Greenland makes us feel like it is 1998 all over again, when the twin asteroid flicks Armageddon and Deep Impact ruled the box office and crash-landed into pop culture consciousness.But in these unnerving and uncertain times, suddenly the end of the world does not seem so far-fetched after all.After 2017's Geostorm, Gerard Butler takes on yet another global catastrophe alongside his Angel Has Fallen director Ric Roman Waugh in back-to-back projects.But this time, he is a regular guy rather than a superhuman Secret Service agent, and more preoccupied with saving his family than the US president.Greenland opens with an estranged couple, John and Allison Garrity (Butler and Morena Baccarin), whose marriage has imploded and are struggling to co-parent their young son (Roger Dale Floyd).But standard news reports of an impending comet passing Earth quickly escalate into an extinction-level event when the fragments start laying waste to continents and society falls apart.This is one of those conventional race-against-the-clock thrillers jam-packed with classic genre tropes and cliches.Our protagonists embark on perilous and increasingly desperate attempts to seek sanctuary in rumoured bunkers located in Greenland.The Garritys are soon split up amid the pandemonium and run into seemingly impossible hurdles.Those who want to get their money's worth in spectacle should be appeased by the terrifying destruction of a cargo plane transporting select groups of VIPs to safety when the premises are overrun by the have-nots in true zombie fashion.The callous kidnapping of the Garritys' child, separating him from his mother, is also a different kind of nightmare.After two hours, you do end up caring about the characters, even as Greenland showcases the best and worst in humanity and hurtles inevitably towards a predictable conclusion.Its message rings even louder during the Covid-19 crisis, reflecting on who we are as a people and how we can survive a common international threat together.So if you are looking for a sliver of hope - and mass entertainment - amid the gloom, Greenland makes enough of an impact."
289,Lots of movies that dipicts the end of the world have the same storyline. Was this meant to happen in reality. Prepare yourself folks something huge is about to happen soon. This isn't just a movie but an indirect warning.
290,"The movie is so real that I lived it while watching! People's behavior during a cataclysm is presented realistically and decisions made were truly... 85% of the movie you'll watch with your eyes wide open if you truly understand how it is being in state of emergency, knowing that you can't avoid the inevitable. I like how the movie isn't about hero saving the world and it's not filled with boring everyday cliches that you see in every other movie. This is something different that we all needed and I absolutely recommend watching it!"
291,"This film start with a man ""John"" asking by his worker to go home, and John back to his house talking to his wife ""Allison"" scene! As turnout, this film is about John, Allison and their son ""Nathan"" need to escape to a bunker at Greenland to save themselves from the strike of the comet! Entire film full of boring conversation, and annoying overuse scene! Such as, overuse of the news broadcasting scene, overuse of the staring scene, overuse of the shouting name scene, overuse of the arguing scene, and overuse of the flashbacks scene! Make the film unwatchable! All the action scene also not intense, messy and shaky! Barely intense scene is, myriad of debris from the comet strike at a bunch of people's car on the road! At the end, John, Allison, and Nathan come out from the bunker, after the comet disaster over! That's it! wasting time to watch!"
292,"""Greenland"" actually shows the bigger reality of our existence on this planet, and does it in a realistic way. Without a moment of boredom, and without any notable thing to complain about.
For that alone it deserves the highest mark."
293,"This film feels like it was written by a Millennial only capable of creating characters driven by their own self-absorbed needs, as on countless occasions our protagonists are given the opportunity to help others and yet they do not. Which doesn't exactly make you want to see them survive. In fact, at several points in the film I wished, I prayed even, that a large chunk of comet debris would fall on their heads. ***SPOILER ALERT*** Unfortunately, it didn't. Rather anyone who seemed to show these losers even a ounce of kindness wound up dead."
294,The subject was good but the movie is quite boring... Very predictable and unnecessarily lengthy scenes. Didn't enjoy it much at all.
295,"I gave it a 5 due to the drama bits being soooo long and drawn out. The special effects we're well done but the directing is just a bit lacking, imo. It kept feeling like it wanted to move on but kept getting stuck."
296,The story does not link together. The movie has some seance that are to bloody. and they were not important. I don't know why they had to put some much vaillant!
297,Nothing unique about this film but I like sci fi and I like Gerard Butler so I watched this. I heard an interview with a scientist that I guess consulted on this movie. It's 2020 so anything can happen right ? Lol. A comet is heading toward Earth threatening to destroy all humanity.Dialogue nothing impressive especially the scene between John and his father in law when he is confronted about the marriage and cheating. Thought it was a made for TV movie there for a minute.Morena Bacarrin Gabe a good emotional performance as Johns wife. Trying desperately to protect their diabetic son in the ensuing chaosWorth a watch but I would spend more than 6 or $7 to see it.
298,"I watched it with my kids. My expectations were very low, it pleasantly surprised me. Don't get me wrong, the script is pretty linear, however it plays well on the emotional side."
299,It is hard to find a good catastrophe movie theese days. It was cool to see things normal people would experience in these kind of situations. Little details on the despair of others really made me like this movie. Of course some high-class cinema guru's will crush this movie but it is a damn fine movie for me(a normal person :D).
300,"Gerard Butler was awesome as Leonidas in 300, definitely his best role. Since then he's mainly done disaster style popcorn which are enjoyable if not substantial.This is similar and better than average . Well paced with a believable existential threat.Negs are the unnecessary back story melodrama and the covert woke culture but that is standard across the board for many years.
That the rioting and looting in real present day America is worse than the end of the world America looting in Greenland says some a lot about how crappy a year 2020 has been.Overall well produced and well acted by all if predictable. I got to see it in Asia on the big screen which is the best way to enjoy the sfx . Thumbs up."
301,"Which script was probably written by 12 year olds or imbecils, at least it made me feel like an imbecil."
302,"Finally this actress and in a movie about the end of Earth again😁👌✌It's a good one, really liked it!"
303,I hate everything about these people who think this life is given them! I do not want them to think these people are idiots and are what they saw was
