,0
197,"Terrible terrible movie. As soon as we know the kid is a diabetic, It was clear to me what the movie is about and how it would revolve and unfold.. It is so full of clichés, terrible acting and surprisingly dumb events in time and story, it's even insulting to people who simply want to be entertained by watching a disaster movie on Saturday night. Simply disastrous."
198,"Very poor script, very poor acting...one hilarious and non-logical decision after another, the characters are constantly behaving like low-IQ idiots, and especially the wife and the Carl Sagan-like-child are painful to watch"
199,Mediocre at best....the plot has holes like a swiss cheese....incredibly boring and im speechless .... deep impact was better.
200,"Probably the worst movie of the decade, horrible plot - just copied from anything that had the same theme before, be it movie, cartoon or comics - not 1 original moment in the whole ""film""! horrible acting, so horrible that you want to throw up so many times during this garbage, awful music, cheap production, probably the only expense was the ""actors"" wages... this movie is what we will have to get used to if covid 19 stays with us, cheaply produced garbage with worthless actors. Omg, this is not the world we want."
201,"If you enjoy reading my Spoiler-Free reviews, please follow my blog :)This type of movie is always rather divisive between critics and audiences simply due to its nature. Story-wise, it's never groundbreaking or innovative in any shape or form. These apocalyptic films always follow a formulaic screenplay, packed with logical inconsistencies, but also with tons of thrilling action. Visuals vary in quality depending on the studio, as well as sound design and other technical aspects. I always try my best to accept *everything* these movies throw irrationally at the viewer. I prepare myself to be as open-minded as I can, and usually, I have no issues with that (actually, I find the ""that's not how science works"" argument a bit nitpicky in this subgenre).However, Greenland fails to deliver the only thing I did expect from it: a planet-killer comet of pure popcorn entertainment. The only positive aspects are the cast and two/three sequences genuinely exciting. Gerard Butler is already used to this sort of film (Has Fallen series, Geostorm), so he has no problems in portraying another thin character with no real motivations or depth. Same goes for Morena Baccarin, who simply plays the wife of Butler. Both deliver good performances, enough to keep me engaged until the end of the flick.The few good sequences are really good. Little scraps of the giant comet hit Earth before the extinction-level event, and these look great. Nevertheless, just this for a 119-minute runtime is far from being satisfying. As expected, Chris Sparling's screenplay is as generic as it could be, just like Ric Roman Waugh's direction, which doesn't really offer anything remotely new. Some narrative decisions (not related to science or technology because these I just accepted as part of the usual illogical stuff) are definitely to pass the time since they have no consequences whatsoever. Greenland is precisely like dozens of other movies in the subgenre, but without the technical aspects that end up elevating the overall picture.The VFX look dated in some sequences, almost like they didn't have enough time (or money) to finish them. I mean, a static image of a meteorite shower as the sky? Really? Sadly, this comes across as amateur and lazy. The absence of a powerful score (David Buckley) makes the action scenes feel ""empty"", like something is missing. A few fighting moments are pretty much impossible to see clearly due to the overly dark environment and choppy editing (Gabriel Fleming). Overall, the action walks the line between decent and terrible.However, the most significant ""slap in the face"" is the planet-killer comet that everyone is going to look forward to as soon as they enter the theater. There's no way of working around this: if an entire film builds up a third act's massive comet of the side of Europe, it must show it hit the ground in all of its splendor. The gigantic explosion of ridiculous proportions, the endless smoke that fills up the whole atmosphere, the distinctive sound of the impact... This is the moment that can make or break any apocalyptic movie. Unfortunately, and I'm only going to write this, it broke.In the end, Greenland is predictably underwhelming, packing only a couple of genuinely exciting sequences, and a decent cast. Gerard Butler and Morena Baccarin try, but they're not enough to compensate for everything else. As expected, Chris Sparling's formulaic screenplay doesn't add a unique storyline or innovative aspect to the genre, as well as Ric Roman Waugh's basic direction. This would all be fine if the action delivered what most people want to see, but sadly, this component is also quite a letdown. Despite a few occasional, riveting scenes, the entertainment levels are pretty low due to the unimpressive visual effects, lack of a powerful score, and poor editing, culminating in a ""viewing-killer"" disappointment. If you absolutely love apocalyptic films, maybe you'll find something enjoyable about it that I didn't. However, if this type of movie doesn't suit your preferences, then this one surely isn't going to convert you.Rating: D+"
202,"If it is not Guy Ritchie who directs Butler, then it's not worth mentioning G Butler at all -- unless one focuses on the potential that movie could have had"
203,"Basic premise failure: if you can't predict where the pieces of the comet are going to impact with any accuracy, then it makes the most sense to stay put rather than bug out. The stupidity of the premise is outdone by the stupidity of the main characters and the cliches layered on top of cliches. I"
204,"Emmerich has run out of ideas and we're left with a much worse copy of his 10 yrs old ""2012"" cgi is of course better but- this truly sucks."
205,"I took the Missy with me knowing that it would be the last day that this new release would be on the biggest screen in the cinema. I kept telling her that she was gonna love this movie. I was so embarrassed after the movie.There's hardly any CGI, which I was hoping for except for 1 scene where there's debri of a meteor falling onto cars. I could count on my 1 hand the amount of special effects there were. I was so disappointed with this movie I just had to warn my fellow movie goers. Rather watch this less than mediocre movie at home, don't waste your time and money going to the cinema's.Mother loses husband, then decides, hey let's trek across the country to my dad, knowing he has the insulin for her son who's with her. Knowing that there's a huge chance that he'll come back to the car looking for them, and leaves a small note by the car which anyone could've just taken. There's a long night scene of shaky camera, where I struggled to actually see what the hell was happening, hoping that it could be daylight again. I just wanted this movie to end to put me out of my misery."
206,"Do not expect the usual disaster movie full of explosions and VFX. It focuses more on the Garrity family, and their quest to reach the safety in the government bunker, before the world ends. The family during their survival journey will encounter many difficulties. Greenland tries to be a different movie on the genre, and I appreciate when a director take a different approach, considering also that most of these apocalypse movie are very similar.Characters are very flat, there is no development. The wife, Allison is really annoying and I think that she cries 80% of the time, Gerard Butler tried to do his best, but unfortunately he could not deliver a convincing performance. Maybe the most convincing actor was Roger Dave Floyd playing the kid. There are a lot of boring and uninspired dialogues, that serves to increase the runtime. If they wanted to do a really different thing, they should have focus more on the human side of the family, showing more complex emotions, adding maybe a few tension moments here and there. The problem with Greenland is that it wants to take a different approach from the rest of these disaster movies, but at the same time wants to be one of those Hollywood blockbuster, so at the end I did not really understand the who this movie was made for. For sure not for people that loves apocalypse movies, there is not enough action, but is not either for people that would like to watch something deeper, because there isn't one single interesting dialogue or character.I personally don't recommend this movie, it seems that screenwriters and the director did not even try to do a good product."
207,"I love this kind of movies: extinction, alien invasion and all sorts of end of the world-heroic saviors-human action and drama movies. This movie is just ok, it doesn't reach the level of the 90's and early 2020's films. Armageddon, Deep Impact, Independence Day. It seems they don't make them like that anymore. Say all you want about American action heroes and their topics, those movies were something special and memorable. Greenland is a very forgettable story that could have been waaaaay better."
208,It was interesting the whole time i never got bored while watching it
209,"Corny acting. Corny plot. I can't believe that I watched this crock.
Gerard must be hard up to put his name to this.
Amateurish plot and poorly executed."
210,"Total time waste. 1. Its like an emotional roller coaster. Everyone is either getting seperated or some other silly tragedies. 2. Wherever the main characters go, something drops close to them. They are cursed man!"
211,"This movie should've had a warning label, for viewers five years and under."
212,"I've seen more action in a daytime Lifetime movie. And why would it be a good idea to combine marital problems with the end of the world? If the world is ending tomorrow, i'm pretty sure that relationship issues would be one of the last things on peoples minds, yet they made it into a prominent part of this movie. So silly."
213,In one word boring in two words childishly boring. Content is lacking with usual story line. Going from one situation to the next in a really unrealistic way. If you are a teenager maybe you will enjoy this movie.
214,This movie is predictable n unbelievable in so many ways. It should be a comedy. Actually no it'd still stink!!
215,"The enjoyment of this flick would depend totally upon a) one's IQ or b) disposition (that's less permanent, ha ha). If you prefer (or in the mood to) watch a work of art that tells a story of a comet about to hit the Earth, see Melancholia. Should you just want to kill a couple of precious hours of your life, opt for Greenland. Sometimes it's OK to watch something unpretentious and lowbrow, just don't make it a habit."
216,"I was really quite looking forward to seeing this, as it was supposed to be thrilling.....After 40 minutes in, I turned it off, its all very predictable, from the sick kid leaving his meds in the car, to them getting separated, to the fuel spill, sorry but its just predictably the same as most other disaster films."
217,"Things I've learned from this movie are;
Abandoning your parents is OK.Having a decent education and job saves your life.You deserve to die if you are poor and uneducated.Your family is the most important. Families of other people are worthless."
218,"Usual story revolving around a small family. Not much visual effects. I was expecting some visuals like movie 2012. 3 stars just for acting and lesson they are trying to give, moreover some useful instruction incase of any disaster."
219,"Better than I expected, not just a loud blockbuster movie."
220,"Okay this is a great example of the type of movie that doesn't have to be ""good"" for me to enjoy it. i like disaster action movies, but this one is very different from the ones i've seen. it comes from space!! very cool, very anxiety-inducing, and just generally a good time.but that is all. and it's all cliche."
221,"I've seen this so many times over the years - white American saves family from certain death and save the world.When the Hero has to rush back to get the son's life saving drugs from the car, which they gave to the son to look after and of course he dropped as he was petrified, through crowds of screaming people trying to save themselves, that was it for me.If they want a script that isn't 100 years old, let me know."
222,Another manufactured emotional rollercoaster. Everything goes wrong and everyone makes every possible dumb decision to heighten the artificial conflict.
223,"The comet stuff, the way the world reacts and the special effects are great. I was really on the edge of my seat because it was really believable, all of it. I love disaster movies like Deep Impact and Armageddon but this is the first one that was realistic, in my opinion.That said, you get people who just make one bad decision after another. It's like the zombie movies where people do this. You're screaming at the screen ""why? why?"" It's super annoying. And the maudlin ""I love you son"" every time they're in the same scene, also annoying.I'd love to see a movie like this, that is well done, with people making the decisions that you and I would make in this situation, then create conflict from that. Not from stupid people making stupid decisions.The comet stuff was really great and realistic, I recommend for that alone."
224,"I set my expectations low and still this movie disappointed me. Dumb decision after dumb decision. And also extremely biased casting on the ""good guys and the bad guys"". Subliminal wokeness. Lets make sure every person of this race is a helping hand hero good guy, and for the select evil characters we must make sure they are that race. NO exceptions on this part except for the main hero who's solely cast to lure a big audience to this disaster of a disastermovie"
225,"Wanted to see this as it sounded really good, but its so disappointing. One poor choice after another, cliché, and slow. Terrible actually"
226,"One stupid moment after another. Watchable, but if the choice is this or another movie. Go with the other."
227,"It starts so good! And then it devolves into a broken marriage reconnecting.Oh and the dinosaur killer asteroid that caused an ice age - thousands of years! Blacked out the sun! Bigger one hit, atmosphere cleared up in NINE MONTHS. Are you kidding?Also they went into the cave with maybe a month of insulin. 9 months later. Kids still good."
228,"I had the total lack of pleasure of watching this last night at a neighbours ... Its like a woman's hour made for tv disaster movie ... Its mostly cars and motorways and roadblocks ... I think literally all the effects shots are in the trailer ... And they are all just copies of stuff from 2012 ... A film without the best reputation itself, but I think its a great entertaining over the top comedy ... This thing is more like drowning is syrup ... Hideously shmaltzy manipulative storytelling ... A family drama in a crisis ... And it fails terribly ...I couldn't wait for it to end ... Gerard Butler is a limited actor and this highlites all his limitations ... Its basically everything that's wrong with Hollywood today ... Why redo things that have been done so much better before ... There is absolutely no reason for this thing to resist ... It doesn't have one new idea or shot that can justify its existence ... And some it is just cringeworthy ... Do yourself a favour and do something else with your 2 hours cos this is painful outmoded trash"
229,"Something just like 2012
visual effects are OK.
I like the doomsday, but not like this."
230,"There's too many things that just defy basic social interaction amongst people to go into here: 1 of 10Some special effects really cool, most are not: 4 of 10Kid was rightfully rejected, not for being a diabetic, but because of his total lack of critical thinking skills, and as well you can put his parents in there. Government in charge of saving the world realism: 2 of 10Clarke was seen to be closer than the moon, given scale to airplanes flying in foreground, and they are just alerting people of impact and you've been selected, surprise! Well just some thumbnail math for it to be moving at extinction speed would say they had about 2 hours TKTAG. Realistic physics: 1 of 10.News media broadcasting their doom and all communications for TV are still up and running, they even announce on radio you have seconds to seek shelter from molten meteor showering down, again that slow-as-molasses comet, gave only seconds warning notice, and the dutiful media there to help out instead of getting their families and themselves to shelter. Just idiotic: 1 of 10In general, if you need something to hurl sarcasm at the screen with friends then this is it: 10 of 10."
231,"Sad to say, this brought nothing new to the table. Actually I felt like it brought less than a few other movies in the same category. It's the same ingredients as all the other disaster movies. It's too simple and annoying all the time. I didn't have a lot of fun watching it. Me and my friends watching it, felt the same. BIG letdown.I love Gerard Butler, I see all his movie. And I will continue too. But this delivered too little of what was promised. But, you might like it. Give it a go.5/10"
232,"It wasnt bad but needed more disaster parts, here it was more drama with dis. bits. the moment they said kid is diabetic i knew there will be some subplot problem with it (cliche f boring). so 9 months and its over, sun is back etc? pretty sure u wont be able to see even a glimpse of sun for few years. and since they didnt take ill ppl, where they find insuline 4 kid 4 9 months?
anyway decent warch especially with Morena..."
233,"End of the world movies. We went to the cinema expecting bad and we got worse. As a person who always wants to see the next EOTW movie, I have seen all of the cliches and this one had them all. Let´s start with the yet again white, rich family (all though the woman is Brazilian) with the broken marriage and a kid with an illness, diabetes (it´s always diabetes). The diabetes fact is given to us straight away, so we both knew immediately what was going to happen with that, and it did. The kid is also smart and well behaved, which is nice but getting kinda boring. Why can´t they represent the morons? The whole cast is tall and skinny, so how about a 150 cm (4""9) person for a change?
The guy is obviously an accidental hero throughout the movie while the woman hangs around with the child and can´t seem to do anything on her own. She will also ask the man idiotic questions to which she should know the answer to, since she´s in the situations herself.
The main character guy (Butler) does stupid heroic acts multiple times during the movie, no doubt playing out the macho man fantasy of the director or screenwriter.
This is a good piece for when you want to waste a couple hours or when you need a movie for a drinking game. Either way wouldn´t pay to see it, but the damage is already done. I will give credit for the fact that the kid was a great actor and for once the world included other continents too. They even mention countries that I guess many Americans don´t have any idea about. All in all made me laugh and cringe, so an evening well spent? See at own risk."
234,Out of 17.6 million for production of movie I think 17million was given to butler.. not worth a watch.
235,"This family should not be cellect from goverment , done too many stupid thing. Grand father bad (very) acting . So borning movie ."
236,"It's a realistic recreation of possible events when a comet hits the Earth. Human relations and human behavior in extreme situations are observed and these are important part of this movie. So, this not just non-stop CGI action what you probably think if you see the movie trailer.
Shame to admit name Morena Baccarin didn't say much to me before, I checked, and she has strong sci-fi background already."
237,"I must say this movie was way better than what I expected. I am afraid it won't succeed as much due to COVID.
But on the other hand it is kind of a good timing. The everyone-for-himself attitude depicted in Greenland is very much what we have seen so far in this crisis.
For a Misanthrop like me a perfect movie."
238,"I liked the movie and I liked the plot, I think the actors did a good job in the movie.
There's two things that bothered me, first of all was the bag and the blanket... they suddenly reappeared, after mother and son reunited... what happened?? Those things were supposed to be in the crazy couples car, where the son was kidnapped.
Second, the characters arrived to Greenland... or was it Greenland? It would be so nice, for once, to show the real landscape of Greenland... even more if the movie is going be called Greenland.."
239,"Watched it tonight, felt like stopping it hald way through. What a stupid movie! So an asteroid is hitting the Earth, if thats not plot enough for you to write a 2h movie on, go back to writting school. They threw in all kinds of stupid ideas for no reason what so ever. People are raiding a pharmacy... okay... but then a bunch of goons start shooting up the place just because... WTF?! A guy gives the wife and the kid a ride north, ends up kidnapping the kid?! How ridiculous is this?! ohhh yeahhh and the kid was diabetic!!!R U Serious?! Its like they had a writers meeting where every idea on how to make it worse made it to the movie!! Ridiculous."
240,"I thought this might me a reasonable movie to watch but was disappointed with it.The story is predictable and just not very interesting at all. The story could have been told in half the time, and many of the events were just so far fetched as to be stupid. More like a low level B movie.One to miss."
241,This is a family drama with a little bit of action thrown in to disguise it as a disaster movie. It's about 45 minutes too long and the story is quite boring considering the subject matter.
242,"A total disappointment . That's the least to say in a supposed better , Gerard Butler movie . I feel i was maximum cheated in names once again , and felt bored to death watching a family loosing first their son , then the husband looses the wife and all three end up searching for each other , in a very fractured plot and incomprehensible way , then when my ordeal ended (not theirs), let's search for a lost father !..Frankly , I started betting with family that they'll be lost again , but yes , i was joking .
Finally , when the four meet , kaboom , and I was happy , lol ..
2012 , Armageddon , I was seriously underestimating you , the cliches and the whole things .
I won't talk about the one hundred mess and unsustainable fractures in Greenland cause frankly it ain't worth it . A wasted time .I rated it 4/10 ."
243,"I dont often go to cinemas, but do enjoy big action disaster
movies on the big screen , unfortunately this was not it!!"
244,"Amazing film, liked it a lot. I was wondered when discovered, that budget of this film is so low (if we are talking about disaster films which are full of effects), because it doesn't look like cheap film at all. Liked almost everything and definitely will watch once again in the nearest future. Highly recommend this film to everyone :)"
245,First time taking the time to write a review... absolutely completely disappointed. 🤙🏼🙄
246,"The film suprised me positively. There are old cliches, but it really is a disaster movie. What were you expecting?The characters are not superhuman, they fumble in fights and are afraid. They also make poor choices. The story is not overexplained.There is no presidents speech (truly rare in disaster movies). They way that society breaks down is totally believable.Ballance between action and story building is good. If they would have left the final ending out I would have given 9/10 stars.Go see this, its a fun ride."
247,👍🏽👍🏽👍🏽👍🏽👍🏽👍🏽👍🏽👍🏽👍🏽👍🏽👍🏽👍🏽👍🏽👍🏽👍🏽👍🏽👍🏽👍🏽👍🏽👍🏽👍🏽👍🏽👍🏽👍🏽👍🏽👍🏽👍🏽👍🏽👍🏽👍🏽👍🏽👍🏽👍🏽👍🏽👍🏽👍🏽👍🏽👍🏽👍🏽👍🏽👍🏽👍🏽👍🏽👍🏽👍🏽👍🏽👍🏽👍🏽👍🏽👍🏽👍🏽👍🏽👍🏽👍🏽👍🏽👍🏽👍🏽👍🏽👍🏽👍🏽👍🏽👍🏽👍🏽👍🏽👍🏽👍🏽👍🏽👍🏽
248,"Bad acting and very predictable plot.
Worth the time if you're in a desperado mode.
3.5/10"
249,"I don't expect much about this movie, but I thank God I was able to watch thoroughly. This is one of the best acting performance of Gerard Butler I've ever seen on his films.The storylines was perfect to entertain audiences who are fan on world destruction flicks. The thrill and suspense caught the wildest of my imagination.I don't understand why people thumbs down this movie. It's pretty decent, in fact this is the best movie I've seen in 2020 so far!"
250,"Whole movie revolves around a family that I really couldn't care less about. The start of the movie was promising, but after that it was just cliches and face-palm worthy moments. I ended up skipping through the last half of the movie, and am glad I did.
Nothing interesting or fresh. Waste of good actors."
251,Never seen G. Butler be so indecisive. Very frustrating movie even the wife was yelling at the sceen.
252,"What an awful movie, thanks to the dad a plane full of people die, the son when he was in the truck he could have get off but he did nothing and the mom could tell the truth and they wouldn't have kidnapped her son, thanks to that family a lot a lot of people die and they didn't care, just stupid"
253,"This film is scene for scene world war z minus the zombies. Still a good watch but, mmm."
