,0
336,This movie is nothing more than another bland Hollywood comedy film. So weird and bad acting .
337,This movie is awful. The acting is stupid. The effects are lame. The whole movie is bad . Don't recommend it .
338,"This is by far the worst witch movie I have seen. The cast is lame , the effects are fake and cheap. Don't recommend it!"
339,This movie is equivalent to the ultimate Karen's movie. Not witches at all! These are joker Karen looking things. Too scary for kids and too boring for adults. Lost the charm of the original! Don't recommend!
340,This movie is awful from its acting to its sets and effects. Terrible movie! Don't recommend it!
341,This movie is awful. Everything from the acting to the effects are just awful. Don't recommend this movie at all!
342,"This movie is just awful! The acting is weird and stupid, the effects are cheap and lame, the whole movie is just awful! Don't recommend it!"
343,This is not a witches movie!! This is the ultimate Karen movie + everybody hates Chris !! Terrible waste of time! Don't recommend this at all! Skip it! Read the book or watch the 1990 movie instead of this garbage!
344,This movie sucks! The acting is bipolar and all the actors look uninterested in their roles. The effects are cheap and fake looking. Bad movie!!
345,This movie sucks!! The original was far superior. This movie is too bland and boring !
346,This remake is awful and bland ! There's nothing new nor noteworthy about this CGI driven boring remake. Don't recommend it!
347,"This movie is very unnecessary and stupid remake to a classic story / movie. The acting is awful and bipolar , the sets are bland and cheap , the whole movie is just awful. Don't recommend it at all!"
348,"This movie sucks! One of the worst book to movie adaptations I have seen ! The acting is lame and stupid, the sets are small and fake looking, the effects are very cheap and artificial looking as well! Don't recommend this !!"
349,This movie is an awful excuse for a witches remake! The film is hands down awful garbage about some random Karen's running around on screen acting ridiculous. Not entertaining. Too problematic and weird movie. Don't recommend it! Skip it!
350,This movie was too underwhelming and lame ! The acting was bad and stupid. Don't recommend it! Skip it !
351,"This movie is too bland and boring and doesn't bring much new content to the screen. Don't recommend it! Bad acting, fake sets, overall very lame movie!"
352,"This movie is awful ! Terrible acting , actors don't seem engaged in their roles, the sets are cheap and fake. Overall, very over rated and not delivers ! Don't recommend!"
353,"This movie is nothing more than cheesy, flashy, Hollywood garbage movie about some bratty Karen's! Worst movie ever ! Too scary and weird for kids and too boring and bland for adults ! Don't recommend it!"
354,Anne Hathaway does not play a witch in this movie... more like a weird Karen joker character. Not scary and not very consistent with her acting. Don't recommend it! Too scary for kids and too boring for adults. Skip it!
355,This movie is equivalent to the trash and worst movies produced from Hollywood. It is painfully stupid and boring film with nothing new to offer either the story nor to its characters. Don't recommend it! Skip it!
356,"This movie is a complete mess! The acting is bipolar , the sets are cheap and fake looking, the whole film is negative. I don't recommend this film at all! Skip it!"
357,Anne Hathaway was the perfect woman for the reboot of the witches . Her humor and cgi of being a witch is brilliant.Robert zemeckis choose Anne Hathaway very good .
358,This movie is so awfully executed and poorly put together it is SCARY! There are lots of weird offensive elements spilled in this movie. It's awful and I can't stand it. Don't recommend it! Skip it!
359,They did not need to make a remake of this movie the original was a classic and this one was terrible. The special effects made it so tacky and definitely wasn't as tasteful and intense as the first one.. also terrible acting overall a waste of time to watch. Watch the original
360,This witches remake is nothing more than another average Hollywood fastly made movie with nothing unique to offer. Don't recommend it . Skip it.
361,"I absolutely loved this Remake of The Witches. Dont get me wrong i like the original. This REMAKE tho It was cute, funny & very kid oriented. The new look for the witches were amazing! The mouth, hands, & feet. I loved the way the grand high witch hands stretched into the vent, and when the lightning flew out her hands. To me Anne Hathaway brought a whole different element to the movie, ALL the actors did. I smiled thru out the whole movie. I will be watching over & over again you can believe that"
362,"This movie is awfully executed! The acting is bipolar, the sets are cheap and fake looking, the whole movie is just a mess. Don't recommend it at all! Skip it and watch anything else !"
363,"It has all these cheesy plot, script, storyline. Well almost everything about this movie is cheesy. But it is watchable and you might enjoy this watching with your whole family. But little kids audience might find the witches face quite scary to look at. Creepy.I actually quite enjoy this despite all the bad reviews. Come on! It is not that bad. I managed to watch this without any skipping or paused to finish it the next day (like i always did)."
364,"I mainly watched this movie cause I was curious about how the effects of this remake would be in comparison to the original 1990 movie, & I have to say although the movie is quite enjoyable to watch it really doesn't live up to the original. Having never really been a fan of Anne Hathaway and only seeing her in ""The Devil Wears Prada"" which believe me, I don't think I'll ever watch that movie the same way again after seeing ""The Witches"" (2020), there's just something about her character of The Grand High Witch that didn't really give me the chills as much as the original (if at all). In the original Anjelica Huston was known to frighten many that I know of, myself included, with her 4 hours of make-up I should bloody well think so and all. But here, in the 2020 remake it seems there's little to no effort at all. And like many of the reviews here, there's a lot of scenes in this movie that have been cut which were originally in the 1990 classic, as for Hathaway's accent; yes I do see the change in it throughout the movie, there's no consistency with it - is she Russian or British? I think I can safely say she's been well and truly mis-cast here, it isn't the right film for her & if you read the trivia section it mentions other possible actresses that were considered for the role & most of them would have been far better. For me, this isn't a terrible film but it's not blockbuster of the year either. Entertaining for kids yes and comedic elements are there but I will always think more of the original. Hathaway is no Huston."
365,"Robert Zemeckis with the help of Guillermo del Toro has gone for a grotesque take on Roald Dahl's The Witches.The book has been transplanted to Alabama 1968. A young boy (Jahzir Bruno) goes to live with his Grandma (Octavia Spencer) after the death of his parents in a car accident. He gets a pet mouse to cheer him up.One day in a store he is lured by a witch who offers him a bar of chocolate. However his grandma calls out for him before any damage is done.His grandmother tells him when she was a child her friend was turned into a chicken by a witch. The witches seem to target black kids as no one seems to notice when they go missing.The boy is taken to a hotel to stay by the seaside by his grandmother. Unfortunately the witches are having a convention where the Grand High Witch (Anne Hathaway) plans to turn all the children into mice.Blessed with a narration from Chris Rock, a camp performance from Anne Hathaway and expensive CGI special effects. This adaptation still struggles compared to Nicolas Roeg's version from 1990.This can be shown by the waste of Stanley Tucci's hotel manager character. At times The Witches wants to be a dark Disneyfied kids movie with a nod and a wink to Charlie and the Chocolate Factory. This explains why a fat boy lured with bars of chocolate is transformed into a mouse because of his greed."
366,"Now if you're going to go into this movie expecting anything similar to the first adaptation, you'll be sorely disappointed. Yes, people seem to remember it more than the original book, but just like the case of Willy Wonka vs Charlie & the Chocolate Factory, it's a misunderstood case of not realizing what one adaptation is over the other. I can't stress enough how much this irritates me. I'm not saying this film is all that great though, as it has as many misfires as it does gems. For all the decent performances, impressive practical effects and playful cinematography, there's also a sordid first half of the narrative, bland characters and horrifying CGI. My only recommendation is to see this if you've never read the book or seen the 1990 adaptation, because it's more for first time viewers anyway."
367,"I'll admit, some stuff was very disappointing about the film. There wasn't enough action, Sci-fi and fantasy scenes. There also wasn't enough character building. everything just seemed to go through at its own pace without further explanations or more depth to the story. But this movie is not all bad as it may seem. The main, and most enjoyable part of this movie was Anne Hathaway. She played the head which perfectly. I have never seen her do a project that involved so much screaming and had that much visual effects for her. To me I think she deserves another ask her for her role. Same with Octavia Spencer. She was awesome too! This movie may not live up to its novelization in the 1990 version, but it's still an enjoyable film for the family to watch and has a somewhat awesome plot that tells the story of creepy ass witches!!"
368,Yes this film should have been british and Anne Hathaway was not the right choice for lead role but this is still a good adaption.I believe kids will love this movie and adult also so long as you dont compare to much to the classic british version.Just sit back and enjoy the kids and the grandmother who all did a great job in this movie and dont listen to the 1 star or 10 star reviews.
369,Such a great remake! Way better! We loves this movie. My kids adore this movie!!! Anne Hathaway is just perfect
370,"First, I'd never heard of the original Witches until the trailer for the remake. We watched the old one and liked it, but the old robotic mice creeped me out and I can't see my kids loving it like the movies being made today. It's not a stab at the old one, just the truth. Times have evolved in movie making and the new one proves it. The story was not in depth like the first one, at least in the witch scenes. I can excuse it because it left room for the grandma and Luke to bond and some new scenes to add to the fun aspect of being mice. Their background was a retelling and you can't be mad at it because the setting is in Georgia, not Norway so the original story of the girl in the painting wouldn't work. The new story was meant to capture kids' imagination and I think it achieved it. Anne's accent was just as hard to understand as Angelica's so I wish they would've improved on that. These two ladies shouldn't be compared because I enjoyed what they both brought to the characters. It's a retelling, not an exact copy! Each movie has their own high's and lows, which should just be enjoyed, not picked apart because grown adults think it it should only be done ONE way. The retelling was fun and meant to capture the attention of kids, which I think it did. It brought a new audience to an old forgotten movie and it's new companion. I recommend it!"
371,1960's Alabama........ really. Seems like the director was more concerned about ticking the equity and diversity box than making a good movie
372,"Why on God's green Earth did someone feel the need to place this movie in Alabama, make everyone speak Southern U.S. English and make it about race when the movie was supposed to be about witches? The original adaptation made me so scared as a kid that I had nightmares after watching it. This one was so colorful that the only thing I have right now is a color shock. Also, why was the Grand High Witch talking like Gollum from Lord of the Rings and looked like Nyssiana from Alita? If you would like your kids to see movies about rats, go watch Ratatouille instead."
373,"Ok. I haven't seen the 90's Original. I haven't read the book. I like this movie though, and I can understand the comments from the fans of the original. It is pain when someone turns your childhood memories and twists them a bit and then polishes and gives them back, only they are transformed now and you don't connect to them. This will always be the problem of remakes.But let me just be clear, Mulan was remade, I hadn't watched that original either, still I found the remake disgusting, it was a terrible movie. That is not the case with The Witches, I found it sweet, funny and thoroughly entertaining."
374,"With a hilarious blend of comedy and a few frights. Witches lived up to the high expectations. Hilarious narrations by Chris Rock keeps you smiling, and entertained. All the actors and actresses did phenomenal jobs. Fantastic movie"
375,"I will start by saying I just recently watched the original about a week ago and thought it was pretty cool, especially the effects for the time. Anjelica Huston was great in it but that's it. I love the reimagined backstory of the little boy and what happens to his parents. Love his welcoming grandmother (played by the wonderful Octavia Spencer) and as a black man I relate to this story a lot more than the original. The music used was perfectly used as well as Chris Rock's narration. I thought Anne Hathaway did a great job and the effects were pretty decent. I know people love the original of anything no matter what and usually hate remakes, but simply put this one was a lot better simply because the boy and grandmother are black, it makes it more personal and relatable to me."
376,"I love the original movie and although the remake is not as good, I feel that it is still a good movie. I watched it with my 5 year old and we were able to finish it and she liked it. It is a kids movie, a little bit more darker or scarier my girl would not have watch it."
377,"If you like a movie that is all about fun, a decent storyline, great special effects and loaded with really good actors this is it.Perfect Hallowe'een movie for the whole family. Watch and enjoy!"
378,"I went into this with very low expectations, having read the book as a child and seen the original movie. If I'm going to be completely honest, anyone who hasn't seen this film needs to go in without seeing reviews because there is a clear bias against it. It is a very decent if not very straightforward remake that perhaps simplifies Roald Dahl's story a bit to be a bit cleaner cut whilst keeping it fresh and modern. Just enough backstory is given to keep children aware and adults interested. The movie has beautiful visuals and the acting is actually very good with special mentions going to both Octavia Spencer and Anne Hathaway's performances.The latter I tried to dislike but her habit of chewing the scenery and penchant for over the top villainy make her a perfect villain although at times, her attempt at an Eastern European accent can be a bit jarring. The child actors, Jahzir Kareem Bruno and Codie-Lei Eastick, we see in the lead roles are both very good in their limited screen time and their voice overs are professional. As an African-American male, I personally enjoyed the subtle references which came off as relatable but not too forced as to make it exploitative especially in a children's film. I loved how the film added in the aspects of the witches preying on those who wouldn't be missed or were vulnerable. All in all, this is a wonderful film and I feel any fan of the original and the book will love this straightforward but very good remake."
379,"Where do I start? Right away I could tell you I was in for quite the halloween treat. The aesthetic, the costumes, the sets, were very much needed to be enhanced from the original and zemeckis and co. absolutely delivered.Octavia is fantastic in this one folks, but isn't she just the charming little peach in just about everything she's in, there honey child?The child is no longer cringey and isn't given terrible lines and direction which is a big relief. Remember when the child in the original kept saying ""Grandma!"" in a far too excited and annoying cadence? I do and I still have nightmares.Opening up the film, it's again, so much better. You actually feel for the child losing his parents in this one as it isn't as cold or glossed over like in the 1990 version.Anne Hathaway is just phenomenal as the grand high witch, and I was scared too, as Houston was just superb in the original. She had no problem with portraying a hilarious and genuinely terrifying witch in this.I'll try not to go too far into this one, but there are some much welcomed surprises and twists in this that will delight and entertain the entire family.Go see it."
380,"You're not a child anymore, and they aren't here for you. i'm sure if you show any child they'll be totally engrossed in this movie and characters.also how are you going to say this is a shot by shot remake? i suspect a lot of you didn't even watch this. the original is a better movie overall, but saying this is a one star movie is a mistake.if you're not a picky, nostalgia ridden human, you'll likely find enjoyment from this. fast paced, easy to watch, kinda creepy, pretty funny, and perfect introduction to horror for young kids. i recommend."
381,Terrible casting and mangling a beloved story. Not much more needs to be said other than go watch the 1990 version.
382,Its strays so far from the original its unbelievable. The cast is totally wrong for the movie especially considering the grandma an grandson are white austrian and english in the original. And all of a sudden bame from alabama????? Totally awful movie.
383,"Roald Dahl's 1983 novel 'The Witches' was one of many hits from the highly-acclaimed author's prestigious bibliography and was brought to life on the big-screen in 1990 thanks in large part to producer Jim Henson. Dahl, however, was rather critical towards the film (as he was admittedly known to do when it came to adaptations of his work) for its radically different ending. Nevertheless, the film was a huge success with critics and while it may not have been much of a box-office hit, it has very much become a cult classic of its time. As such, it's not too surprising that the 1990 film's legacy has had a major impact on the reactions towards this year's new adaptation of the novel, directed by Robert Zemeckis and produced by Guillermo Del Toro and Alfonso Cuaron. But while most of the user reviews on this site are venomously decrying this as a complete and utter disaster, it's not 'that' bad.To be fair, though, I'm not saying that it's perfect as it's arguably the most by-the-numbers film that Zemeckis has ever directed. Just like what happened when Tim Burton directed his remake of 'Planet of the Apes' in 2001, this is one of those films where, if you didn't know that it was directed by the same guy behind 'Back to the Future' and 'Who Framed Roger Rabbit', you probably wouldn't have guessed since it's one of those films that could've easily been done by anyone. Still, for what it's worth, the film does a nice job of maintaining the whimsical nature of Roald Dahl's writing where the kids are the heroes in a story that's full of the delightfully twisted dark sense of humor that Dahl was well-known for. And while it's completely understandable if some may find her performance to be a bit too over-the-top, Anne Hathaway is clearly having a lot of fun in the lead role of the story's main antagonist, the Grand High Witch.Now as a quick disclaimer, while I have read the book, I'll admit that I've never watched the 1990 film because, simply put, it never ended up on my radar when I was growing up. As such, I don't have the strong connection to it that other folks have, thus influencing their thoughts on this new film. And becuase of this, I found this new version of 'The Witches' to be generally solid overall. While it's far from being the best film that Robert Zemeckis has ever directed, it's ultimately a harmless family-friendly flick that helps bring one of Dahl's most famous stories to a new generation."
384,"Casting, acting, pacing, all wrong. Another ruined movie. Chris Rock is terrible.The only reason it got 2 stars was that it had some good songs."
385,"Things are a little different but don't let they deter you from watching it. It has a fun story and all the actors/actresses do a great job! I had a great time watching it! Funny, spooky facial expressions from witches and a great story! Should definitely watch!"
386,"This is how you take a story and just destroy any heart it has.Whilst the cast isn't awful, they aren't given much to work with.A lot of people see the 1990 movie as a classic, and this 2020 version is definitely not a classic. It's full of over the top CGI, bad dialogue and too much Anne Hathaway cleavage for a 'family' movie.Some of the spooks are still there but then the tension is ruined by everything else that is bad.Let's not talk about that unnecessary voiceover.This is 2020s CATS. But with mice instead."
387,"I wish if they remade classics that they did a better job. I could've done WITHOUT Chris Rock's annoying voice and Anne Hathaway's TERRIBLE performace. I honestly do NOT why they casted her for this. Because of those two I am sad to say I am giving this film three stars. If it wasn't for them, I would have given the film at LEAST a six. That's how bad their perfomace was."
388,"This is a movie that's bizarre and not in a good way. The Witches look pretty horrifying and not in a spooky manner. The animation as a whole is very poor for the year 2020 and is distracting throughout. The fact 3 Oscar-winning directors were heavily involved in the making of this film is stunning. The effort here is lackluster, except for Hathaway, who you can tell is enjoying chewing the scenery. Zemeckis keeps doing these weird hybrid animation movies that just aren't good. A lot of the visuals are disturbing and the messages aren't well told. Also the Everybody Hates Chris narration is super weird. Not sure who asked for this movie, but it wasn't me."
389,Firstly there are a suspiciously large amount of 1 star reviews. Conclusion: trolls. Or just bored people with too much time on their hands. My kids absolutely LOVED this
390,"My 4 year old has a very poor attention span. Hardly ever sits through movies but she sat through the whole of this and thoroughly enjoyed it. She laughed throughout and found the grand high witch very scary.I personally found the movie to be watchable and it wasn't bad at all, the effects were very good and I liked Anne Hathaway's performance. I did however feel the movie lacked the depth of the original. They changed a lot of the original storyline which made it hard to connect with the characters and not to mention they didn't include a certain character that I feel was central to the original in adding a nice twist to the story, mainly at the end (if you've seen it and then watch this you will know who I'm talking about). I didn't feel any macabre and eerie aspects to this film and missed the story about the girl in the picture from the original movie. I hated the ending.I found that there were too many comedic elements to the movie instead of good character development and I would have given it 5 stars for effort, however my daughter just loved it and at the end of the day these kind of movies are more tailored to children so, although far from perfect, it's certainly one that little ones will enjoy around Halloween. Angelica Houston will always be the grand high witch to me but maybe watch this with an open mind with the kiddies and try not to take it too seriously. It's not a bad movie."
391,"I was really looking forward to catching this because the 1990 version with Angelica Huston as the villainous Grand High Witch was my absolute favourite film as a child.There are some things about this version which are enjoyable. I liked the opening section, and Octavia Spencer puts in a great performance as a characterful, strong and kind grandmother.It's the entire middle stretch of the film, taking place at the hotel, which is lacking. Hathaway's Grand High Witch just isn't scary. She's too clownish, over the top and silly. There is no subtlety. No sense of controlled, calculating evil under a sophisticated, disguised surface. The worst section was the conference room scene. In the original, it was suspenseful and scary. There's no suspence in this new version, it moves very quickly, and the over the top CGI is very off-putting. The reveal of the witches true appearance happens within seconds. Bruno's arrival and transformation is similarly rushed, there's no build-up as he slowly realises he's walked into danger and that he's the of a joke but doesn't know what it is yet.I'm sure children may enjoy this version, and maybe that's all I that matters, but I think the 1990 version is far superior in its writing, performances and effects."
392,Not near as good as the original but I suppose cute in it's own way.
393,First of all don't know why all this negativity here. Maybe it's not the remake audience expected. Still if you are watching it for first time with your family it is one of the sweetest enjoyable family movies I have seen. Perfect movie to watch with family this Halloween. Don't miss it.
