,0
438,"""The Witches"" is a dark fantasy film based on the novel of the same name by Roald Dahl. Directed by Robert Zemeckis (Back to the Future Trilogy, Forrest Gump) and starring Anne Hathaway, it is a mediocre update to a beloved children's story that only barely manages to engage its audience.In 1968 in Alabama, the unnamed hero boy (Jahzir Kadeem Bruno) survives a car crash that kills both of his parents and is sent to live with his maternal grandmother (Octavia Spencer). One day when the two are out shopping together, the hero boy encounters a witch who entices him with a snake and some chocolate, but disappears when his grandmother calls out to him. Later on, the grandmother tells the hero boy about how witches are very real and that once they set their sights on a particular child, they will never give up pursuit until that child is dead. Desperate to avoid her grandson from being killed, the grandmother and the hero boy take refuge in a high class hotel, unaware that a large group of witches led by the Grand High Witch (Anne Hathaway) are staying there as well.Nearly everyone I have met has read at least one story written by Roald Dahl. His dark sense of humour and tongue-in-cheek wit still resonates strongly with many people today, and most of this ends up being translated successfully into cinematic form with films like 1990's ""The Witches"". That film remains one of the most popular adaptations of Dahl's work, so it comes as a surprise that this modern update with seemingly better technology thirty years later could be so inferior in comparison. What I believe made the 1990 film special was how lively and raw the special effects were thanks to the puppetry and animatronics provided by the The Jim Henson Company. Whenever you saw a character interact with a mouse or a freakishly ugly witch, you instantly got the feeling that there was something physically there in front of them. With this film, the CGI is so overabundant and unconvincing that it severed most connection with me as I watched actors talk to an obvious green screen under the pretense that something will be added later in post-production. This made the film feel soulless and sterile and it constantly made me wish I was watching the original film instead.Quite a few talented people worked on this film, like director Robert Zemeckis, who also co-wrote the script with Guillermo del Toro. This should have been a winning combination but instead it seems nothing good came from it. Not once did I ever have that sense of wonder and fascination I've come to expect from watching a movie made with the involvement of either of these two. Zemeckis, who directed the cult classic ""Death Becomes Her"", a film renowned for its impressive visual effects, instead takes the easy route of overloading each scene with CGI and badly rendered animals, including a very fake looking cat. Additionally, del Toro's signature style seems like a mixed bag here, keeping that dark fantasy tone while also including scenes that would be too frightening for most young children. That's not to say the 1990 film didn't have its fair share of scary moments, but most of them were brief, whereas this time the camera would often linger on the fearsome appearances of the witches enough to burn their images into one's mind. Something like this may be fine for del Toro's other films aimed at adults but seeing as this is supposed to be for kids it comes across as unnecessarily mean-spirited.The film's one saving grace was Anne Hathaway's performance as the Grand High Witch. Almost equalling Anjelica Huston before her, Hathaway brings so much over-the-top madness and eccentricism to her role that one can't help but laugh at seeing her lose herself playing this cartoonishly evil character. She easily overshadows the rest of the cast, which isn't really a good thing the more I think about it. While all of the other actors aren't terrible by any means, they just didn't leave as much of an impression as their 1990 film counterparts. Rather strangely, the film is narrated by Chris Rock as the older hero boy, which made the film feel as though I was watching an episode of the sitcom ""Everybody Hates Chris"". Even though that did offer some mild amusement, it still seemed like a bizarre creative decision that made me forget I was supposed to be watching a Roald Dahl story in the first place.In the end, I just don't see this film being anywhere near as fondly remembered as the 1990 one. The very fact that I am able to recall so much of the original off the top of my head despite having seen it so long ago whereas with this one I am struggling to think of even one memorable scene goes to show which of the two has the most staying power. Roald Dahl rather infamously hated nearly all film adaptations of his work so it's hard to say if he'd approve of this one, but considering that it does accurately follow certain parts of the book more closely than its previous incarnation makes me think he would probably enjoy this one more. Personally, I'm going to stick with the 1990 film and so should you.I rate it 5.5/10"
439,"Absolutely NOT a movie for children. 15+ I'll say. Nice cast, bad acting. Nice decor and clothing, but that is only one thing that was really creative in this movie. I heard one word that was a bit Norwegian-like. The rest was Russian! Anne Can Do Better. Everyone can do better. Maybe, just maybe don't make remakes?"
440,"I grew up with the original Witches and I was looking forward to this remake (and I never look forward to remakes). The previews looked great - I liked that they mixed up the storyline a little by changing the setting, adding in new characters and changing the approach. I really like Anne Hathaway, and she was certainly the standout in this rendition, but that might be all I can say for it.The movie started out well. I liked the way they introduced the characters. I think updating the witches and the setting of the story was smart - it was a great way to reach a broader audience. I also liked how they showed the bond between the central two after the loss of his parents/her daughter. It was sweet and the young man in the movie was doing a great job, definitely a talented young actor. But the movie took a nose dive as soon as Grandma started talking about witches.Turning Grandma into the backstory, authority on witches, and moral compass was a huge mistake. I realize that getting Octavia Spencer in probably required a larger role, but this was ridiculous. I didn't mind that she had her own story about them, honestly. But she just kept yammering on (in many scenes, about all things) - it made the movie drag and removed a lot of plot discoveries. She spelled everything out and it really took away the magic of Roald Dahl's story. Even the 'will they make it' moments were destroyed by their existing knowledge from grandma. She knew way too much about the witches and magic in general, which is not really well explained (other than being a voodoo priestess, maybe). Her character was terribly written and played way too large of a role.Still, I was prepared to come on here and say watch it, you might think it is OK if you like this style of storytelling. I was even prepared to give it a middle of the line grade. While boring, they did really recreate this, rather than try to duplicate the original. I was happy to look past poor graphics and CGI (the budget for which was clearly thrown into the cast). I thought, someone will like this well enough. Then, they did something ridiculous...They don't change back! You have a young boy who is happy to live maybe 9 years as a mouse, no 'good witch' to fix the situation, and everyone is just cool with the fact that Bruno's parents are going to pass on him if he is a mouse. The ending they created just destroyed anything positive you could say up until this point. Every choice was bad (aside from chasing after all the bad witches). Just one wrong move after another to end the movie. I am quite sad to write this review, but I think a lot of people are going to be disappointed with the film."
441,"Ok, first the good things about the film...
1. Octavia Spencer. Hilarious. Just hilarious.
2. Kirsten Chenoweth adds a certain Southern charm and in my humble opinion, a welcome addition to the cast of characters.
3. Chris Rock as the narrator. He normally gets on my nerves a tiny bit but I thought he was perfect in it.
4. Stanley Tucci can do no wrong in my eyes. Even when his willy is being bitten by a rat.Ok, now let's address the glaringly obvious flaws of this film...
1. Anne Hathaway. No she was never going to measure up to Angelica Houston but to fall this short is a travesty. Her accent is absolutely disastrous and that's not the worst of it. She TOTALLY overacted and brought absolutely NO class to the role of the Grand High Witch.
2. The CGI. What the hell were they thinking?! Again, totally overdone and unnecessary. Surely they could have got a trained cat for goodness sake.Overall, I thought it was enjoyable. I enjoyed the first one for different reasons. But I still enjoyed it."
442,I don't understand all those bad comments. I think it is a good movie. I enjoyed watching it. It was fun.
443,"I am rating it 4 stars only because behind what I saw, I imagined other versions that could be far better than this one. I haven't seen the original version nor I haven't read the book, but I see that this movie lacks a lot! It lacks proper dialogue, interaction etc. The only character I loved was the grandma. I loved the kid, he did the best, but not for too long. Chris Rock's voice was so annoying, it made the whole plot sound ridiculous. My expectations were much higher when I saw Anne Hathaway is going to be the Grand Witch. Her acting was okay, the makeup was just stupid. Why did the witches have to be so fashionable I don't understand. Concerning the witches, they barely had a say during the entire movie. The CGI was unbelievably poor. It felt like this movie had too many unfulfilled deadlines, so they had to wrap things up as soon as possible to release it on the due date."
444,"I remember my kids loving the original, but I found this a little darker and probably not suitable for younger children. It was amusing but decayed a little into slapstick halfway through. The animation's good, but Anne Hathaway is no Bet Midler. Should still keep the kids entertained enough though, and maybe parents who haven't seen the original. That's the problem with remakes, the deck's stacked against them from the start if the original was a decent film."
445,"If you're thinking about watching this because Guillermo del Torro was involved and you're expecting gruesome horror, then walk away. This is definitively a family film. Some scenes are extremely childish, as they should for a family movie. As long as you don't watch it under false pretences it's a fun and cute movie."
446,"Ive read the book before and loved it, but this was just so disappointing. Parts were entertaining and anne hathaway was great in it but it just didnt really go anywhere and i only kept watching to see her. It wasnt funny, and then on top of all that they had to put in a fat english kid that was just so annoying throughout the film. A fun film for kids but just could have been so much better."
447,"Basically, it's exactly the same as the first, but with better CGI. Although the original even without the CGI was streets ahead of this one.It was scarier, the acting albeit wasn't great but again, better than this one.
Children probably won't give the old witches the time of day due to it's age, and as they have nothing to gauge against, they will however enjoy this film.Kids will like it, adults won't be bothered."
448,"I actually enjoyed Anne Hathaway.
I guess they want to stick with the original book ending. Because in the book he does not turn back human. In the book they even accepts the fact that he's a mouse and is probably going to live for the next nine or 10 years.
So that's why they gave you a happy ending in the 1990 film.
I was watching this version and like OK there is no witch that honestly feels bad about this. All witches are evil And all of them are turned into mice. So wouldn't you know it none of the kids turn back to human. Bruno parents don't even want him anymore.
That really bothered me."
449,"It amazes me how many people in these reviews think this is a remake of the original movie. The original was based on a book. This is based on a book. This is a movie adaptation of a book, not a remake of a movie. And the original, as great as it was, is also not particularly faithful either. Regardless, comparing differences between this and the original movie is pointless and, in my opinion, stupid.That said...The movie is still mediocre at best. It's also not a particularly good adaptation of the book. Nor is it a good remake of the original movie. It wasn't the worst thing I've ever seen, a lot of the people giving it 1's are clearly just salty and have no idea what a 1/10 movie is really like and are stuck on the original (I suggest Birdemic for a 1/10 movie), but I don't see myself recommending this to anyone any time soon either.The fact is, it's not a good book adaptation, the original movie is both more captivating in the way the plot unfolds, the puppets are in my opinion far scarier than the CGI, and while the actors were all pretty good for the most part, I'm sorry but they just can't compare to the original's who were almost born to play those roles.And To be clear I could care less about them casting black actors. I'm not at all opposed to this. But I'm sorry, Chris Rock was not a good choice for narrator. Especially if you are a grown up who grew up with the real Chris Rock. It just doesn't work. There were much better choices for this movie. It seems SO forced. Like Will Smith singing Arabian Nights.Disappointing to say the least but for a cheesy one time Halloween flick for people who love Halloween movies I guess there's worse out there..."
450,"I never saw Anjelica Huston's version, which according to IMDB has a 7 rating.
This movie doesn't seem bad to me, just a movie to spend the afternoon, maybe it should have gone straight to Streeaming or DVD, Octavia Spencer very much in her role.
Anne Hattaway doing the best she could, the script does not give much, perhaps Zemeckis and Del Toro, should have put a little more emphasis on the story, than on the characterization of the witches."
451,"Well this goes down as one of the most useless remakes of the last years. I am not sure why a creative mind like Robert Zemeckis wasted his time on a project like this. I know he is often hit and miss but lately more miss than hit.
The original film starring Anjelica Huston gives us a much deeper insight of the story and is not as superficial as this one. It is funny and sad in a way and has a much better ending ( not sure what the ending in the book is, but this one was really unsatisfying).
Anne Hathaway is really bad. She really overdid it and overacts her role to death. And while I generally really enjoyed the effects and male up work in this film (one of the better aspects) why did she look like a female Venom? Octavia Spencer tried her best and she did have some fine moments but was just too cute and nice for he own good at times. But still one of the better aspects of the film. Stanley Tucci was painfully wasted. He tried to give his character a bit irk but yeah, was mostly forgettable. The score was ok, the look was fine but thats about it.
A huge disappointment regarding the enormous talent that was involved with it."
452,An entertaining movie. I haven't watched the original or read the book but I found it quite good. Octavia and Anne are amazing.
453,"I knew that there was no way that Robert Zemeckis's version of Roald Dahl's book would equal Nicolas Roeg's version. The setting in 1960s Alabama should've made for a broader focus on racial issues.Nevertheless, you gotta love Anne Hathaway's performance as the Grand High Witch, talking like Natasha on ""Rocky and Bullwinkle"".Basically, if you expect nonstop silliness from this version of ""The Witches"", you won't be disappointed. I do hope that Zemeckis's next movie is something more along the lines of his first movies, though."
454,"It was a relatively enjoyable flick, however, had I paid to see it, I would have been disappointed. Anne Hathaway held up her end very well, though at times her (Russian?) accent occasionally caused us to ask one another on a few occasions,""What did she say?"" The CGI's were the only true disappointment. Some scenes were done relatively well while others came across looking very dated (think,"" Who Framed Roger Rabbit""). Had this not been 2020 and true theatrical releases all but gone, I would expect this to go straight-to-DVD, again, mostly due to the production value."
455,"Like Willy Wonka, this remake feels unnecessary, uninspired and replaces really storytelling with mediocre CGI. Sadly, Anne Hathaway just cannot inspire the same innate fear, as her predecessor Angelica Houston."
456,"I found excellent entertainment. well executed, magical and funny. people always expect to see FÃ¡tima's third secret, instead of just relaxing and watching a movie. Anne Hathaway looks great in her character."
457,"A young wannabe witch from the Midwest gets more than she bargained for when she moves to New York to become a full time professional witch and ends up as assistant to a tyrannical, thundering editor-in-chief of Witches Weekly magazine. Hilarity ensues..."
458,"The original was great. It was magical for both adults and children. On the plus side this visually is wonderful and Anne Hathaway and Octavia Spencer are magnificent. The problem lies with the execution which looses much of the magic. While it's worth watching, it won't be a repeat viewing like the original."
459,"The laughs that were delivered were good and worth the time spent watching this remake of a great film that I enjoyed so much. Unfortunately, this time the heart wasn't in it. Wish they had taken the time to given it some resuscitation. I really didn't enjoy the ending as even though there was some sadness in the original, at least it afforded the grandson and the other kids a happier ending. Some folks always give Ann Hathaway a hard time when she is given a roll that waxes theatricallly, however, that is exactly why she is so funny. She had a total field day making use of her special effects and such. She is a funny lady so give her a break."
460,"Great movie and remake to a classic. There's no replacing to Angelica Houston. Did like the story line and different take to this classic.
I have to admit Chris Rock narrating ..... worst decision ever. He voice is to annoying and wasn't a good match."
461,"Everyone has different opinions.
If you wanna watch this movie, just watch it.
Don't read other reviews."
462,"Anne Hathaway embodies the role of Melania Trump!Joking aside;
Good family film based on Roald Dahls Â«HekseneÂ»"
463,"Great acting from Octavia and Anne (it's a kids movie so I was t expecting serious acting, Anne made a fun villian). Really good music too. No it is not an exact replica of the original, which if I wanted to watch the original I would just watch the original. The story was good kept me and my children interested from start to finish. The transformations were were my favorite."
464,"I enjoyed it very much, especially getting to relive one of my favorite movies from my childhood, but as hard as Anne Hathaway tries, she just can't hold a candle to Angelica Houston. She does do a very good job though. It's essentially the exact same storyline, but instead of Angelica Houston as the grand High witch, it's Anne Hathaway, and instead of Mr Bean (A.k.a. Rowan Atkinson) as the hotel manager it's Stanley Tucci. I remember the part where she turns into a wedge and turns the kid into a mouse as one of the most terrifying experiences of my childhood. This version doesn't exactly do you as well in that department, but maybe it's geared towards an even younger audience. Remember our twisted 80s movies used to be even for kids? They just don't do that anymore."
465,"Funny, a little scary and great performances all around. These adult babies writing negative reviews are writing them from an adult perspective. Not the target audience. Also, most of the critiques are not in the spirit of Roland Dahl."
466,"It's a decent movie. I still favour the original from 1990, but this has plenty of funny moments for sure, I enjoyed it."
467,"How anyone could have the gall to try and remake a movie that had an iconic performance by an iconic actress is beyond reality. Everything about this stink to high heaven!! Anne Hathaway is an overrated actress and she shows it here, she has to be compared to the incredible Angelica Houston who nailed the role if the grand high witch. It's like trying to redo hannibal or beetlejuice some roles are so iconic they cant be copied . This is a disaster and Anne Hathaway was HORRIBLE, and her accents were atrocious. STAY AWAY!!!!!!!!!"
468,This was great fun for the kids. Octavia Spencer did a great job and Anne Hathaway was terrific also.
469,It was fun informative and funny surpassing the its predecessor i loved it all kids will love this but not racist they won't
470,"Honestly 1* reviews are idiotic it anyone says this is the worst thing they've ever watched they have had an easy life, I'm all for nostalgia and old movies being ruined I get that but to act so stupidly to bombard a film with 1/10 is dumb. I'd respect 3/4/5 with valid reasons but its just people crying over a book and thirty year old film.The film is good it's entertaining goes quickly, well acted and good cgi, the accents are a bit off but Anne hath away is great in this people seem to give her unfair hate. Honestly watch it, it's not perfect but it's a good enough film in its own merit"
471,"The movie held a sense of humbality whilst keeping the still very frightening concept of a modern witch. I liked how more linear the movie was in comparison to the older version and not just full of random movie fodder. I miss the live action and puppet mouse fx the original had but still thought everything the movie harnessed was proper and on point. I also appreciate the dominant change in minority actors in this movie. Adding a lot of dynamic and homely love to the entire story.
I almost feel people disliked this movie because of the amount of color in it. See the movie, it's good.."
472,"I loved this remake. As a devote Roald Dahl fan, I was nervous it wouldn't meet my expectations. It veered from the book quite a bit but I found it refreshing! I've read the book many times to my kids so we were pleasantly surprised with the remake. The meeting scene was a bit scary for my younger kids but it was very entertaining. Anne Hathaway was perfect for the role of the Grand High witch. LOVED IT!"
