,0
0,"I thought the cat CGI was inconsistent and Anne Hathaway's accent all over the place. Sometimes she's Russian, Scottish and Swedish. It's hilariously bad."
1,"What the F... is Going on? Im a norwegian, and one of the best things about the original, is that the beginning is set in norway. Bergen. The story about the girl in the painting. Dahl had norwegian parents, so i really love the beginning of the original.Why do the keep making terrible remakes of really good movies? The make up in the original is far surperior to the terrible CGI in this movie. If you check out the drawings in the book, the Grand witch is way off in this movie. The CGI is more like the Scorpion King.That someone in the comments gave this movie 7-10 is just nuts. So incredible bad"
2,"Do not waste your time just watch the classic original which still looks anazing today 30 years later , mainly cos of the acting and practical effects and because it was so darn sinister for a children's movie .Anne Hathaway cast as the grand high witch is a massive miscasting if their ever was one , her supposed german accents goes from russian to Scottish all in one sentence .Who the hell thought choosing second rate CGI effects over animatronics and make up clearly is missing the point on what made the original movie so iconic and scary , the CGI mice were like someat a student at film college could of made on some free app on android... Octavia Spencer was so over the top camp , Chris rocks voice over was overly excited considering he is narrating a story that is about evil withches and the danger they pose towards children ..The whole film was so badly miscast it makes showgirls look like pride and prejudice, Hollywood u have to stop now remaking classic movies , come up with some new ideas and make new movies diverse. We do not need to erase iconic movies from the past just to tick the diversity quota , make new movies new ideas and just be diverse ....Anne Hathaway really should be kept away from icnonc roles like this. It's actually angered me at how bad this film is. Enough already"
3,Total tripe from start to finish. The only one good thing about this movie is Anne. The CGI is shockingly bad and cartoonish. A British story set in Britain that's been Americanised and therefore completely ruined. Hideous doesn't even come close to describe this movie.
4,"The remake has no story line, no emotional connections to the characters. Nothing compared to the original and yes you should be comparing. The only good actress in this film is Anne Hathaway who did alright. The director should be ashamed. What a waste of money and talent. I'm going to go have some Cress soup and enjoy the rest of my night watching the original version. More talent in just the pinky of that movie."
5,"This re-make of the witches is very short and very simplified from the original adaptation of the film. The cast doesn't seem entirely engaged in their roles. Too much auto-tone and CGI used here to the point that it's not as effective as one might hope it to be. Very bland sets and much smaller scale compared to the original version. Ultimately, this is just another bland Hollywood low budget re-make film."
6,This was horrible I can't believe they would remake this amazing classic and cast Anne Hathaway at the grand high which. No offense to her she's an OK actress but this was not a role for her. This was Anjelica Huston's part it's like could you imagine anyone else playing Morticia Addams? And also no offense to Chris rock but the narration was no Bueno
7,"The Grand High Witch is killing it. but seriously, she's terrible.
From the start on, with the weird Chris Rock voice-over, this remake goes wrong wherever it can wrong. The acting is stiff, the focus is hardly on all the other witches, the CGI is not good. Even the housekeeping cart seems to come from the CGI box. Positive thing: Octavia Spencer is doing her best to be a genuine grandmother, and she succeeds, but that's about it.
OK, yes, I am a fan of the 1990 movie. Even though it wasn't as close to the original story, I really can't believe Roald Dahl would recognize his book in this mess. The first movie was gorgeous in it's authenticity. It has folklore, it has an edge, it has a heart. This is Hollywood factory work and seems to want to be much more than it can deliver. It made me miss much more than the purple glow in the witches eyes. It made me want to just throw up like a witch who smells children.
I'm not saying you shouldn't watch it. I am sure that an entire generation who never grew up with the original will disagree, but to me, this is like cursing in a church. It's horrible."
8,"This whole movie is a mess! The cast all seem very dis-interested in their roles. The plot is a shot by shot re-make of the original and overall, I don't feel like there is any spirit or enthusiasm in this project at all! Don't recommend at all! Skip it and watch the original more engaging version of the film!"
9,"There is going to be a lot of unemployed actors in Hollywood, very soon.Is there anyone left who understands the public mood?"
10,"I love Octavia and Anne, but this movie seems like it was rushed and that they were just phoning it in.To begin with, the original is a cult classic, so how dare you mess up with it. Then, if you are gonna do it, well, do it well. They were clearly going for a kids friendly movie but I mean, this story is creepy. The mouse animation takes you away from it, specially coming from Henson's animatronics. The Great Witch reveal is underwhelming, and the changes/additions to the story don't serve it. It just doesn't adds up.It pains me that Cuaron and Del Toro are attached to this project as producers. Zemeckis seems to be going in decline and it just sucks. Dahl's fans may be happier with this ending, but with all the other changes I dunno how they can be happy with the movie in general."
11,I just don't get it??? Why do producers think it's a good idea to re-make an already fabulous movie????? WHY???? Why not remake a movie that should have been good and wasn't!?
12,The original was better. They should of just left this movie alone all together
13,Anne Hathaway can't hold a candle to Angelica Houston and neither can the rest of cast against their 1990 counter parts. Zemekis's direction is bland and unimaginative. Avoid.
14,Worst remake so far. Don't waste yours or you kids time. Just watch the original
15,"Some 80s and 90s family movies look incredibly cheesy and bad compared to modern releases... Well, now we have the opposite! The 90s adaptation is a masterpiece compared to this. It's incredible how many talented people worked on this mess. The cringiest thing about it is Anne Hathaway's accent, which jumps from Russian to German to Swedish, and it's never funny because she's trying too hard.
There are many other talking animal movies that your children will enjoy, spare them, and don't succumb to the voice in your head asking ""how bad can it be?"". IT'S REALLY BAD."
16,"What they end up doing in this movie makes the film less of a movie and more of a commercial for something stupid , if you see the film you will know what I'm talking about. It was cute and fun. But NOT at all a good movie nor a classic. It's barely considered a movie. Not sure what audience this movie would even appeal to. I would skip this and either read the book or watch the original movie instead. Not worth the time!!"
17,"I've not written a review before on here, but I felt compelled to after sitting through this film and wasting Â£15 for the privilege!
I didn't understand why they had to remake the witches, the original felt authentic and was engaging and fun. The grandma and little boy made a great team and you rooted for them! This one was boring in places, all the actors (except Octavia Spencer) were dreadful, the little boy especially! And Chris Rock as the voice over was annoying, at times you couldn't hear /understand what he was saying!
My children found it frightening, the way Anne Hathaway's mouth opened with those teeth and her extending arms was very much like the clown from IT and the CGI was so obvious. And what accent was she supposed to have? At times it was Scottish/Irish and some kind of Eastern European!!?
I wouldn't recommend it, stick with the original!"
18,"Terrible. The witches are pathetic, the original had over twice the amount in the hotel. Anne Hathaway WISHES she has the poise, energy and even the accent."
19,Nothing new nor exciting here at all! Makes sense why it's free to watch with hbo max subscription! Terrible re-make of a classic! Don't even waste your time!! BOO!
20,Again I ask...why?! Why God why?!?! These extra words are because my review is too short. How long does it need to be because there is nothing else to say about this basura. And just in case that is spanish for trash so if you do decide to watch it...you've been warned.
21,"So I wanted to like this and had some hopes for it, but it honestly fell pretty flat. I even thought that with actors like Octavia Spencer, Stanley Tucci and Anne Hathaway that it might be saved, and they were great in their roles as far as remaking/re-imagining movies go. But even with that, the grandmother is sort of a rehash of Spencer's character Minnie from The Help, Stanley Tucci hardly gets ANY screen time or character development, and Hathaway, while nailing so many of Angelica Houston's mannerisms, is still a bit overdone on her character. But also the remake lacks the character/story development, decent plot, dialogue and even the action and tense scenes from the original. And the transformation scenes (minus the one in the beginning which I thought was a good add) were extremely short with bad CGI. Overall, this was no improvement over the 1990 version, and not different enough to be all that good."
22,"Well, it seems any of these days someone in the Louvre Museum will paint Mona Lisa's face....Michelangelo's Davis will wake up missing a part of its anatomy... I have the impression that any of these days, people will start burning books, or that it will be acceptable to destroy any piece of art, literature and even scientific advances that does not conform to some form of acceptable collective thinking.The funny thing is that these remakes are, without exception, unimaginative toothless messes when compared to the originals.CanÂ´t writers and directors come up with original ideas?"
23,This film is barley considered a movie... nothing more than eye candy. The film is not engaging enough for kids and not Sophisticated enough for adults. Not sure what audience it targets. Too main stream and actually kind of boring at parts! Don't recommend at all!
24,This was one of my favorite stories growing up. The old movie was not the best but good enough for the technology they had back then. I always dreamed of them remaking it! But lo and behold this was terrible. Everyones acting sucked and there was no good direction nor good effects. The cgi of the old film was actually better. Ahh they ruined it for me! Please don't pay to watch this movie.
25,"Yes you'll always have the the original movie or book were superior crowd no matter what but you have to give a movie a chance to be good, this falls short in a few ways imo. Firstly way too much too much attention is paid into the special effects without much focus on anything else.My gripes, the grandma, she's very cold at the start, doesn't fill you with the same sense of comfort the original grandma in the 1st mobiedid.Brunos parents, in the original movie you had a bit of dialogue from the father which gave you a sense of what type of person he is, this movie basically did nothing to create any type of other characters apart from the main onesThe hotel manager, in the original movie he was a bit of a snivelling stuck up so and so whos character you started to hate but he redeemed himself at the end, in this one the manager just looks confused and has no redeeming qualities at allAll in all a disappointment, the original set itself as a very dark childrens film where as this one was more focused on trying to be too dark than actually being so and just looked comedic at gimes, a shame because the story itself has so much potential"
26,"Just watched the remake of Roald Dahl's The Witches. It had so much potential but unfortunately falls flat with its over use of awful CGI effects. One for the kiddies but if you're a fan of the original classic, stick to it. Not even Anne and her terrible accent could save this toned down version!"
27,This film has too many messages and signs of racism present. I don't recommend this adaptation of the Roald Dahl story at all for the lack of creativity and political messages present. I prefer the 1990 classic family film. Skip this new adaptation!
28,"I'll admit that I had little to no hope for this one to begin with, at the risk of sounding like an old man drinking from a hip flask and muttering at innappropriate moments 'I miss the good old days.'Never before has that been more applicable than now.Lets begin with the goodit isnt a long movie.I guess that's it!Now for the bad!The addition of CG when used properly is seamless and adds an extra layer of depth to an already decent idea. Unfortunately as is the norm these days CG is used at the drop of a hat (or wig) because its simply the easier option. Remember the terrifying grand high witch transformation from the original film? now its a question of forget prosthetics or excellent makeup, or even excellent acting actually. You wont find it here!The CG snake was needless and looked awful, hire a real snake or use one of the crew members' pet snake, cheaper, easier and realistic. SIMPLE!The most irritating thing about this movie from the beginning is that it lacks any subtlety at all, which unfortunately makes it all completely unbelievable. If witches were obvious-and every single witch in this movie parades around with the subtlety of Donald Trump-then they would be easy to spot. Sometimes less is more, what you dont see can be infinitely more horrifying.The above bits are the least of this movie's problems. Now I am mixed race and love a cultural nod as much as the next person but again a little subtlety would be nice, yes the main characters are black and no problem with that at all in fact I welcome the change, however I dont need to be given a stereotypical view of a black family, We dont all like motown, we dont all like southern style food, i mean what was with that room service scene!?!?!? All it was missing was a sign saying Stereotypical Southern Black Woman's Order' , Please get away from this one size fits all model because its old and tired.Movie is set in the US, why? What was the point of doing that? Story is unchanged regardless of where it takes place but what difference did changing the setting to the US actually make? Other than filming it in America because it was convenient I cant think of any other reason for this.The actingOctavia Spencer is great I love the lady but shes the only good thing here.
Stanley Tucci plays the same character he plays in everything, the quirky one, it works for him and thats fine.
The kids are terrible and very irritating, at least the kids in the original had some likeability.
Anne Hathaway is awful, bad accent, hammy and just a farce overall. Very much a paint by numbers portrayal of the bad guy, clichÃ©, robotic, silly really and not in a good way.I touched on it earlier but why is EVERYTHING CG!?!?
The terrible mouth of the Grand High Witch, the terrible CG mice, The transformations were pathetic and we had a CG wooden log!!!I ask you WHY!?Skip this Hammy dumpster fire"
29,"An awful lot of grumpy reviewers here.. Yes it's animation is a bit Stuart little/cartoony, and Anne Hathaway's accent is all over Europe.. but as remakes go it's well thought out and just plain Dahl-esque magical fun!I really enjoyed the 60's Deep South reimagining of where the story is set, and octavia spencer is always good as a sagely and wise older figure. The story is similar enough to be considered a remake, but the minor differences keep it interesting!It's been given the Hollywood treatment for sure, so it's far glossier/more polished than the original, but having just watched them back to back, unless it's just nostalgia you're after, then that's no bad thing I promise.Overall the quality of the story itself shines through, and if you just want to have some fun watching it then you will certainly do just that.If you're looking to review it for Oscar-worthiness then maybe reassess your expectations, chill out and grab a drink. It's a fantasy film people. Let the fantasy breathe!"
30,Awful.... why remake it the first one was great... the special effects are too much and take over the movie and they aren't actually that great.Don't watch this... enjoy the first one again instead
31,"""The Witches"" misses opportunities and makes me wonder why director Robert Zemeckis continues to make mediocre films. Take a break, Zemeckis.In this fantasy film set in 1968 Alabama, an orphaned young boy stumbles across a conference of witches while staying with his grandmother at a hotel. Based on the book by Roald Dahl.Aside from fun performances from Anne Hathaway and Octavia Spencer, ""The Witches"" relies too much on CGI, which in my opinion is making movies worse with every use. What happened to getting a real cat in a movie? Is it really about animal rights or more because Hollywood doesn't want to train an animal to sit on Anne Hathaway's forearm? Chris Rock as the narrator was a nice touch and the highlight of the film. Overall, I think Robert Zemeckis should take a break from making movies to find his groove again, because right now it's getting tired.Follow @snobmedia for all reviews!"
32,This film is a snooze and looks cheap and poorly made. Acting is bad and mediocre. Don't recommend it at all!
33,"Terrible, boring, and dull re-make of an already simple and stupid film and story. Don't recommend it at all, I suggest to watch the original version instead ! This terrible trash re-make is a waste of time!"
34,"Everything was being cool, until Anne's really exaggerated performance, maybe another actress would have been better choice"
35,The Witches had the potential to be an entertaining movie due to Anne Hathaway and Olivia Spencer but it is way too simple with lazy writing and in my opinion it has one of the worst endings seen in a film.When the parents of a boy are killed tragically in an accident in 1968 he ends up living with his grandmother who tells him that witches are real and are not even women but demons. They go to a hotel in Alabama and they have the misfortune to be there at the same time as a witch coven gathering. The witches have a plan to turn all children into mice and eliminate them. They turn the boy into a mouse and he together with two other children who were turned into mice and his grandmother had to defeat the coven led by the high witch. They do this by feeding the witches the same potion that was used to turn them into mice and it ends up turning the witches into ugly looking rats. And then they leave with a huge pile of money and potion and a list of all witches in the world and plan to turn them into rats as well. About 45 seconds is spent trying to turn the children back into their human form and then they shrug their shoulders and say well it's ok beeing a mouse. The boy even asks how long mice live and the grandmother says that regular mice live three years but that they might live three times that which is ok with the boy who is happy he won't have to go to school and they can die together. The grandmother doesn't seem to be too bothered either which is strange to say the least since the indication is that none of these poor children will see past their mid teens but at least they can have fun with all the money. And then they show us a scene 11 years later with an aged mouse talking to children and sending them out on a mission to eliminate witches. Obviously someone was not good at math since 1979 is about two years past the mice life span according to the film.Another issue is why does the potion work on witches who are not even human? Why doesn't the grandmother try to find an antidote when she captures the head witch instead of feeding her to her cat familiar. In the beginning it is said that a witch gets the same pleasure from squashing children as a normal person would from eating ice cream. And then 25 minutes later it is said they hate the smell of children since children smell like dog poop... soooo....dog poop ice cream that they get enjoyment out of squashing. Someone should have read through this script more. The good things are the effects and the adult actors although Anne Hathaway changes her accent throughout the movie. She was still entertaining but not enough to improve this movie which has a terrible ending. A 3 out of 10.
36,"What was this? There's complete no plot or storyline in this movie. Characters are just nowhere or without existance. An hotel that is empty of people, where is everyone? The high witch is the only one who talks or acts in this movie from the rest of the Witches group, the rest are just robots. I don't know who approved the script for this remake but should be fired inmediately. Where is the makeup? Where is the evilness? Where is the Witch? Both kids have more personality while they are mice than humans. When they are in human form they are so lame. But as mice they are cometely different in form and intentions. This is just trash."
37,Like Through the Woods and Cats this is another waste of time. So annoying I had to turn it off not even mid-way.
38,Was not worth the watch. What is up with the scars on their faces the point of the disguise is to not be able to recognize the witch without looking into their eyes if they're trying to remake the movie exactly as the first one which it seems like they are. Anne Hathaway is a great actress and they have a making a fool of herself with this accent . There are many other things with this movie wrong just skip this whole movie and watch the original this is not worth the watch!
39,"I really wanted to like this movie, I had high hopes after finding out Anne was cast. But it just failed in every aspect, weak clichÃ© punchlines, terrible CGI for 2020, and most importantly no connection to the characters."
40,"I wanted to like this, the original adaption is one of my favourite films since first watching it as a child, however, this remake is a low budget CGI fest with cartoonish characters that rob the film of any potential to be scary or sinister. Forgettable with zero kindertrauma, they should have left it alone."
41,Way to ruin a British classic! And I say this as an American!
42,"What a shame, I think this one is another disaster of 2020"
43,"The original movie was fanatic it brings me so much nostalgia to watch it, I watch the new one it has some similarity but overall a complete different story really. In my opinion they over used CGI and the storyline was bland, what wrong with using Prosthetics like in the original. The story leaves you unfulfilled and not wanting more. Like many of the remake during the last few years it leaves a Sour taste in your mouth and you asking the question why?. Will these film producers instead of only think about making a quick buck, decide to make something new and with integrity, Their is plenty of source material, books, et. I think I speak for most people when I say if it not broke don't fix it"
44,"I don't get why everyone's calling this a remake. It's not a remake. It's another adaption of the book. I think people need to focus more on comparing the movie to the book rather than the 1990 movie. I will say that the 1990 movie was a lot darker and dramatic while this one is more comedic and light hearted but I never expected this to be a copy of the other movie since again, it's not a remake. Here are what I think are the pros and cons of the movie.Pros:Stayed more true to the book especially the ending, Anne's performance was amazing and I could tell she had fun with this role, I liked Daisy/Mary's story, the costumes were great especially the Grand High Witch's, loved the final battle feel between the grandma and the GHW, the beginning was really well done and emotional, loved the scene of the witches meeting especially the GHW's dialogue and the witches chasing after Luke, Mary and Bruno, even though she didn't have an unmasked form, I still liked what they did with the GHW's ""true look"" and still found it quite terrifying, loved Octavia's performance even though I felt that she was too young for the role.Cons:CGI was over the top, movie seemed a bit rushed, I didn't like the way the grandmother's backstory was played out, was confused as to why the GHW didn't have an unmasked form but I still liked what they did with it (I put that under both the pros and cons list because I was kinda disappointed but I still liked it), felt bad for Bruno's parents that they never got Bruno back, don't get why the main character is just labeled as ""Hero"" instead of Luke or some other name though I can't remember if he was given a name in the book.Overall, I think the biggest highlights of this movie was Octavia and Anne's performances and it staying more true the book than the 1990 movie did even though the time settings were different and they changed the races of the grandma and grandson but I don't mind that."
45,This movie feels very slow and stupid to the point I no longer have any interest to watch nor care about the characters or much or the story at all! Skip this in-interesting/ un-captivating CGI garbage! The original 1990 film is WAAAYYY better and more engaging film altogether. This film is too simplified and boring for me.
